No.     Time           Source                Destination           Protocol Length Info
      1 0.000000000    127.0.0.1             127.0.0.1             TCP      76     37888 → 8080 [SYN] Seq=0 Win=43690 Len=0 MSS=65495 SACK_PERM=1 TSval=3195450389 TSecr=0 WS=512

Frame 1: 76 bytes on wire (608 bits), 76 bytes captured (608 bits) on interface any, id 0
Linux cooked capture
Internet Protocol Version 4, Src: 127.0.0.1, Dst: 127.0.0.1
Transmission Control Protocol, Src Port: 37888, Dst Port: 8080, Seq: 0, Len: 0

No.     Time           Source                Destination           Protocol Length Info
      2 0.000011967    127.0.0.1             127.0.0.1             TCP      76     8080 → 37888 [SYN, ACK] Seq=0 Ack=1 Win=43690 Len=0 MSS=65495 SACK_PERM=1 TSval=3195450389 TSecr=3195450389 WS=512

Frame 2: 76 bytes on wire (608 bits), 76 bytes captured (608 bits) on interface any, id 0
Linux cooked capture
Internet Protocol Version 4, Src: 127.0.0.1, Dst: 127.0.0.1
Transmission Control Protocol, Src Port: 8080, Dst Port: 37888, Seq: 0, Ack: 1, Len: 0

No.     Time           Source                Destination           Protocol Length Info
      3 0.000019921    127.0.0.1             127.0.0.1             TCP      68     37888 → 8080 [ACK] Seq=1 Ack=1 Win=44032 Len=0 TSval=3195450389 TSecr=3195450389

Frame 3: 68 bytes on wire (544 bits), 68 bytes captured (544 bits) on interface any, id 0
Linux cooked capture
Internet Protocol Version 4, Src: 127.0.0.1, Dst: 127.0.0.1
Transmission Control Protocol, Src Port: 37888, Dst Port: 8080, Seq: 1, Ack: 1, Len: 0

No.     Time           Source                Destination           Protocol Length Info
      4 0.000094010    127.0.0.1             127.0.0.1             HTTP     339    POST /qos/rules/0000000000000001 HTTP/1.1  (application/x-www-form-urlencoded)

Frame 4: 339 bytes on wire (2712 bits), 339 bytes captured (2712 bits) on interface any, id 0
Linux cooked capture
Internet Protocol Version 4, Src: 127.0.0.1, Dst: 127.0.0.1
Transmission Control Protocol, Src Port: 37888, Dst Port: 8080, Seq: 1, Ack: 1, Len: 271
Hypertext Transfer Protocol
HTML Form URL Encoded: application/x-www-form-urlencoded

No.     Time           Source                Destination           Protocol Length Info
      5 0.000097508    127.0.0.1             127.0.0.1             TCP      68     8080 → 37888 [ACK] Seq=1 Ack=272 Win=43520 Len=0 TSval=3195450389 TSecr=3195450389

Frame 5: 68 bytes on wire (544 bits), 68 bytes captured (544 bits) on interface any, id 0
Linux cooked capture
Internet Protocol Version 4, Src: 127.0.0.1, Dst: 127.0.0.1
Transmission Control Protocol, Src Port: 8080, Dst Port: 37888, Seq: 1, Ack: 272, Len: 0

No.     Time           Source                Destination           Protocol Length Info
      6 0.002532736    127.0.0.1             127.0.0.1             HTTP     291    HTTP/1.1 200 OK  (application/json)

Frame 6: 291 bytes on wire (2328 bits), 291 bytes captured (2328 bits) on interface any, id 0
Linux cooked capture
Internet Protocol Version 4, Src: 127.0.0.1, Dst: 127.0.0.1
Transmission Control Protocol, Src Port: 8080, Dst Port: 37888, Seq: 1, Ack: 272, Len: 223
Hypertext Transfer Protocol
JavaScript Object Notation: application/json

No.     Time           Source                Destination           Protocol Length Info
      7 0.002603677    127.0.0.1             127.0.0.1             TCP      68     37888 → 8080 [ACK] Seq=272 Ack=224 Win=44032 Len=0 TSval=3195450391 TSecr=3195450391

Frame 7: 68 bytes on wire (544 bits), 68 bytes captured (544 bits) on interface any, id 0
Linux cooked capture
Internet Protocol Version 4, Src: 127.0.0.1, Dst: 127.0.0.1
Transmission Control Protocol, Src Port: 37888, Dst Port: 8080, Seq: 272, Ack: 224, Len: 0

No.     Time           Source                Destination           Protocol Length Info
      8 0.002865881    127.0.0.1             127.0.0.1             TCP      68     37888 → 8080 [FIN, ACK] Seq=272 Ack=224 Win=44032 Len=0 TSval=3195450392 TSecr=3195450391

Frame 8: 68 bytes on wire (544 bits), 68 bytes captured (544 bits) on interface any, id 0
Linux cooked capture
Internet Protocol Version 4, Src: 127.0.0.1, Dst: 127.0.0.1
Transmission Control Protocol, Src Port: 37888, Dst Port: 8080, Seq: 272, Ack: 224, Len: 0

No.     Time           Source                Destination           Protocol Length Info
      9 0.002943552    127.0.0.1             127.0.0.1             OpenFlow 172    Type: OFPT_FLOW_MOD

Frame 9: 172 bytes on wire (1376 bits), 172 bytes captured (1376 bits) on interface any, id 0
Linux cooked capture
Internet Protocol Version 4, Src: 127.0.0.1, Dst: 127.0.0.1
Transmission Control Protocol, Src Port: 6653, Dst Port: 53822, Seq: 1, Ack: 1, Len: 104
OpenFlow 1.3

No.     Time           Source                Destination           Protocol Length Info
     10 0.003004201    127.0.0.1             127.0.0.1             TCP      68     53822 → 6653 [ACK] Seq=1 Ack=105 Win=86 Len=0 TSval=3195450392 TSecr=3195450392

Frame 10: 68 bytes on wire (544 bits), 68 bytes captured (544 bits) on interface any, id 0
Linux cooked capture
Internet Protocol Version 4, Src: 127.0.0.1, Dst: 127.0.0.1
Transmission Control Protocol, Src Port: 53822, Dst Port: 6653, Seq: 1, Ack: 105, Len: 0

No.     Time           Source                Destination           Protocol Length Info
     11 0.003134274    127.0.0.1             127.0.0.1             TCP      68     8080 → 37888 [FIN, ACK] Seq=224 Ack=273 Win=44032 Len=0 TSval=3195450392 TSecr=3195450392

Frame 11: 68 bytes on wire (544 bits), 68 bytes captured (544 bits) on interface any, id 0
Linux cooked capture
Internet Protocol Version 4, Src: 127.0.0.1, Dst: 127.0.0.1
Transmission Control Protocol, Src Port: 8080, Dst Port: 37888, Seq: 224, Ack: 273, Len: 0

No.     Time           Source                Destination           Protocol Length Info
     12 0.003138127    127.0.0.1             127.0.0.1             TCP      68     37888 → 8080 [ACK] Seq=273 Ack=225 Win=44032 Len=0 TSval=3195450392 TSecr=3195450392

Frame 12: 68 bytes on wire (544 bits), 68 bytes captured (544 bits) on interface any, id 0
Linux cooked capture
Internet Protocol Version 4, Src: 127.0.0.1, Dst: 127.0.0.1
Transmission Control Protocol, Src Port: 37888, Dst Port: 8080, Seq: 273, Ack: 225, Len: 0

No.     Time           Source                Destination           Protocol Length Info
     13 0.020025801    127.0.0.1             127.0.0.1             TCP      76     37892 → 8080 [SYN] Seq=0 Win=43690 Len=0 MSS=65495 SACK_PERM=1 TSval=3195450409 TSecr=0 WS=512

Frame 13: 76 bytes on wire (608 bits), 76 bytes captured (608 bits) on interface any, id 0
Linux cooked capture
Internet Protocol Version 4, Src: 127.0.0.1, Dst: 127.0.0.1
Transmission Control Protocol, Src Port: 37892, Dst Port: 8080, Seq: 0, Len: 0

No.     Time           Source                Destination           Protocol Length Info
     14 0.020038702    127.0.0.1             127.0.0.1             TCP      76     8080 → 37892 [SYN, ACK] Seq=0 Ack=1 Win=43690 Len=0 MSS=65495 SACK_PERM=1 TSval=3195450409 TSecr=3195450409 WS=512

Frame 14: 76 bytes on wire (608 bits), 76 bytes captured (608 bits) on interface any, id 0
Linux cooked capture
Internet Protocol Version 4, Src: 127.0.0.1, Dst: 127.0.0.1
Transmission Control Protocol, Src Port: 8080, Dst Port: 37892, Seq: 0, Ack: 1, Len: 0

No.     Time           Source                Destination           Protocol Length Info
     15 0.020046878    127.0.0.1             127.0.0.1             TCP      68     37892 → 8080 [ACK] Seq=1 Ack=1 Win=44032 Len=0 TSval=3195450409 TSecr=3195450409

Frame 15: 68 bytes on wire (544 bits), 68 bytes captured (544 bits) on interface any, id 0
Linux cooked capture
Internet Protocol Version 4, Src: 127.0.0.1, Dst: 127.0.0.1
Transmission Control Protocol, Src Port: 37892, Dst Port: 8080, Seq: 1, Ack: 1, Len: 0

No.     Time           Source                Destination           Protocol Length Info
     16 0.020208199    127.0.0.1             127.0.0.1             HTTP     339    POST /qos/rules/0000000000000001 HTTP/1.1  (application/x-www-form-urlencoded)

Frame 16: 339 bytes on wire (2712 bits), 339 bytes captured (2712 bits) on interface any, id 0
Linux cooked capture
Internet Protocol Version 4, Src: 127.0.0.1, Dst: 127.0.0.1
Transmission Control Protocol, Src Port: 37892, Dst Port: 8080, Seq: 1, Ack: 1, Len: 271
Hypertext Transfer Protocol
HTML Form URL Encoded: application/x-www-form-urlencoded

No.     Time           Source                Destination           Protocol Length Info
     17 0.020212188    127.0.0.1             127.0.0.1             TCP      68     8080 → 37892 [ACK] Seq=1 Ack=272 Win=43520 Len=0 TSval=3195450409 TSecr=3195450409

Frame 17: 68 bytes on wire (544 bits), 68 bytes captured (544 bits) on interface any, id 0
Linux cooked capture
Internet Protocol Version 4, Src: 127.0.0.1, Dst: 127.0.0.1
Transmission Control Protocol, Src Port: 8080, Dst Port: 37892, Seq: 1, Ack: 272, Len: 0

No.     Time           Source                Destination           Protocol Length Info
     18 0.022996304    127.0.0.1             127.0.0.1             HTTP     291    HTTP/1.1 200 OK  (application/json)

Frame 18: 291 bytes on wire (2328 bits), 291 bytes captured (2328 bits) on interface any, id 0
Linux cooked capture
Internet Protocol Version 4, Src: 127.0.0.1, Dst: 127.0.0.1
Transmission Control Protocol, Src Port: 8080, Dst Port: 37892, Seq: 1, Ack: 272, Len: 223
Hypertext Transfer Protocol
JavaScript Object Notation: application/json

No.     Time           Source                Destination           Protocol Length Info
     19 0.023075973    127.0.0.1             127.0.0.1             TCP      68     37892 → 8080 [ACK] Seq=272 Ack=224 Win=44032 Len=0 TSval=3195450412 TSecr=3195450412

Frame 19: 68 bytes on wire (544 bits), 68 bytes captured (544 bits) on interface any, id 0
Linux cooked capture
Internet Protocol Version 4, Src: 127.0.0.1, Dst: 127.0.0.1
Transmission Control Protocol, Src Port: 37892, Dst Port: 8080, Seq: 272, Ack: 224, Len: 0

No.     Time           Source                Destination           Protocol Length Info
     20 0.023360117    127.0.0.1             127.0.0.1             TCP      68     37892 → 8080 [FIN, ACK] Seq=272 Ack=224 Win=44032 Len=0 TSval=3195450412 TSecr=3195450412

Frame 20: 68 bytes on wire (544 bits), 68 bytes captured (544 bits) on interface any, id 0
Linux cooked capture
Internet Protocol Version 4, Src: 127.0.0.1, Dst: 127.0.0.1
Transmission Control Protocol, Src Port: 37892, Dst Port: 8080, Seq: 272, Ack: 224, Len: 0

No.     Time           Source                Destination           Protocol Length Info
     21 0.023410158    127.0.0.1             127.0.0.1             OpenFlow 172    Type: OFPT_FLOW_MOD

Frame 21: 172 bytes on wire (1376 bits), 172 bytes captured (1376 bits) on interface any, id 0
Linux cooked capture
Internet Protocol Version 4, Src: 127.0.0.1, Dst: 127.0.0.1
Transmission Control Protocol, Src Port: 6653, Dst Port: 53822, Seq: 105, Ack: 1, Len: 104
OpenFlow 1.3

No.     Time           Source                Destination           Protocol Length Info
     22 0.023415034    127.0.0.1             127.0.0.1             TCP      68     53822 → 6653 [ACK] Seq=1 Ack=209 Win=86 Len=0 TSval=3195450412 TSecr=3195450412

Frame 22: 68 bytes on wire (544 bits), 68 bytes captured (544 bits) on interface any, id 0
Linux cooked capture
Internet Protocol Version 4, Src: 127.0.0.1, Dst: 127.0.0.1
Transmission Control Protocol, Src Port: 53822, Dst Port: 6653, Seq: 1, Ack: 209, Len: 0

No.     Time           Source                Destination           Protocol Length Info
     23 0.023538725    127.0.0.1             127.0.0.1             TCP      68     8080 → 37892 [FIN, ACK] Seq=224 Ack=273 Win=44032 Len=0 TSval=3195450412 TSecr=3195450412

Frame 23: 68 bytes on wire (544 bits), 68 bytes captured (544 bits) on interface any, id 0
Linux cooked capture
Internet Protocol Version 4, Src: 127.0.0.1, Dst: 127.0.0.1
Transmission Control Protocol, Src Port: 8080, Dst Port: 37892, Seq: 224, Ack: 273, Len: 0

No.     Time           Source                Destination           Protocol Length Info
     24 0.023543136    127.0.0.1             127.0.0.1             TCP      68     37892 → 8080 [ACK] Seq=273 Ack=225 Win=44032 Len=0 TSval=3195450412 TSecr=3195450412

Frame 24: 68 bytes on wire (544 bits), 68 bytes captured (544 bits) on interface any, id 0
Linux cooked capture
Internet Protocol Version 4, Src: 127.0.0.1, Dst: 127.0.0.1
Transmission Control Protocol, Src Port: 37892, Dst Port: 8080, Seq: 273, Ack: 225, Len: 0

No.     Time           Source                Destination           Protocol Length Info
     25 0.041195563    127.0.0.1             127.0.0.1             TCP      76     37894 → 8080 [SYN] Seq=0 Win=43690 Len=0 MSS=65495 SACK_PERM=1 TSval=3195450430 TSecr=0 WS=512

Frame 25: 76 bytes on wire (608 bits), 76 bytes captured (608 bits) on interface any, id 0
Linux cooked capture
Internet Protocol Version 4, Src: 127.0.0.1, Dst: 127.0.0.1
Transmission Control Protocol, Src Port: 37894, Dst Port: 8080, Seq: 0, Len: 0

No.     Time           Source                Destination           Protocol Length Info
     26 0.041208770    127.0.0.1             127.0.0.1             TCP      76     8080 → 37894 [SYN, ACK] Seq=0 Ack=1 Win=43690 Len=0 MSS=65495 SACK_PERM=1 TSval=3195450430 TSecr=3195450430 WS=512

Frame 26: 76 bytes on wire (608 bits), 76 bytes captured (608 bits) on interface any, id 0
Linux cooked capture
Internet Protocol Version 4, Src: 127.0.0.1, Dst: 127.0.0.1
Transmission Control Protocol, Src Port: 8080, Dst Port: 37894, Seq: 0, Ack: 1, Len: 0

No.     Time           Source                Destination           Protocol Length Info
     27 0.041216807    127.0.0.1             127.0.0.1             TCP      68     37894 → 8080 [ACK] Seq=1 Ack=1 Win=44032 Len=0 TSval=3195450430 TSecr=3195450430

Frame 27: 68 bytes on wire (544 bits), 68 bytes captured (544 bits) on interface any, id 0
Linux cooked capture
Internet Protocol Version 4, Src: 127.0.0.1, Dst: 127.0.0.1
Transmission Control Protocol, Src Port: 37894, Dst Port: 8080, Seq: 1, Ack: 1, Len: 0

No.     Time           Source                Destination           Protocol Length Info
     28 0.041291516    127.0.0.1             127.0.0.1             HTTP     339    POST /qos/rules/0000000000000001 HTTP/1.1  (application/x-www-form-urlencoded)

Frame 28: 339 bytes on wire (2712 bits), 339 bytes captured (2712 bits) on interface any, id 0
Linux cooked capture
Internet Protocol Version 4, Src: 127.0.0.1, Dst: 127.0.0.1
Transmission Control Protocol, Src Port: 37894, Dst Port: 8080, Seq: 1, Ack: 1, Len: 271
Hypertext Transfer Protocol
HTML Form URL Encoded: application/x-www-form-urlencoded

No.     Time           Source                Destination           Protocol Length Info
     29 0.041294786    127.0.0.1             127.0.0.1             TCP      68     8080 → 37894 [ACK] Seq=1 Ack=272 Win=43520 Len=0 TSval=3195450430 TSecr=3195450430

Frame 29: 68 bytes on wire (544 bits), 68 bytes captured (544 bits) on interface any, id 0
Linux cooked capture
Internet Protocol Version 4, Src: 127.0.0.1, Dst: 127.0.0.1
Transmission Control Protocol, Src Port: 8080, Dst Port: 37894, Seq: 1, Ack: 272, Len: 0

No.     Time           Source                Destination           Protocol Length Info
     30 0.043213526    127.0.0.1             127.0.0.1             HTTP     291    HTTP/1.1 200 OK  (application/json)

Frame 30: 291 bytes on wire (2328 bits), 291 bytes captured (2328 bits) on interface any, id 0
Linux cooked capture
Internet Protocol Version 4, Src: 127.0.0.1, Dst: 127.0.0.1
Transmission Control Protocol, Src Port: 8080, Dst Port: 37894, Seq: 1, Ack: 272, Len: 223
Hypertext Transfer Protocol
JavaScript Object Notation: application/json

No.     Time           Source                Destination           Protocol Length Info
     31 0.043284100    127.0.0.1             127.0.0.1             TCP      68     37894 → 8080 [ACK] Seq=272 Ack=224 Win=44032 Len=0 TSval=3195450432 TSecr=3195450432

Frame 31: 68 bytes on wire (544 bits), 68 bytes captured (544 bits) on interface any, id 0
Linux cooked capture
Internet Protocol Version 4, Src: 127.0.0.1, Dst: 127.0.0.1
Transmission Control Protocol, Src Port: 37894, Dst Port: 8080, Seq: 272, Ack: 224, Len: 0

No.     Time           Source                Destination           Protocol Length Info
     32 0.043541838    127.0.0.1             127.0.0.1             TCP      68     37894 → 8080 [FIN, ACK] Seq=272 Ack=224 Win=44032 Len=0 TSval=3195450432 TSecr=3195450432

Frame 32: 68 bytes on wire (544 bits), 68 bytes captured (544 bits) on interface any, id 0
Linux cooked capture
Internet Protocol Version 4, Src: 127.0.0.1, Dst: 127.0.0.1
Transmission Control Protocol, Src Port: 37894, Dst Port: 8080, Seq: 272, Ack: 224, Len: 0

No.     Time           Source                Destination           Protocol Length Info
     33 0.043578397    127.0.0.1             127.0.0.1             OpenFlow 172    Type: OFPT_FLOW_MOD

Frame 33: 172 bytes on wire (1376 bits), 172 bytes captured (1376 bits) on interface any, id 0
Linux cooked capture
Internet Protocol Version 4, Src: 127.0.0.1, Dst: 127.0.0.1
Transmission Control Protocol, Src Port: 6653, Dst Port: 53822, Seq: 209, Ack: 1, Len: 104
OpenFlow 1.3

No.     Time           Source                Destination           Protocol Length Info
     34 0.043582945    127.0.0.1             127.0.0.1             TCP      68     53822 → 6653 [ACK] Seq=1 Ack=313 Win=86 Len=0 TSval=3195450432 TSecr=3195450432

Frame 34: 68 bytes on wire (544 bits), 68 bytes captured (544 bits) on interface any, id 0
Linux cooked capture
Internet Protocol Version 4, Src: 127.0.0.1, Dst: 127.0.0.1
Transmission Control Protocol, Src Port: 53822, Dst Port: 6653, Seq: 1, Ack: 313, Len: 0

No.     Time           Source                Destination           Protocol Length Info
     35 0.043700089    127.0.0.1             127.0.0.1             TCP      68     8080 → 37894 [FIN, ACK] Seq=224 Ack=273 Win=44032 Len=0 TSval=3195450432 TSecr=3195450432

Frame 35: 68 bytes on wire (544 bits), 68 bytes captured (544 bits) on interface any, id 0
Linux cooked capture
Internet Protocol Version 4, Src: 127.0.0.1, Dst: 127.0.0.1
Transmission Control Protocol, Src Port: 8080, Dst Port: 37894, Seq: 224, Ack: 273, Len: 0

No.     Time           Source                Destination           Protocol Length Info
     36 0.043704154    127.0.0.1             127.0.0.1             TCP      68     37894 → 8080 [ACK] Seq=273 Ack=225 Win=44032 Len=0 TSval=3195450432 TSecr=3195450432

Frame 36: 68 bytes on wire (544 bits), 68 bytes captured (544 bits) on interface any, id 0
Linux cooked capture
Internet Protocol Version 4, Src: 127.0.0.1, Dst: 127.0.0.1
Transmission Control Protocol, Src Port: 37894, Dst Port: 8080, Seq: 273, Ack: 225, Len: 0

No.     Time           Source                Destination           Protocol Length Info
     37 0.211561689    fe80::e86d:abff:fe23:3caa ff02::fb              MDNS     205    Standard query 0x0000 PTR _nfs._tcp.local, "QM" question PTR _ipp._tcp.local, "QM" question PTR _ipps._tcp.local, "QM" question PTR _ftp._tcp.local, "QM" question PTR _webdav._tcp.local, "QM" question PTR _webdavs._tcp.local, "QM" question PTR _sftp-ssh._tcp.local, "QM" question PTR _smb._tcp.local, "QM" question PTR _afpovertcp._tcp.local, "QM" question

Frame 37: 205 bytes on wire (1640 bits), 205 bytes captured (1640 bits) on interface any, id 0
Linux cooked capture
Internet Protocol Version 6, Src: fe80::e86d:abff:fe23:3caa, Dst: ff02::fb
User Datagram Protocol, Src Port: 5353, Dst Port: 5353
Multicast Domain Name System (query)

No.     Time           Source                Destination           Protocol Length Info
     38 0.262030647    fe80::e4f7:31ff:fee0:382e ff02::fb              MDNS     205    Standard query 0x0000 PTR _nfs._tcp.local, "QM" question PTR _ipp._tcp.local, "QM" question PTR _ipps._tcp.local, "QM" question PTR _ftp._tcp.local, "QM" question PTR _webdav._tcp.local, "QM" question PTR _webdavs._tcp.local, "QM" question PTR _sftp-ssh._tcp.local, "QM" question PTR _smb._tcp.local, "QM" question PTR _afpovertcp._tcp.local, "QM" question

Frame 38: 205 bytes on wire (1640 bits), 205 bytes captured (1640 bits) on interface any, id 0
Linux cooked capture
Internet Protocol Version 6, Src: fe80::e4f7:31ff:fee0:382e, Dst: ff02::fb
User Datagram Protocol, Src Port: 5353, Dst Port: 5353
Multicast Domain Name System (query)

No.     Time           Source                Destination           Protocol Length Info
     39 1.067752813    127.0.0.1             127.0.0.1             TCP      76     37908 → 8080 [SYN] Seq=0 Win=43690 Len=0 MSS=65495 SACK_PERM=1 TSval=3195451456 TSecr=0 WS=512

Frame 39: 76 bytes on wire (608 bits), 76 bytes captured (608 bits) on interface any, id 0
Linux cooked capture
Internet Protocol Version 4, Src: 127.0.0.1, Dst: 127.0.0.1
Transmission Control Protocol, Src Port: 37908, Dst Port: 8080, Seq: 0, Len: 0

No.     Time           Source                Destination           Protocol Length Info
     40 1.067768883    127.0.0.1             127.0.0.1             TCP      76     8080 → 37908 [SYN, ACK] Seq=0 Ack=1 Win=43690 Len=0 MSS=65495 SACK_PERM=1 TSval=3195451457 TSecr=3195451456 WS=512

Frame 40: 76 bytes on wire (608 bits), 76 bytes captured (608 bits) on interface any, id 0
Linux cooked capture
Internet Protocol Version 4, Src: 127.0.0.1, Dst: 127.0.0.1
Transmission Control Protocol, Src Port: 8080, Dst Port: 37908, Seq: 0, Ack: 1, Len: 0

No.     Time           Source                Destination           Protocol Length Info
     41 1.067778023    127.0.0.1             127.0.0.1             TCP      68     37908 → 8080 [ACK] Seq=1 Ack=1 Win=44032 Len=0 TSval=3195451457 TSecr=3195451457

Frame 41: 68 bytes on wire (544 bits), 68 bytes captured (544 bits) on interface any, id 0
Linux cooked capture
Internet Protocol Version 4, Src: 127.0.0.1, Dst: 127.0.0.1
Transmission Control Protocol, Src Port: 37908, Dst Port: 8080, Seq: 1, Ack: 1, Len: 0

No.     Time           Source                Destination           Protocol Length Info
     42 1.067869932    127.0.0.1             127.0.0.1             HTTP     172    GET /qos/rules/0000000000000001 HTTP/1.1 

Frame 42: 172 bytes on wire (1376 bits), 172 bytes captured (1376 bits) on interface any, id 0
Linux cooked capture
Internet Protocol Version 4, Src: 127.0.0.1, Dst: 127.0.0.1
Transmission Control Protocol, Src Port: 37908, Dst Port: 8080, Seq: 1, Ack: 1, Len: 104
Hypertext Transfer Protocol

No.     Time           Source                Destination           Protocol Length Info
     43 1.067874052    127.0.0.1             127.0.0.1             TCP      68     8080 → 37908 [ACK] Seq=1 Ack=105 Win=44032 Len=0 TSval=3195451457 TSecr=3195451457

Frame 43: 68 bytes on wire (544 bits), 68 bytes captured (544 bits) on interface any, id 0
Linux cooked capture
Internet Protocol Version 4, Src: 127.0.0.1, Dst: 127.0.0.1
Transmission Control Protocol, Src Port: 8080, Dst Port: 37908, Seq: 1, Ack: 105, Len: 0

No.     Time           Source                Destination           Protocol Length Info
     44 1.069898585    127.0.0.1             127.0.0.1             OpenFlow 124    Type: OFPT_MULTIPART_REQUEST, OFPMP_FLOW

Frame 44: 124 bytes on wire (992 bits), 124 bytes captured (992 bits) on interface any, id 0
Linux cooked capture
Internet Protocol Version 4, Src: 127.0.0.1, Dst: 127.0.0.1
Transmission Control Protocol, Src Port: 6653, Dst Port: 53822, Seq: 313, Ack: 1, Len: 56
OpenFlow 1.3

No.     Time           Source                Destination           Protocol Length Info
     45 1.069909723    127.0.0.1             127.0.0.1             TCP      68     53822 → 6653 [ACK] Seq=1 Ack=369 Win=86 Len=0 TSval=3195451459 TSecr=3195451459

Frame 45: 68 bytes on wire (544 bits), 68 bytes captured (544 bits) on interface any, id 0
Linux cooked capture
Internet Protocol Version 4, Src: 127.0.0.1, Dst: 127.0.0.1
Transmission Control Protocol, Src Port: 53822, Dst Port: 6653, Seq: 1, Ack: 369, Len: 0

No.     Time           Source                Destination           Protocol Length Info
     46 1.070220568    127.0.0.1             127.0.0.1             OpenFlow 540    Type: OFPT_MULTIPART_REPLY, OFPMP_FLOW

Frame 46: 540 bytes on wire (4320 bits), 540 bytes captured (4320 bits) on interface any, id 0
Linux cooked capture
Internet Protocol Version 4, Src: 127.0.0.1, Dst: 127.0.0.1
Transmission Control Protocol, Src Port: 53822, Dst Port: 6653, Seq: 1, Ack: 369, Len: 472
OpenFlow 1.3

No.     Time           Source                Destination           Protocol Length Info
     47 1.073350134    127.0.0.1             127.0.0.1             HTTP     648    HTTP/1.1 200 OK  (application/json)

Frame 47: 648 bytes on wire (5184 bits), 648 bytes captured (5184 bits) on interface any, id 0
Linux cooked capture
Internet Protocol Version 4, Src: 127.0.0.1, Dst: 127.0.0.1
Transmission Control Protocol, Src Port: 8080, Dst Port: 37908, Seq: 1, Ack: 105, Len: 580
Hypertext Transfer Protocol
JavaScript Object Notation: application/json

No.     Time           Source                Destination           Protocol Length Info
     48 1.073362526    127.0.0.1             127.0.0.1             TCP      68     37908 → 8080 [ACK] Seq=105 Ack=581 Win=43520 Len=0 TSval=3195451462 TSecr=3195451462

Frame 48: 68 bytes on wire (544 bits), 68 bytes captured (544 bits) on interface any, id 0
Linux cooked capture
Internet Protocol Version 4, Src: 127.0.0.1, Dst: 127.0.0.1
Transmission Control Protocol, Src Port: 37908, Dst Port: 8080, Seq: 105, Ack: 581, Len: 0

No.     Time           Source                Destination           Protocol Length Info
     49 1.073968995    127.0.0.1             127.0.0.1             TCP      68     37908 → 8080 [FIN, ACK] Seq=105 Ack=581 Win=44032 Len=0 TSval=3195451463 TSecr=3195451462

Frame 49: 68 bytes on wire (544 bits), 68 bytes captured (544 bits) on interface any, id 0
Linux cooked capture
Internet Protocol Version 4, Src: 127.0.0.1, Dst: 127.0.0.1
Transmission Control Protocol, Src Port: 37908, Dst Port: 8080, Seq: 105, Ack: 581, Len: 0

No.     Time           Source                Destination           Protocol Length Info
     50 1.074212616    127.0.0.1             127.0.0.1             TCP      68     8080 → 37908 [FIN, ACK] Seq=581 Ack=106 Win=44032 Len=0 TSval=3195451463 TSecr=3195451463

Frame 50: 68 bytes on wire (544 bits), 68 bytes captured (544 bits) on interface any, id 0
Linux cooked capture
Internet Protocol Version 4, Src: 127.0.0.1, Dst: 127.0.0.1
Transmission Control Protocol, Src Port: 8080, Dst Port: 37908, Seq: 581, Ack: 106, Len: 0

No.     Time           Source                Destination           Protocol Length Info
     51 1.074220023    127.0.0.1             127.0.0.1             TCP      68     37908 → 8080 [ACK] Seq=106 Ack=582 Win=44032 Len=0 TSval=3195451463 TSecr=3195451463

Frame 51: 68 bytes on wire (544 bits), 68 bytes captured (544 bits) on interface any, id 0
Linux cooked capture
Internet Protocol Version 4, Src: 127.0.0.1, Dst: 127.0.0.1
Transmission Control Protocol, Src Port: 37908, Dst Port: 8080, Seq: 106, Ack: 582, Len: 0

No.     Time           Source                Destination           Protocol Length Info
     52 1.117184484    127.0.0.1             127.0.0.1             TCP      68     6653 → 53822 [ACK] Seq=369 Ack=473 Win=86 Len=0 TSval=3195451506 TSecr=3195451459

Frame 52: 68 bytes on wire (544 bits), 68 bytes captured (544 bits) on interface any, id 0
Linux cooked capture
Internet Protocol Version 4, Src: 127.0.0.1, Dst: 127.0.0.1
Transmission Control Protocol, Src Port: 6653, Dst Port: 53822, Seq: 369, Ack: 473, Len: 0

No.     Time           Source                Destination           Protocol Length Info
     53 4.172944645    fe80::e4f7:31ff:fee0:382e ff02::2               ICMPv6   72     Router Solicitation from e6:f7:31:e0:38:2e

Frame 53: 72 bytes on wire (576 bits), 72 bytes captured (576 bits) on interface any, id 0
Linux cooked capture
Internet Protocol Version 6, Src: fe80::e4f7:31ff:fee0:382e, Dst: ff02::2
Internet Control Message Protocol v6

No.     Time           Source                Destination           Protocol Length Info
     54 5.200020487    fe80::e86d:abff:fe23:3caa ff02::2               ICMPv6   72     Router Solicitation from ea:6d:ab:23:3c:aa

Frame 54: 72 bytes on wire (576 bits), 72 bytes captured (576 bits) on interface any, id 0
Linux cooked capture
Internet Protocol Version 6, Src: fe80::e86d:abff:fe23:3caa, Dst: ff02::2
Internet Control Message Protocol v6

No.     Time           Source                Destination           Protocol Length Info
     55 5.751364976    fe80::200:ff:fe00:1   ff02::2               ICMPv6   72     Router Solicitation from 00:00:00:00:00:01

Frame 55: 72 bytes on wire (576 bits), 72 bytes captured (576 bits) on interface any, id 0
Linux cooked capture
Internet Protocol Version 6, Src: fe80::200:ff:fe00:1, Dst: ff02::2
Internet Control Message Protocol v6

No.     Time           Source                Destination           Protocol Length Info
     56 5.801255182    127.0.0.1             127.0.0.1             OpenFlow 180    Type: OFPT_PACKET_IN

Frame 56: 180 bytes on wire (1440 bits), 180 bytes captured (1440 bits) on interface any, id 0
Linux cooked capture
Internet Protocol Version 4, Src: 127.0.0.1, Dst: 127.0.0.1
Transmission Control Protocol, Src Port: 53822, Dst Port: 6653, Seq: 473, Ack: 369, Len: 112
OpenFlow 1.3

No.     Time           Source                Destination           Protocol Length Info
     57 5.801325206    127.0.0.1             127.0.0.1             TCP      68     6653 → 53822 [ACK] Seq=369 Ack=585 Win=86 Len=0 TSval=3195456190 TSecr=3195456190

Frame 57: 68 bytes on wire (544 bits), 68 bytes captured (544 bits) on interface any, id 0
Linux cooked capture
Internet Protocol Version 4, Src: 127.0.0.1, Dst: 127.0.0.1
Transmission Control Protocol, Src Port: 6653, Dst Port: 53822, Seq: 369, Ack: 585, Len: 0

No.     Time           Source                Destination           Protocol Length Info
     58 5.802558593    127.0.0.1             127.0.0.1             OpenFlow 178    Type: OFPT_PACKET_OUT

Frame 58: 178 bytes on wire (1424 bits), 178 bytes captured (1424 bits) on interface any, id 0
Linux cooked capture
Internet Protocol Version 4, Src: 127.0.0.1, Dst: 127.0.0.1
Transmission Control Protocol, Src Port: 6653, Dst Port: 53822, Seq: 369, Ack: 585, Len: 110
OpenFlow 1.3

No.     Time           Source                Destination           Protocol Length Info
     59 5.802866623    fe80::200:ff:fe00:1   ff02::2               ICMPv6   72     Router Solicitation from 00:00:00:00:00:01

Frame 59: 72 bytes on wire (576 bits), 72 bytes captured (576 bits) on interface any, id 0
Linux cooked capture
Internet Protocol Version 6, Src: fe80::200:ff:fe00:1, Dst: ff02::2
Internet Control Message Protocol v6

No.     Time           Source                Destination           Protocol Length Info
     60 5.855359617    127.0.0.1             127.0.0.1             TCP      68     53822 → 6653 [ACK] Seq=585 Ack=479 Win=86 Len=0 TSval=3195456244 TSecr=3195456191

Frame 60: 68 bytes on wire (544 bits), 68 bytes captured (544 bits) on interface any, id 0
Linux cooked capture
Internet Protocol Version 4, Src: 127.0.0.1, Dst: 127.0.0.1
Transmission Control Protocol, Src Port: 53822, Dst Port: 6653, Seq: 585, Ack: 479, Len: 0

No.     Time           Source                Destination           Protocol Length Info
     61 5.965405922    fe80::200:ff:fe00:2   ff02::2               ICMPv6   72     Router Solicitation from 00:00:00:00:00:02

Frame 61: 72 bytes on wire (576 bits), 72 bytes captured (576 bits) on interface any, id 0
Linux cooked capture
Internet Protocol Version 6, Src: fe80::200:ff:fe00:2, Dst: ff02::2
Internet Control Message Protocol v6

No.     Time           Source                Destination           Protocol Length Info
     62 5.965857490    127.0.0.1             127.0.0.1             OpenFlow 180    Type: OFPT_PACKET_IN

Frame 62: 180 bytes on wire (1440 bits), 180 bytes captured (1440 bits) on interface any, id 0
Linux cooked capture
Internet Protocol Version 4, Src: 127.0.0.1, Dst: 127.0.0.1
Transmission Control Protocol, Src Port: 53822, Dst Port: 6653, Seq: 585, Ack: 479, Len: 112
OpenFlow 1.3

No.     Time           Source                Destination           Protocol Length Info
     63 5.967252815    127.0.0.1             127.0.0.1             OpenFlow 178    Type: OFPT_PACKET_OUT

Frame 63: 178 bytes on wire (1424 bits), 178 bytes captured (1424 bits) on interface any, id 0
Linux cooked capture
Internet Protocol Version 4, Src: 127.0.0.1, Dst: 127.0.0.1
Transmission Control Protocol, Src Port: 6653, Dst Port: 53822, Seq: 479, Ack: 697, Len: 110
OpenFlow 1.3

No.     Time           Source                Destination           Protocol Length Info
     64 5.967263285    127.0.0.1             127.0.0.1             TCP      68     53822 → 6653 [ACK] Seq=697 Ack=589 Win=86 Len=0 TSval=3195456356 TSecr=3195456356

Frame 64: 68 bytes on wire (544 bits), 68 bytes captured (544 bits) on interface any, id 0
Linux cooked capture
Internet Protocol Version 4, Src: 127.0.0.1, Dst: 127.0.0.1
Transmission Control Protocol, Src Port: 53822, Dst Port: 6653, Seq: 697, Ack: 589, Len: 0

No.     Time           Source                Destination           Protocol Length Info
     65 5.967702056    fe80::200:ff:fe00:2   ff02::2               ICMPv6   72     Router Solicitation from 00:00:00:00:00:02

Frame 65: 72 bytes on wire (576 bits), 72 bytes captured (576 bits) on interface any, id 0
Linux cooked capture
Internet Protocol Version 6, Src: fe80::200:ff:fe00:2, Dst: ff02::2
Internet Control Message Protocol v6

No.     Time           Source                Destination           Protocol Length Info
     66 8.219378220    fe80::e86d:abff:fe23:3caa ff02::fb              MDNS     205    Standard query 0x0000 PTR _nfs._tcp.local, "QM" question PTR _ipp._tcp.local, "QM" question PTR _ipps._tcp.local, "QM" question PTR _ftp._tcp.local, "QM" question PTR _webdav._tcp.local, "QM" question PTR _webdavs._tcp.local, "QM" question PTR _sftp-ssh._tcp.local, "QM" question PTR _smb._tcp.local, "QM" question PTR _afpovertcp._tcp.local, "QM" question

Frame 66: 205 bytes on wire (1640 bits), 205 bytes captured (1640 bits) on interface any, id 0
Linux cooked capture
Internet Protocol Version 6, Src: fe80::e86d:abff:fe23:3caa, Dst: ff02::fb
User Datagram Protocol, Src Port: 5353, Dst Port: 5353
Multicast Domain Name System (query)

No.     Time           Source                Destination           Protocol Length Info
     67 8.258820469    fe80::e4f7:31ff:fee0:382e ff02::fb              MDNS     205    Standard query 0x0000 PTR _nfs._tcp.local, "QM" question PTR _ipp._tcp.local, "QM" question PTR _ipps._tcp.local, "QM" question PTR _ftp._tcp.local, "QM" question PTR _webdav._tcp.local, "QM" question PTR _webdavs._tcp.local, "QM" question PTR _sftp-ssh._tcp.local, "QM" question PTR _smb._tcp.local, "QM" question PTR _afpovertcp._tcp.local, "QM" question

Frame 67: 205 bytes on wire (1640 bits), 205 bytes captured (1640 bits) on interface any, id 0
Linux cooked capture
Internet Protocol Version 6, Src: fe80::e4f7:31ff:fee0:382e, Dst: ff02::fb
User Datagram Protocol, Src Port: 5353, Dst Port: 5353
Multicast Domain Name System (query)

No.     Time           Source                Destination           Protocol Length Info
     68 10.972363030   127.0.0.1             127.0.0.1             OpenFlow 76     Type: OFPT_ECHO_REQUEST

Frame 68: 76 bytes on wire (608 bits), 76 bytes captured (608 bits) on interface any, id 0
Linux cooked capture
Internet Protocol Version 4, Src: 127.0.0.1, Dst: 127.0.0.1
Transmission Control Protocol, Src Port: 53822, Dst Port: 6653, Seq: 697, Ack: 589, Len: 8
OpenFlow 1.3

No.     Time           Source                Destination           Protocol Length Info
     69 10.973838501   127.0.0.1             127.0.0.1             OpenFlow 76     Type: OFPT_ECHO_REPLY

Frame 69: 76 bytes on wire (608 bits), 76 bytes captured (608 bits) on interface any, id 0
Linux cooked capture
Internet Protocol Version 4, Src: 127.0.0.1, Dst: 127.0.0.1
Transmission Control Protocol, Src Port: 6653, Dst Port: 53822, Seq: 589, Ack: 705, Len: 8
OpenFlow 1.3

No.     Time           Source                Destination           Protocol Length Info
     70 10.973857817   127.0.0.1             127.0.0.1             TCP      68     53822 → 6653 [ACK] Seq=705 Ack=597 Win=86 Len=0 TSval=3195461363 TSecr=3195461363

Frame 70: 68 bytes on wire (544 bits), 68 bytes captured (544 bits) on interface any, id 0
Linux cooked capture
Internet Protocol Version 4, Src: 127.0.0.1, Dst: 127.0.0.1
Transmission Control Protocol, Src Port: 53822, Dst Port: 6653, Seq: 705, Ack: 597, Len: 0

No.     Time           Source                Destination           Protocol Length Info
     71 15.976071899   127.0.0.1             127.0.0.1             OpenFlow 76     Type: OFPT_ECHO_REQUEST

Frame 71: 76 bytes on wire (608 bits), 76 bytes captured (608 bits) on interface any, id 0
Linux cooked capture
Internet Protocol Version 4, Src: 127.0.0.1, Dst: 127.0.0.1
Transmission Control Protocol, Src Port: 53822, Dst Port: 6653, Seq: 705, Ack: 597, Len: 8
OpenFlow 1.3

No.     Time           Source                Destination           Protocol Length Info
     72 15.977522606   127.0.0.1             127.0.0.1             OpenFlow 76     Type: OFPT_ECHO_REPLY

Frame 72: 76 bytes on wire (608 bits), 76 bytes captured (608 bits) on interface any, id 0
Linux cooked capture
Internet Protocol Version 4, Src: 127.0.0.1, Dst: 127.0.0.1
Transmission Control Protocol, Src Port: 6653, Dst Port: 53822, Seq: 597, Ack: 713, Len: 8
OpenFlow 1.3

No.     Time           Source                Destination           Protocol Length Info
     73 15.977543219   127.0.0.1             127.0.0.1             TCP      68     53822 → 6653 [ACK] Seq=713 Ack=605 Win=86 Len=0 TSval=3195466366 TSecr=3195466366

Frame 73: 68 bytes on wire (544 bits), 68 bytes captured (544 bits) on interface any, id 0
Linux cooked capture
Internet Protocol Version 4, Src: 127.0.0.1, Dst: 127.0.0.1
Transmission Control Protocol, Src Port: 53822, Dst Port: 6653, Seq: 713, Ack: 605, Len: 0

No.     Time           Source                Destination           Protocol Length Info
     74 17.753636975   00:00:00_00:00:02                           ARP      44     Who has 10.0.0.1? Tell 10.0.0.2

Frame 74: 44 bytes on wire (352 bits), 44 bytes captured (352 bits) on interface any, id 0
Linux cooked capture
Address Resolution Protocol (request)

No.     Time           Source                Destination           Protocol Length Info
     75 17.754369140   127.0.0.1             127.0.0.1             OpenFlow 152    Type: OFPT_PACKET_IN

Frame 75: 152 bytes on wire (1216 bits), 152 bytes captured (1216 bits) on interface any, id 0
Linux cooked capture
Internet Protocol Version 4, Src: 127.0.0.1, Dst: 127.0.0.1
Transmission Control Protocol, Src Port: 53822, Dst Port: 6653, Seq: 713, Ack: 605, Len: 84
OpenFlow 1.3

No.     Time           Source                Destination           Protocol Length Info
     76 17.755353423   127.0.0.1             127.0.0.1             OpenFlow 150    Type: OFPT_PACKET_OUT

Frame 76: 150 bytes on wire (1200 bits), 150 bytes captured (1200 bits) on interface any, id 0
Linux cooked capture
Internet Protocol Version 4, Src: 127.0.0.1, Dst: 127.0.0.1
Transmission Control Protocol, Src Port: 6653, Dst Port: 53822, Seq: 605, Ack: 797, Len: 82
OpenFlow 1.3

No.     Time           Source                Destination           Protocol Length Info
