No.     Time           Source                Destination           Protocol Length Info
      1 0.000000000    127.0.0.1             127.0.0.1             TCP      76     56912 → 6653 [SYN] Seq=0 Win=43690 Len=0 MSS=65495 SACK_PERM=1 TSval=3195545526 TSecr=0 WS=512

Frame 1: 76 bytes on wire (608 bits), 76 bytes captured (608 bits) on interface any, id 0
Linux cooked capture
Internet Protocol Version 4, Src: 127.0.0.1, Dst: 127.0.0.1
Transmission Control Protocol, Src Port: 56912, Dst Port: 6653, Seq: 0, Len: 0

No.     Time           Source                Destination           Protocol Length Info
      2 0.000023411    127.0.0.1             127.0.0.1             TCP      76     6653 → 56912 [SYN, ACK] Seq=0 Ack=1 Win=43690 Len=0 MSS=65495 SACK_PERM=1 TSval=3195545526 TSecr=3195545526 WS=512

Frame 2: 76 bytes on wire (608 bits), 76 bytes captured (608 bits) on interface any, id 0
Linux cooked capture
Internet Protocol Version 4, Src: 127.0.0.1, Dst: 127.0.0.1
Transmission Control Protocol, Src Port: 6653, Dst Port: 56912, Seq: 0, Ack: 1, Len: 0

No.     Time           Source                Destination           Protocol Length Info
      3 0.000038497    127.0.0.1             127.0.0.1             TCP      68     56912 → 6653 [ACK] Seq=1 Ack=1 Win=44032 Len=0 TSval=3195545526 TSecr=3195545526

Frame 3: 68 bytes on wire (544 bits), 68 bytes captured (544 bits) on interface any, id 0
Linux cooked capture
Internet Protocol Version 4, Src: 127.0.0.1, Dst: 127.0.0.1
Transmission Control Protocol, Src Port: 56912, Dst Port: 6653, Seq: 1, Ack: 1, Len: 0

No.     Time           Source                Destination           Protocol Length Info
      4 0.000240391    127.0.0.1             127.0.0.1             TCP      68     56912 → 6653 [FIN, ACK] Seq=1 Ack=1 Win=44032 Len=0 TSval=3195545526 TSecr=3195545526

Frame 4: 68 bytes on wire (544 bits), 68 bytes captured (544 bits) on interface any, id 0
Linux cooked capture
Internet Protocol Version 4, Src: 127.0.0.1, Dst: 127.0.0.1
Transmission Control Protocol, Src Port: 56912, Dst Port: 6653, Seq: 1, Ack: 1, Len: 0

No.     Time           Source                Destination           Protocol Length Info
      5 0.000982386    127.0.0.1             127.0.0.1             TCP      68     6653 → 56912 [FIN, ACK] Seq=1 Ack=2 Win=44032 Len=0 TSval=3195545527 TSecr=3195545526

Frame 5: 68 bytes on wire (544 bits), 68 bytes captured (544 bits) on interface any, id 0
Linux cooked capture
Internet Protocol Version 4, Src: 127.0.0.1, Dst: 127.0.0.1
Transmission Control Protocol, Src Port: 6653, Dst Port: 56912, Seq: 1, Ack: 2, Len: 0

No.     Time           Source                Destination           Protocol Length Info
      6 0.000992863    127.0.0.1             127.0.0.1             TCP      68     56912 → 6653 [ACK] Seq=2 Ack=2 Win=44032 Len=0 TSval=3195545527 TSecr=3195545527

Frame 6: 68 bytes on wire (544 bits), 68 bytes captured (544 bits) on interface any, id 0
Linux cooked capture
Internet Protocol Version 4, Src: 127.0.0.1, Dst: 127.0.0.1
Transmission Control Protocol, Src Port: 56912, Dst Port: 6653, Seq: 2, Ack: 2, Len: 0

No.     Time           Source                Destination           Protocol Length Info
      7 0.160214957    ::                    ff02::16              ICMPv6   92     Multicast Listener Report Message v2

Frame 7: 92 bytes on wire (736 bits), 92 bytes captured (736 bits) on interface any, id 0
Linux cooked capture
Internet Protocol Version 6, Src: ::, Dst: ff02::16
Internet Control Message Protocol v6

No.     Time           Source                Destination           Protocol Length Info
      8 0.160205014    ::                    ff02::16              ICMPv6   92     Multicast Listener Report Message v2

Frame 8: 92 bytes on wire (736 bits), 92 bytes captured (736 bits) on interface any, id 0
Linux cooked capture
Internet Protocol Version 6, Src: ::, Dst: ff02::16
Internet Control Message Protocol v6

No.     Time           Source                Destination           Protocol Length Info
      9 0.223768254    ::                    ff02::16              ICMPv6   92     Multicast Listener Report Message v2

Frame 9: 92 bytes on wire (736 bits), 92 bytes captured (736 bits) on interface any, id 0
Linux cooked capture
Internet Protocol Version 6, Src: ::, Dst: ff02::16
Internet Control Message Protocol v6

No.     Time           Source                Destination           Protocol Length Info
     10 0.224136444    ::                    ff02::16              ICMPv6   92     Multicast Listener Report Message v2

Frame 10: 92 bytes on wire (736 bits), 92 bytes captured (736 bits) on interface any, id 0
Linux cooked capture
Internet Protocol Version 6, Src: ::, Dst: ff02::16
Internet Control Message Protocol v6

No.     Time           Source                Destination           Protocol Length Info
     11 0.275703191    ::                    ff02::16              ICMPv6   92     Multicast Listener Report Message v2

Frame 11: 92 bytes on wire (736 bits), 92 bytes captured (736 bits) on interface any, id 0
Linux cooked capture
Internet Protocol Version 6, Src: ::, Dst: ff02::16
Internet Control Message Protocol v6

No.     Time           Source                Destination           Protocol Length Info
     12 0.275735064    ::                    ff02::16              ICMPv6   112    Multicast Listener Report Message v2

Frame 12: 112 bytes on wire (896 bits), 112 bytes captured (896 bits) on interface any, id 0
Linux cooked capture
Internet Protocol Version 6, Src: ::, Dst: ff02::16
Internet Control Message Protocol v6

No.     Time           Source                Destination           Protocol Length Info
     13 0.363709115    127.0.0.1             127.0.0.1             TCP      76     49988 → 5037 [SYN] Seq=0 Win=43690 Len=0 MSS=65495 SACK_PERM=1 TSval=3195545890 TSecr=0 WS=512

Frame 13: 76 bytes on wire (608 bits), 76 bytes captured (608 bits) on interface any, id 0
Linux cooked capture
Internet Protocol Version 4, Src: 127.0.0.1, Dst: 127.0.0.1
Transmission Control Protocol, Src Port: 49988, Dst Port: 5037, Seq: 0, Len: 0

No.     Time           Source                Destination           Protocol Length Info
     14 0.363733797    127.0.0.1             127.0.0.1             TCP      56     5037 → 49988 [RST, ACK] Seq=1 Ack=1 Win=0 Len=0

Frame 14: 56 bytes on wire (448 bits), 56 bytes captured (448 bits) on interface any, id 0
Linux cooked capture
Internet Protocol Version 4, Src: 127.0.0.1, Dst: 127.0.0.1
Transmission Control Protocol, Src Port: 5037, Dst Port: 49988, Seq: 1, Ack: 1, Len: 0

No.     Time           Source                Destination           Protocol Length Info
     15 0.364927660    127.0.0.1             127.0.0.1             TCP      76     49992 → 5037 [SYN] Seq=0 Win=43690 Len=0 MSS=65495 SACK_PERM=1 TSval=3195545891 TSecr=0 WS=512

Frame 15: 76 bytes on wire (608 bits), 76 bytes captured (608 bits) on interface any, id 0
Linux cooked capture
Internet Protocol Version 4, Src: 127.0.0.1, Dst: 127.0.0.1
Transmission Control Protocol, Src Port: 49992, Dst Port: 5037, Seq: 0, Len: 0

No.     Time           Source                Destination           Protocol Length Info
     16 0.364935474    127.0.0.1             127.0.0.1             TCP      56     5037 → 49992 [RST, ACK] Seq=1 Ack=1 Win=0 Len=0

Frame 16: 56 bytes on wire (448 bits), 56 bytes captured (448 bits) on interface any, id 0
Linux cooked capture
Internet Protocol Version 4, Src: 127.0.0.1, Dst: 127.0.0.1
Transmission Control Protocol, Src Port: 5037, Dst Port: 49992, Seq: 1, Ack: 1, Len: 0

No.     Time           Source                Destination           Protocol Length Info
     17 0.367889905    127.0.0.1             127.0.0.1             TCP      76     50008 → 5037 [SYN] Seq=0 Win=43690 Len=0 MSS=65495 SACK_PERM=1 TSval=3195545894 TSecr=0 WS=512

Frame 17: 76 bytes on wire (608 bits), 76 bytes captured (608 bits) on interface any, id 0
Linux cooked capture
Internet Protocol Version 4, Src: 127.0.0.1, Dst: 127.0.0.1
Transmission Control Protocol, Src Port: 50008, Dst Port: 5037, Seq: 0, Len: 0

No.     Time           Source                Destination           Protocol Length Info
     18 0.367908820    127.0.0.1             127.0.0.1             TCP      56     5037 → 50008 [RST, ACK] Seq=1 Ack=1 Win=0 Len=0

Frame 18: 56 bytes on wire (448 bits), 56 bytes captured (448 bits) on interface any, id 0
Linux cooked capture
Internet Protocol Version 4, Src: 127.0.0.1, Dst: 127.0.0.1
Transmission Control Protocol, Src Port: 5037, Dst Port: 50008, Seq: 1, Ack: 1, Len: 0

No.     Time           Source                Destination           Protocol Length Info
     19 0.369306117    127.0.0.1             127.0.0.1             TCP      76     50020 → 5037 [SYN] Seq=0 Win=43690 Len=0 MSS=65495 SACK_PERM=1 TSval=3195545895 TSecr=0 WS=512

Frame 19: 76 bytes on wire (608 bits), 76 bytes captured (608 bits) on interface any, id 0
Linux cooked capture
Internet Protocol Version 4, Src: 127.0.0.1, Dst: 127.0.0.1
Transmission Control Protocol, Src Port: 50020, Dst Port: 5037, Seq: 0, Len: 0

No.     Time           Source                Destination           Protocol Length Info
     20 0.369320637    127.0.0.1             127.0.0.1             TCP      56     5037 → 50020 [RST, ACK] Seq=1 Ack=1 Win=0 Len=0

Frame 20: 56 bytes on wire (448 bits), 56 bytes captured (448 bits) on interface any, id 0
Linux cooked capture
Internet Protocol Version 4, Src: 127.0.0.1, Dst: 127.0.0.1
Transmission Control Protocol, Src Port: 5037, Dst Port: 50020, Seq: 1, Ack: 1, Len: 0

No.     Time           Source                Destination           Protocol Length Info
     21 0.370463106    127.0.0.1             127.0.0.1             TCP      76     50026 → 5037 [SYN] Seq=0 Win=43690 Len=0 MSS=65495 SACK_PERM=1 TSval=3195545896 TSecr=0 WS=512

Frame 21: 76 bytes on wire (608 bits), 76 bytes captured (608 bits) on interface any, id 0
Linux cooked capture
Internet Protocol Version 4, Src: 127.0.0.1, Dst: 127.0.0.1
Transmission Control Protocol, Src Port: 50026, Dst Port: 5037, Seq: 0, Len: 0

No.     Time           Source                Destination           Protocol Length Info
     22 0.370472185    127.0.0.1             127.0.0.1             TCP      56     5037 → 50026 [RST, ACK] Seq=1 Ack=1 Win=0 Len=0

Frame 22: 56 bytes on wire (448 bits), 56 bytes captured (448 bits) on interface any, id 0
Linux cooked capture
Internet Protocol Version 4, Src: 127.0.0.1, Dst: 127.0.0.1
Transmission Control Protocol, Src Port: 5037, Dst Port: 50026, Seq: 1, Ack: 1, Len: 0

No.     Time           Source                Destination           Protocol Length Info
     23 0.372696061    127.0.0.1             127.0.0.1             TCP      76     50038 → 5037 [SYN] Seq=0 Win=43690 Len=0 MSS=65495 SACK_PERM=1 TSval=3195545899 TSecr=0 WS=512

Frame 23: 76 bytes on wire (608 bits), 76 bytes captured (608 bits) on interface any, id 0
Linux cooked capture
Internet Protocol Version 4, Src: 127.0.0.1, Dst: 127.0.0.1
Transmission Control Protocol, Src Port: 50038, Dst Port: 5037, Seq: 0, Len: 0

No.     Time           Source                Destination           Protocol Length Info
     24 0.372715511    127.0.0.1             127.0.0.1             TCP      56     5037 → 50038 [RST, ACK] Seq=1 Ack=1 Win=0 Len=0

Frame 24: 56 bytes on wire (448 bits), 56 bytes captured (448 bits) on interface any, id 0
Linux cooked capture
Internet Protocol Version 4, Src: 127.0.0.1, Dst: 127.0.0.1
Transmission Control Protocol, Src Port: 5037, Dst Port: 50038, Seq: 1, Ack: 1, Len: 0

No.     Time           Source                Destination           Protocol Length Info
     25 0.375195778    127.0.0.1             127.0.0.1             TCP      76     50050 → 5037 [SYN] Seq=0 Win=43690 Len=0 MSS=65495 SACK_PERM=1 TSval=3195545901 TSecr=0 WS=512

Frame 25: 76 bytes on wire (608 bits), 76 bytes captured (608 bits) on interface any, id 0
Linux cooked capture
Internet Protocol Version 4, Src: 127.0.0.1, Dst: 127.0.0.1
Transmission Control Protocol, Src Port: 50050, Dst Port: 5037, Seq: 0, Len: 0

No.     Time           Source                Destination           Protocol Length Info
     26 0.375210831    127.0.0.1             127.0.0.1             TCP      56     5037 → 50050 [RST, ACK] Seq=1 Ack=1 Win=0 Len=0

Frame 26: 56 bytes on wire (448 bits), 56 bytes captured (448 bits) on interface any, id 0
Linux cooked capture
Internet Protocol Version 4, Src: 127.0.0.1, Dst: 127.0.0.1
Transmission Control Protocol, Src Port: 5037, Dst Port: 50050, Seq: 1, Ack: 1, Len: 0

No.     Time           Source                Destination           Protocol Length Info
     27 0.377433113    ::                    ff02::16              ICMPv6   92     Multicast Listener Report Message v2

Frame 27: 92 bytes on wire (736 bits), 92 bytes captured (736 bits) on interface any, id 0
Linux cooked capture
Internet Protocol Version 6, Src: ::, Dst: ff02::16
Internet Control Message Protocol v6

No.     Time           Source                Destination           Protocol Length Info
     28 0.377446410    ::                    ff02::16              ICMPv6   112    Multicast Listener Report Message v2

Frame 28: 112 bytes on wire (896 bits), 112 bytes captured (896 bits) on interface any, id 0
Linux cooked capture
Internet Protocol Version 6, Src: ::, Dst: ff02::16
Internet Control Message Protocol v6

No.     Time           Source                Destination           Protocol Length Info
     29 0.378407462    127.0.0.1             127.0.0.1             TCP      76     50064 → 5037 [SYN] Seq=0 Win=43690 Len=0 MSS=65495 SACK_PERM=1 TSval=3195545904 TSecr=0 WS=512

Frame 29: 76 bytes on wire (608 bits), 76 bytes captured (608 bits) on interface any, id 0
Linux cooked capture
Internet Protocol Version 4, Src: 127.0.0.1, Dst: 127.0.0.1
Transmission Control Protocol, Src Port: 50064, Dst Port: 5037, Seq: 0, Len: 0

No.     Time           Source                Destination           Protocol Length Info
     30 0.378423006    127.0.0.1             127.0.0.1             TCP      56     5037 → 50064 [RST, ACK] Seq=1 Ack=1 Win=0 Len=0

Frame 30: 56 bytes on wire (448 bits), 56 bytes captured (448 bits) on interface any, id 0
Linux cooked capture
Internet Protocol Version 4, Src: 127.0.0.1, Dst: 127.0.0.1
Transmission Control Protocol, Src Port: 5037, Dst Port: 50064, Seq: 1, Ack: 1, Len: 0

No.     Time           Source                Destination           Protocol Length Info
     31 0.383843046    127.0.0.1             127.0.0.1             TCP      76     50080 → 5037 [SYN] Seq=0 Win=43690 Len=0 MSS=65495 SACK_PERM=1 TSval=3195545910 TSecr=0 WS=512

Frame 31: 76 bytes on wire (608 bits), 76 bytes captured (608 bits) on interface any, id 0
Linux cooked capture
Internet Protocol Version 4, Src: 127.0.0.1, Dst: 127.0.0.1
Transmission Control Protocol, Src Port: 50080, Dst Port: 5037, Seq: 0, Len: 0

No.     Time           Source                Destination           Protocol Length Info
     32 0.383864303    127.0.0.1             127.0.0.1             TCP      56     5037 → 50080 [RST, ACK] Seq=1 Ack=1 Win=0 Len=0

Frame 32: 56 bytes on wire (448 bits), 56 bytes captured (448 bits) on interface any, id 0
Linux cooked capture
Internet Protocol Version 4, Src: 127.0.0.1, Dst: 127.0.0.1
Transmission Control Protocol, Src Port: 5037, Dst Port: 50080, Seq: 1, Ack: 1, Len: 0

No.     Time           Source                Destination           Protocol Length Info
     33 0.385713341    127.0.0.1             127.0.0.1             TCP      76     50096 → 5037 [SYN] Seq=0 Win=43690 Len=0 MSS=65495 SACK_PERM=1 TSval=3195545912 TSecr=0 WS=512

Frame 33: 76 bytes on wire (608 bits), 76 bytes captured (608 bits) on interface any, id 0
Linux cooked capture
Internet Protocol Version 4, Src: 127.0.0.1, Dst: 127.0.0.1
Transmission Control Protocol, Src Port: 50096, Dst Port: 5037, Seq: 0, Len: 0

No.     Time           Source                Destination           Protocol Length Info
     34 0.385727163    127.0.0.1             127.0.0.1             TCP      56     5037 → 50096 [RST, ACK] Seq=1 Ack=1 Win=0 Len=0

Frame 34: 56 bytes on wire (448 bits), 56 bytes captured (448 bits) on interface any, id 0
Linux cooked capture
Internet Protocol Version 4, Src: 127.0.0.1, Dst: 127.0.0.1
Transmission Control Protocol, Src Port: 5037, Dst Port: 50096, Seq: 1, Ack: 1, Len: 0

No.     Time           Source                Destination           Protocol Length Info
     35 0.449680178    127.0.0.1             127.0.0.1             TCP      76     56928 → 6653 [SYN] Seq=0 Win=43690 Len=0 MSS=65495 SACK_PERM=1 TSval=3195545976 TSecr=0 WS=512

Frame 35: 76 bytes on wire (608 bits), 76 bytes captured (608 bits) on interface any, id 0
Linux cooked capture
Internet Protocol Version 4, Src: 127.0.0.1, Dst: 127.0.0.1
Transmission Control Protocol, Src Port: 56928, Dst Port: 6653, Seq: 0, Len: 0

No.     Time           Source                Destination           Protocol Length Info
     36 0.449705841    127.0.0.1             127.0.0.1             TCP      76     6653 → 56928 [SYN, ACK] Seq=0 Ack=1 Win=43690 Len=0 MSS=65495 SACK_PERM=1 TSval=3195545976 TSecr=3195545976 WS=512

Frame 36: 76 bytes on wire (608 bits), 76 bytes captured (608 bits) on interface any, id 0
Linux cooked capture
Internet Protocol Version 4, Src: 127.0.0.1, Dst: 127.0.0.1
Transmission Control Protocol, Src Port: 6653, Dst Port: 56928, Seq: 0, Ack: 1, Len: 0

No.     Time           Source                Destination           Protocol Length Info
     37 0.449720598    127.0.0.1             127.0.0.1             TCP      68     56928 → 6653 [ACK] Seq=1 Ack=1 Win=44032 Len=0 TSval=3195545976 TSecr=3195545976

Frame 37: 68 bytes on wire (544 bits), 68 bytes captured (544 bits) on interface any, id 0
Linux cooked capture
Internet Protocol Version 4, Src: 127.0.0.1, Dst: 127.0.0.1
Transmission Control Protocol, Src Port: 56928, Dst Port: 6653, Seq: 1, Ack: 1, Len: 0

No.     Time           Source                Destination           Protocol Length Info
     38 0.450519294    127.0.0.1             127.0.0.1             OpenFlow 76     Type: OFPT_HELLO

Frame 38: 76 bytes on wire (608 bits), 76 bytes captured (608 bits) on interface any, id 0
Linux cooked capture
Internet Protocol Version 4, Src: 127.0.0.1, Dst: 127.0.0.1
Transmission Control Protocol, Src Port: 6653, Dst Port: 56928, Seq: 1, Ack: 1, Len: 8
OpenFlow 1.3

No.     Time           Source                Destination           Protocol Length Info
     39 0.450677910    127.0.0.1             127.0.0.1             TCP      68     56928 → 6653 [ACK] Seq=1 Ack=9 Win=44032 Len=0 TSval=3195545977 TSecr=3195545977

Frame 39: 68 bytes on wire (544 bits), 68 bytes captured (544 bits) on interface any, id 0
Linux cooked capture
Internet Protocol Version 4, Src: 127.0.0.1, Dst: 127.0.0.1
Transmission Control Protocol, Src Port: 56928, Dst Port: 6653, Seq: 1, Ack: 9, Len: 0

No.     Time           Source                Destination           Protocol Length Info
     40 0.452798883    127.0.0.1             127.0.0.1             OpenFlow 84     Type: OFPT_HELLO

Frame 40: 84 bytes on wire (672 bits), 84 bytes captured (672 bits) on interface any, id 0
Linux cooked capture
Internet Protocol Version 4, Src: 127.0.0.1, Dst: 127.0.0.1
Transmission Control Protocol, Src Port: 56928, Dst Port: 6653, Seq: 1, Ack: 9, Len: 16
OpenFlow 1.3

No.     Time           Source                Destination           Protocol Length Info
     41 0.452815510    127.0.0.1             127.0.0.1             TCP      68     6653 → 56928 [ACK] Seq=9 Ack=17 Win=44032 Len=0 TSval=3195545979 TSecr=3195545979

Frame 41: 68 bytes on wire (544 bits), 68 bytes captured (544 bits) on interface any, id 0
Linux cooked capture
Internet Protocol Version 4, Src: 127.0.0.1, Dst: 127.0.0.1
Transmission Control Protocol, Src Port: 6653, Dst Port: 56928, Seq: 9, Ack: 17, Len: 0

No.     Time           Source                Destination           Protocol Length Info
     42 0.454524984    127.0.0.1             127.0.0.1             OpenFlow 148    Type: OFPT_PORT_STATUS

Frame 42: 148 bytes on wire (1184 bits), 148 bytes captured (1184 bits) on interface any, id 0
Linux cooked capture
Internet Protocol Version 4, Src: 127.0.0.1, Dst: 127.0.0.1
Transmission Control Protocol, Src Port: 56928, Dst Port: 6653, Seq: 17, Ack: 9, Len: 80
OpenFlow 1.3

No.     Time           Source                Destination           Protocol Length Info
     43 0.454539652    127.0.0.1             127.0.0.1             TCP      68     6653 → 56928 [ACK] Seq=9 Ack=97 Win=44032 Len=0 TSval=3195545981 TSecr=3195545981

Frame 43: 68 bytes on wire (544 bits), 68 bytes captured (544 bits) on interface any, id 0
Linux cooked capture
Internet Protocol Version 4, Src: 127.0.0.1, Dst: 127.0.0.1
Transmission Control Protocol, Src Port: 6653, Dst Port: 56928, Seq: 9, Ack: 97, Len: 0

No.     Time           Source                Destination           Protocol Length Info
     44 0.457980721    127.0.0.1             127.0.0.1             OpenFlow 76     Type: OFPT_FEATURES_REQUEST

Frame 44: 76 bytes on wire (608 bits), 76 bytes captured (608 bits) on interface any, id 0
Linux cooked capture
Internet Protocol Version 4, Src: 127.0.0.1, Dst: 127.0.0.1
Transmission Control Protocol, Src Port: 6653, Dst Port: 56928, Seq: 9, Ack: 97, Len: 8
OpenFlow 1.3

No.     Time           Source                Destination           Protocol Length Info
     45 0.463963375    127.0.0.1             127.0.0.1             OpenFlow 100    Type: OFPT_FEATURES_REPLY

Frame 45: 100 bytes on wire (800 bits), 100 bytes captured (800 bits) on interface any, id 0
Linux cooked capture
Internet Protocol Version 4, Src: 127.0.0.1, Dst: 127.0.0.1
Transmission Control Protocol, Src Port: 56928, Dst Port: 6653, Seq: 97, Ack: 17, Len: 32
OpenFlow 1.3

No.     Time           Source                Destination           Protocol Length Info
     46 0.466442632    127.0.0.1             127.0.0.1             OpenFlow 84     Type: OFPT_MULTIPART_REQUEST, OFPMP_PORT_DESC

Frame 46: 84 bytes on wire (672 bits), 84 bytes captured (672 bits) on interface any, id 0
Linux cooked capture
Internet Protocol Version 4, Src: 127.0.0.1, Dst: 127.0.0.1
Transmission Control Protocol, Src Port: 6653, Dst Port: 56928, Seq: 17, Ack: 129, Len: 16
OpenFlow 1.3

No.     Time           Source                Destination           Protocol Length Info
     47 0.466551658    127.0.0.1             127.0.0.1             OpenFlow 148    Type: OFPT_FLOW_MOD

Frame 47: 148 bytes on wire (1184 bits), 148 bytes captured (1184 bits) on interface any, id 0
Linux cooked capture
Internet Protocol Version 4, Src: 127.0.0.1, Dst: 127.0.0.1
Transmission Control Protocol, Src Port: 6653, Dst Port: 56928, Seq: 33, Ack: 129, Len: 80
OpenFlow 1.3

No.     Time           Source                Destination           Protocol Length Info
     48 0.468800609    127.0.0.1             127.0.0.1             OpenFlow 276    Type: OFPT_MULTIPART_REPLY, OFPMP_PORT_DESC

Frame 48: 276 bytes on wire (2208 bits), 276 bytes captured (2208 bits) on interface any, id 0
Linux cooked capture
Internet Protocol Version 4, Src: 127.0.0.1, Dst: 127.0.0.1
Transmission Control Protocol, Src Port: 56928, Dst Port: 6653, Seq: 129, Ack: 113, Len: 208
OpenFlow 1.3

No.     Time           Source                Destination           Protocol Length Info
     49 0.472214546    127.0.0.1             127.0.0.1             OpenFlow 132    Type: OFPT_FLOW_MOD

Frame 49: 132 bytes on wire (1056 bits), 132 bytes captured (1056 bits) on interface any, id 0
Linux cooked capture
Internet Protocol Version 4, Src: 127.0.0.1, Dst: 127.0.0.1
Transmission Control Protocol, Src Port: 6653, Dst Port: 56928, Seq: 113, Ack: 337, Len: 64
OpenFlow 1.3

No.     Time           Source                Destination           Protocol Length Info
     50 0.512401241    127.0.0.1             127.0.0.1             TCP      68     56928 → 6653 [ACK] Seq=337 Ack=177 Win=44032 Len=0 TSval=3195546038 TSecr=3195545998

Frame 50: 68 bytes on wire (544 bits), 68 bytes captured (544 bits) on interface any, id 0
Linux cooked capture
Internet Protocol Version 4, Src: 127.0.0.1, Dst: 127.0.0.1
Transmission Control Protocol, Src Port: 56928, Dst Port: 6653, Seq: 337, Ack: 177, Len: 0

No.     Time           Source                Destination           Protocol Length Info
     51 0.604667963    ::                    ff02::16              ICMPv6   112    Multicast Listener Report Message v2

Frame 51: 112 bytes on wire (896 bits), 112 bytes captured (896 bits) on interface any, id 0
Linux cooked capture
Internet Protocol Version 6, Src: ::, Dst: ff02::16
Internet Control Message Protocol v6

No.     Time           Source                Destination           Protocol Length Info
     52 0.605054070    127.0.0.1             127.0.0.1             OpenFlow 220    Type: OFPT_PACKET_IN

Frame 52: 220 bytes on wire (1760 bits), 220 bytes captured (1760 bits) on interface any, id 0
Linux cooked capture
Internet Protocol Version 4, Src: 127.0.0.1, Dst: 127.0.0.1
Transmission Control Protocol, Src Port: 56928, Dst Port: 6653, Seq: 337, Ack: 177, Len: 152
OpenFlow 1.3

No.     Time           Source                Destination           Protocol Length Info
     53 0.605962751    127.0.0.1             127.0.0.1             OpenFlow 218    Type: OFPT_PACKET_OUT

Frame 53: 218 bytes on wire (1744 bits), 218 bytes captured (1744 bits) on interface any, id 0
Linux cooked capture
Internet Protocol Version 4, Src: 127.0.0.1, Dst: 127.0.0.1
Transmission Control Protocol, Src Port: 6653, Dst Port: 56928, Seq: 177, Ack: 489, Len: 150
OpenFlow 1.3

No.     Time           Source                Destination           Protocol Length Info
     54 0.605975930    127.0.0.1             127.0.0.1             TCP      68     56928 → 6653 [ACK] Seq=489 Ack=327 Win=44032 Len=0 TSval=3195546132 TSecr=3195546132

Frame 54: 68 bytes on wire (544 bits), 68 bytes captured (544 bits) on interface any, id 0
Linux cooked capture
Internet Protocol Version 4, Src: 127.0.0.1, Dst: 127.0.0.1
Transmission Control Protocol, Src Port: 56928, Dst Port: 6653, Seq: 489, Ack: 327, Len: 0

No.     Time           Source                Destination           Protocol Length Info
     55 0.606297784    ::                    ff02::16              ICMPv6   112    Multicast Listener Report Message v2

Frame 55: 112 bytes on wire (896 bits), 112 bytes captured (896 bits) on interface any, id 0
Linux cooked capture
Internet Protocol Version 6, Src: ::, Dst: ff02::16
Internet Control Message Protocol v6

No.     Time           Source                Destination           Protocol Length Info
     56 0.748729284    ::                    ff02::1:ff00:2        ICMPv6   88     Neighbor Solicitation for fe80::200:ff:fe00:2

Frame 56: 88 bytes on wire (704 bits), 88 bytes captured (704 bits) on interface any, id 0
Linux cooked capture
Internet Protocol Version 6, Src: ::, Dst: ff02::1:ff00:2
Internet Control Message Protocol v6

No.     Time           Source                Destination           Protocol Length Info
     57 0.749469812    127.0.0.1             127.0.0.1             OpenFlow 196    Type: OFPT_PACKET_IN

Frame 57: 196 bytes on wire (1568 bits), 196 bytes captured (1568 bits) on interface any, id 0
Linux cooked capture
Internet Protocol Version 4, Src: 127.0.0.1, Dst: 127.0.0.1
Transmission Control Protocol, Src Port: 56928, Dst Port: 6653, Seq: 489, Ack: 327, Len: 128
OpenFlow 1.3

No.     Time           Source                Destination           Protocol Length Info
     58 0.750130546    127.0.0.1             127.0.0.1             OpenFlow 194    Type: OFPT_PACKET_OUT

Frame 58: 194 bytes on wire (1552 bits), 194 bytes captured (1552 bits) on interface any, id 0
Linux cooked capture
Internet Protocol Version 4, Src: 127.0.0.1, Dst: 127.0.0.1
Transmission Control Protocol, Src Port: 6653, Dst Port: 56928, Seq: 327, Ack: 617, Len: 126
OpenFlow 1.3

No.     Time           Source                Destination           Protocol Length Info
     59 0.750142660    127.0.0.1             127.0.0.1             TCP      68     56928 → 6653 [ACK] Seq=617 Ack=453 Win=44032 Len=0 TSval=3195546276 TSecr=3195546276

Frame 59: 68 bytes on wire (544 bits), 68 bytes captured (544 bits) on interface any, id 0
Linux cooked capture
Internet Protocol Version 4, Src: 127.0.0.1, Dst: 127.0.0.1
Transmission Control Protocol, Src Port: 56928, Dst Port: 6653, Seq: 617, Ack: 453, Len: 0

No.     Time           Source                Destination           Protocol Length Info
     60 0.750548204    ::                    ff02::1:ff00:2        ICMPv6   88     Neighbor Solicitation for fe80::200:ff:fe00:2

Frame 60: 88 bytes on wire (704 bits), 88 bytes captured (704 bits) on interface any, id 0
Linux cooked capture
Internet Protocol Version 6, Src: ::, Dst: ff02::1:ff00:2
Internet Control Message Protocol v6

No.     Time           Source                Destination           Protocol Length Info
     61 0.811860333    ::                    ff02::1:ffea:f7f      ICMPv6   88     Neighbor Solicitation for fe80::84:caff:feea:f7f

Frame 61: 88 bytes on wire (704 bits), 88 bytes captured (704 bits) on interface any, id 0
Linux cooked capture
Internet Protocol Version 6, Src: ::, Dst: ff02::1:ffea:f7f
Internet Control Message Protocol v6

No.     Time           Source                Destination           Protocol Length Info
     62 0.844025966    ::                    ff02::16              ICMPv6   92     Multicast Listener Report Message v2

Frame 62: 92 bytes on wire (736 bits), 92 bytes captured (736 bits) on interface any, id 0
Linux cooked capture
Internet Protocol Version 6, Src: ::, Dst: ff02::16
Internet Control Message Protocol v6

No.     Time           Source                Destination           Protocol Length Info
     63 0.876223379    ::                    ff02::16              ICMPv6   92     Multicast Listener Report Message v2

Frame 63: 92 bytes on wire (736 bits), 92 bytes captured (736 bits) on interface any, id 0
Linux cooked capture
Internet Protocol Version 6, Src: ::, Dst: ff02::16
Internet Control Message Protocol v6

No.     Time           Source                Destination           Protocol Length Info
     64 0.876386530    ::                    ff02::1:ff0c:456c     ICMPv6   88     Neighbor Solicitation for fe80::85c:ceff:fe0c:456c

Frame 64: 88 bytes on wire (704 bits), 88 bytes captured (704 bits) on interface any, id 0
Linux cooked capture
Internet Protocol Version 6, Src: ::, Dst: ff02::1:ff0c:456c
Internet Control Message Protocol v6

No.     Time           Source                Destination           Protocol Length Info
     65 1.067672194    ::                    ff02::1:ff00:1        ICMPv6   88     Neighbor Solicitation for fe80::200:ff:fe00:1

Frame 65: 88 bytes on wire (704 bits), 88 bytes captured (704 bits) on interface any, id 0
Linux cooked capture
Internet Protocol Version 6, Src: ::, Dst: ff02::1:ff00:1
Internet Control Message Protocol v6

No.     Time           Source                Destination           Protocol Length Info
     66 1.068329582    127.0.0.1             127.0.0.1             OpenFlow 196    Type: OFPT_PACKET_IN

Frame 66: 196 bytes on wire (1568 bits), 196 bytes captured (1568 bits) on interface any, id 0
Linux cooked capture
Internet Protocol Version 4, Src: 127.0.0.1, Dst: 127.0.0.1
Transmission Control Protocol, Src Port: 56928, Dst Port: 6653, Seq: 617, Ack: 453, Len: 128
OpenFlow 1.3

No.     Time           Source                Destination           Protocol Length Info
     67 1.069782893    127.0.0.1             127.0.0.1             OpenFlow 194    Type: OFPT_PACKET_OUT

Frame 67: 194 bytes on wire (1552 bits), 194 bytes captured (1552 bits) on interface any, id 0
Linux cooked capture
Internet Protocol Version 4, Src: 127.0.0.1, Dst: 127.0.0.1
Transmission Control Protocol, Src Port: 6653, Dst Port: 56928, Seq: 453, Ack: 745, Len: 126
OpenFlow 1.3

No.     Time           Source                Destination           Protocol Length Info
     68 1.069795181    127.0.0.1             127.0.0.1             TCP      68     56928 → 6653 [ACK] Seq=745 Ack=579 Win=44032 Len=0 TSval=3195546596 TSecr=3195546596

Frame 68: 68 bytes on wire (544 bits), 68 bytes captured (544 bits) on interface any, id 0
Linux cooked capture
Internet Protocol Version 4, Src: 127.0.0.1, Dst: 127.0.0.1
Transmission Control Protocol, Src Port: 56928, Dst Port: 6653, Seq: 745, Ack: 579, Len: 0

No.     Time           Source                Destination           Protocol Length Info
     69 1.070233179    ::                    ff02::1:ff00:1        ICMPv6   88     Neighbor Solicitation for fe80::200:ff:fe00:1

Frame 69: 88 bytes on wire (704 bits), 88 bytes captured (704 bits) on interface any, id 0
Linux cooked capture
Internet Protocol Version 6, Src: ::, Dst: ff02::1:ff00:1
Internet Control Message Protocol v6

No.     Time           Source                Destination           Protocol Length Info
     70 1.293015057    ::                    ff02::16              ICMPv6   112    Multicast Listener Report Message v2

Frame 70: 112 bytes on wire (896 bits), 112 bytes captured (896 bits) on interface any, id 0
Linux cooked capture
Internet Protocol Version 6, Src: ::, Dst: ff02::16
Internet Control Message Protocol v6

No.     Time           Source                Destination           Protocol Length Info
     71 1.293494070    127.0.0.1             127.0.0.1             OpenFlow 220    Type: OFPT_PACKET_IN

Frame 71: 220 bytes on wire (1760 bits), 220 bytes captured (1760 bits) on interface any, id 0
Linux cooked capture
Internet Protocol Version 4, Src: 127.0.0.1, Dst: 127.0.0.1
Transmission Control Protocol, Src Port: 56928, Dst Port: 6653, Seq: 745, Ack: 579, Len: 152
OpenFlow 1.3

No.     Time           Source                Destination           Protocol Length Info
     72 1.294290928    127.0.0.1             127.0.0.1             OpenFlow 218    Type: OFPT_PACKET_OUT

Frame 72: 218 bytes on wire (1744 bits), 218 bytes captured (1744 bits) on interface any, id 0
Linux cooked capture
Internet Protocol Version 4, Src: 127.0.0.1, Dst: 127.0.0.1
Transmission Control Protocol, Src Port: 6653, Dst Port: 56928, Seq: 579, Ack: 897, Len: 150
OpenFlow 1.3

No.     Time           Source                Destination           Protocol Length Info
     73 1.294301334    127.0.0.1             127.0.0.1             TCP      68     56928 → 6653 [ACK] Seq=897 Ack=729 Win=44032 Len=0 TSval=3195546820 TSecr=3195546820

Frame 73: 68 bytes on wire (544 bits), 68 bytes captured (544 bits) on interface any, id 0
Linux cooked capture
Internet Protocol Version 4, Src: 127.0.0.1, Dst: 127.0.0.1
Transmission Control Protocol, Src Port: 56928, Dst Port: 6653, Seq: 897, Ack: 729, Len: 0

No.     Time           Source                Destination           Protocol Length Info
     74 1.294603144    ::                    ff02::16              ICMPv6   112    Multicast Listener Report Message v2

Frame 74: 112 bytes on wire (896 bits), 112 bytes captured (896 bits) on interface any, id 0
Linux cooked capture
Internet Protocol Version 6, Src: ::, Dst: ff02::16
Internet Control Message Protocol v6

No.     Time           Source                Destination           Protocol Length Info
     75 1.771709003    fe80::200:ff:fe00:2   ff02::16              ICMPv6   92     Multicast Listener Report Message v2

Frame 75: 92 bytes on wire (736 bits), 92 bytes captured (736 bits) on interface any, id 0
Linux cooked capture
Internet Protocol Version 6, Src: fe80::200:ff:fe00:2, Dst: ff02::16
Internet Control Message Protocol v6

No.     Time           Source                Destination           Protocol Length Info
     76 1.771812472    fe80::200:ff:fe00:2   ff02::2               ICMPv6   72     Router Solicitation from 00:00:00:00:00:02

Frame 76: 72 bytes on wire (576 bits), 72 bytes captured (576 bits) on interface any, id 0
Linux cooked capture
Internet Protocol Version 6, Src: fe80::200:ff:fe00:2, Dst: ff02::2
Internet Control Message Protocol v6

No.     Time           Source                Destination           Protocol Length Info
     77 1.772090315    127.0.0.1             127.0.0.1             OpenFlow 200    Type: OFPT_PACKET_IN

Frame 77: 200 bytes on wire (1600 bits), 200 bytes captured (1600 bits) on interface any, id 0
Linux cooked capture
Internet Protocol Version 4, Src: 127.0.0.1, Dst: 127.0.0.1
Transmission Control Protocol, Src Port: 56928, Dst Port: 6653, Seq: 897, Ack: 729, Len: 132
OpenFlow 1.3

No.     Time           Source                Destination           Protocol Length Info
     78 1.772118347    127.0.0.1             127.0.0.1             OpenFlow 180    Type: OFPT_PACKET_IN

Frame 78: 180 bytes on wire (1440 bits), 180 bytes captured (1440 bits) on interface any, id 0
Linux cooked capture
Internet Protocol Version 4, Src: 127.0.0.1, Dst: 127.0.0.1
Transmission Control Protocol, Src Port: 56928, Dst Port: 6653, Seq: 1029, Ack: 729, Len: 112
OpenFlow 1.3

No.     Time           Source                Destination           Protocol Length Info
     79 1.772492376    127.0.0.1             127.0.0.1             TCP      68     6653 → 56928 [ACK] Seq=729 Ack=1141 Win=44032 Len=0 TSval=3195547299 TSecr=3195547298

Frame 79: 68 bytes on wire (544 bits), 68 bytes captured (544 bits) on interface any, id 0
Linux cooked capture
Internet Protocol Version 4, Src: 127.0.0.1, Dst: 127.0.0.1
Transmission Control Protocol, Src Port: 6653, Dst Port: 56928, Seq: 729, Ack: 1141, Len: 0

No.     Time           Source                Destination           Protocol Length Info
     80 1.773182806    127.0.0.1             127.0.0.1             OpenFlow 198    Type: OFPT_PACKET_OUT

Frame 80: 198 bytes on wire (1584 bits), 198 bytes captured (1584 bits) on interface any, id 0
Linux cooked capture
Internet Protocol Version 4, Src: 127.0.0.1, Dst: 127.0.0.1
Transmission Control Protocol, Src Port: 6653, Dst Port: 56928, Seq: 729, Ack: 1141, Len: 130
OpenFlow 1.3

No.     Time           Source                Destination           Protocol Length Info
     81 1.773189644    127.0.0.1             127.0.0.1             TCP      68     56928 → 6653 [ACK] Seq=1141 Ack=859 Win=44032 Len=0 TSval=3195547299 TSecr=3195547299

Frame 81: 68 bytes on wire (544 bits), 68 bytes captured (544 bits) on interface any, id 0
Linux cooked capture
Internet Protocol Version 4, Src: 127.0.0.1, Dst: 127.0.0.1
Transmission Control Protocol, Src Port: 56928, Dst Port: 6653, Seq: 1141, Ack: 859, Len: 0

No.     Time           Source                Destination           Protocol Length Info
     82 1.773337648    fe80::200:ff:fe00:2   ff02::16              ICMPv6   92     Multicast Listener Report Message v2

Frame 82: 92 bytes on wire (736 bits), 92 bytes captured (736 bits) on interface any, id 0
Linux cooked capture
Internet Protocol Version 6, Src: fe80::200:ff:fe00:2, Dst: ff02::16
Internet Control Message Protocol v6

No.     Time           Source                Destination           Protocol Length Info
     83 1.773445493    127.0.0.1             127.0.0.1             OpenFlow 178    Type: OFPT_PACKET_OUT

Frame 83: 178 bytes on wire (1424 bits), 178 bytes captured (1424 bits) on interface any, id 0
Linux cooked capture
Internet Protocol Version 4, Src: 127.0.0.1, Dst: 127.0.0.1
Transmission Control Protocol, Src Port: 6653, Dst Port: 56928, Seq: 859, Ack: 1141, Len: 110
OpenFlow 1.3

No.     Time           Source                Destination           Protocol Length Info
     84 1.773448398    127.0.0.1             127.0.0.1             TCP      68     56928 → 6653 [ACK] Seq=1141 Ack=969 Win=44032 Len=0 TSval=3195547299 TSecr=3195547299

Frame 84: 68 bytes on wire (544 bits), 68 bytes captured (544 bits) on interface any, id 0
Linux cooked capture
Internet Protocol Version 4, Src: 127.0.0.1, Dst: 127.0.0.1
