No.     Time           Source                Destination           Protocol Length Info
      1 0.000000000    PcsCompu_65:bf:23                           ARP      44     Who has 10.0.2.2? Tell 10.0.2.15

Frame 1: 44 bytes on wire (352 bits), 44 bytes captured (352 bits) on interface any, id 0
Linux cooked capture
Address Resolution Protocol (request)

No.     Time           Source                Destination           Protocol Length Info
      2 0.001372420    RealtekU_12:35:02                           ARP      62     10.0.2.2 is at 52:54:00:12:35:02

Frame 2: 62 bytes on wire (496 bits), 62 bytes captured (496 bits) on interface any, id 0
Linux cooked capture
Address Resolution Protocol (reply)
VSS Monitoring Ethernet trailer, Source Port: 0

No.     Time           Source                Destination           Protocol Length Info
      3 4.428431973    127.0.0.1             127.0.0.1             TCP      76     46792 → 6653 [SYN] Seq=0 Win=43690 Len=0 MSS=65495 SACK_PERM=1 TSval=3195617198 TSecr=0 WS=512

Frame 3: 76 bytes on wire (608 bits), 76 bytes captured (608 bits) on interface any, id 0
Linux cooked capture
Internet Protocol Version 4, Src: 127.0.0.1, Dst: 127.0.0.1
Transmission Control Protocol, Src Port: 46792, Dst Port: 6653, Seq: 0, Len: 0

No.     Time           Source                Destination           Protocol Length Info
      4 4.428448771    127.0.0.1             127.0.0.1             TCP      76     6653 → 46792 [SYN, ACK] Seq=0 Ack=1 Win=43690 Len=0 MSS=65495 SACK_PERM=1 TSval=3195617198 TSecr=3195617198 WS=512

Frame 4: 76 bytes on wire (608 bits), 76 bytes captured (608 bits) on interface any, id 0
Linux cooked capture
Internet Protocol Version 4, Src: 127.0.0.1, Dst: 127.0.0.1
Transmission Control Protocol, Src Port: 6653, Dst Port: 46792, Seq: 0, Ack: 1, Len: 0

No.     Time           Source                Destination           Protocol Length Info
      5 4.428459174    127.0.0.1             127.0.0.1             TCP      68     46792 → 6653 [ACK] Seq=1 Ack=1 Win=44032 Len=0 TSval=3195617198 TSecr=3195617198

Frame 5: 68 bytes on wire (544 bits), 68 bytes captured (544 bits) on interface any, id 0
Linux cooked capture
Internet Protocol Version 4, Src: 127.0.0.1, Dst: 127.0.0.1
Transmission Control Protocol, Src Port: 46792, Dst Port: 6653, Seq: 1, Ack: 1, Len: 0

No.     Time           Source                Destination           Protocol Length Info
      6 4.429522547    127.0.0.1             127.0.0.1             OpenFlow 76     Type: OFPT_HELLO

Frame 6: 76 bytes on wire (608 bits), 76 bytes captured (608 bits) on interface any, id 0
Linux cooked capture
Internet Protocol Version 4, Src: 127.0.0.1, Dst: 127.0.0.1
Transmission Control Protocol, Src Port: 6653, Dst Port: 46792, Seq: 1, Ack: 1, Len: 8
OpenFlow 1.3

No.     Time           Source                Destination           Protocol Length Info
      7 4.430953295    127.0.0.1             127.0.0.1             TCP      68     46792 → 6653 [ACK] Seq=1 Ack=9 Win=44032 Len=0 TSval=3195617201 TSecr=3195617199

Frame 7: 68 bytes on wire (544 bits), 68 bytes captured (544 bits) on interface any, id 0
Linux cooked capture
Internet Protocol Version 4, Src: 127.0.0.1, Dst: 127.0.0.1
Transmission Control Protocol, Src Port: 46792, Dst Port: 6653, Seq: 1, Ack: 9, Len: 0

No.     Time           Source                Destination           Protocol Length Info
      8 4.431414357    127.0.0.1             127.0.0.1             TCP      68     46792 → 6653 [FIN, ACK] Seq=1 Ack=9 Win=44032 Len=0 TSval=3195617201 TSecr=3195617199

Frame 8: 68 bytes on wire (544 bits), 68 bytes captured (544 bits) on interface any, id 0
Linux cooked capture
Internet Protocol Version 4, Src: 127.0.0.1, Dst: 127.0.0.1
Transmission Control Protocol, Src Port: 46792, Dst Port: 6653, Seq: 1, Ack: 9, Len: 0

No.     Time           Source                Destination           Protocol Length Info
      9 4.432487308    127.0.0.1             127.0.0.1             TCP      68     6653 → 46792 [FIN, ACK] Seq=9 Ack=2 Win=44032 Len=0 TSval=3195617202 TSecr=3195617201

Frame 9: 68 bytes on wire (544 bits), 68 bytes captured (544 bits) on interface any, id 0
Linux cooked capture
Internet Protocol Version 4, Src: 127.0.0.1, Dst: 127.0.0.1
Transmission Control Protocol, Src Port: 6653, Dst Port: 46792, Seq: 9, Ack: 2, Len: 0

No.     Time           Source                Destination           Protocol Length Info
     10 4.432510820    127.0.0.1             127.0.0.1             TCP      68     46792 → 6653 [ACK] Seq=2 Ack=10 Win=44032 Len=0 TSval=3195617202 TSecr=3195617202

Frame 10: 68 bytes on wire (544 bits), 68 bytes captured (544 bits) on interface any, id 0
Linux cooked capture
Internet Protocol Version 4, Src: 127.0.0.1, Dst: 127.0.0.1
Transmission Control Protocol, Src Port: 46792, Dst Port: 6653, Seq: 2, Ack: 10, Len: 0

No.     Time           Source                Destination           Protocol Length Info
     11 4.573530933    ::                    ff02::16              ICMPv6   92     Multicast Listener Report Message v2

Frame 11: 92 bytes on wire (736 bits), 92 bytes captured (736 bits) on interface any, id 0
Linux cooked capture
Internet Protocol Version 6, Src: ::, Dst: ff02::16
Internet Control Message Protocol v6

No.     Time           Source                Destination           Protocol Length Info
     12 4.573551372    ::                    ff02::16              ICMPv6   92     Multicast Listener Report Message v2

Frame 12: 92 bytes on wire (736 bits), 92 bytes captured (736 bits) on interface any, id 0
Linux cooked capture
Internet Protocol Version 6, Src: ::, Dst: ff02::16
Internet Control Message Protocol v6

No.     Time           Source                Destination           Protocol Length Info
     13 4.629127335    ::                    ff02::16              ICMPv6   92     Multicast Listener Report Message v2

Frame 13: 92 bytes on wire (736 bits), 92 bytes captured (736 bits) on interface any, id 0
Linux cooked capture
Internet Protocol Version 6, Src: ::, Dst: ff02::16
Internet Control Message Protocol v6

No.     Time           Source                Destination           Protocol Length Info
     14 4.629151494    ::                    ff02::16              ICMPv6   92     Multicast Listener Report Message v2

Frame 14: 92 bytes on wire (736 bits), 92 bytes captured (736 bits) on interface any, id 0
Linux cooked capture
Internet Protocol Version 6, Src: ::, Dst: ff02::16
Internet Control Message Protocol v6

No.     Time           Source                Destination           Protocol Length Info
     15 4.680794795    ::                    ff02::16              ICMPv6   92     Multicast Listener Report Message v2

Frame 15: 92 bytes on wire (736 bits), 92 bytes captured (736 bits) on interface any, id 0
Linux cooked capture
Internet Protocol Version 6, Src: ::, Dst: ff02::16
Internet Control Message Protocol v6

No.     Time           Source                Destination           Protocol Length Info
     16 4.680811087    ::                    ff02::16              ICMPv6   112    Multicast Listener Report Message v2

Frame 16: 112 bytes on wire (896 bits), 112 bytes captured (896 bits) on interface any, id 0
Linux cooked capture
Internet Protocol Version 6, Src: ::, Dst: ff02::16
Internet Control Message Protocol v6

No.     Time           Source                Destination           Protocol Length Info
     17 4.684631770    127.0.0.1             127.0.0.1             TCP      76     42720 → 5037 [SYN] Seq=0 Win=43690 Len=0 MSS=65495 SACK_PERM=1 TSval=3195617454 TSecr=0 WS=512

Frame 17: 76 bytes on wire (608 bits), 76 bytes captured (608 bits) on interface any, id 0
Linux cooked capture
Internet Protocol Version 4, Src: 127.0.0.1, Dst: 127.0.0.1
Transmission Control Protocol, Src Port: 42720, Dst Port: 5037, Seq: 0, Len: 0

No.     Time           Source                Destination           Protocol Length Info
     18 4.684645869    127.0.0.1             127.0.0.1             TCP      56     5037 → 42720 [RST, ACK] Seq=1 Ack=1 Win=0 Len=0

Frame 18: 56 bytes on wire (448 bits), 56 bytes captured (448 bits) on interface any, id 0
Linux cooked capture
Internet Protocol Version 4, Src: 127.0.0.1, Dst: 127.0.0.1
Transmission Control Protocol, Src Port: 5037, Dst Port: 42720, Seq: 1, Ack: 1, Len: 0

No.     Time           Source                Destination           Protocol Length Info
     19 4.686740884    127.0.0.1             127.0.0.1             TCP      76     42734 → 5037 [SYN] Seq=0 Win=43690 Len=0 MSS=65495 SACK_PERM=1 TSval=3195617456 TSecr=0 WS=512

Frame 19: 76 bytes on wire (608 bits), 76 bytes captured (608 bits) on interface any, id 0
Linux cooked capture
Internet Protocol Version 4, Src: 127.0.0.1, Dst: 127.0.0.1
Transmission Control Protocol, Src Port: 42734, Dst Port: 5037, Seq: 0, Len: 0

No.     Time           Source                Destination           Protocol Length Info
     20 4.686758070    127.0.0.1             127.0.0.1             TCP      56     5037 → 42734 [RST, ACK] Seq=1 Ack=1 Win=0 Len=0

Frame 20: 56 bytes on wire (448 bits), 56 bytes captured (448 bits) on interface any, id 0
Linux cooked capture
Internet Protocol Version 4, Src: 127.0.0.1, Dst: 127.0.0.1
Transmission Control Protocol, Src Port: 5037, Dst Port: 42734, Seq: 1, Ack: 1, Len: 0

No.     Time           Source                Destination           Protocol Length Info
     21 4.693614951    127.0.0.1             127.0.0.1             TCP      76     42744 → 5037 [SYN] Seq=0 Win=43690 Len=0 MSS=65495 SACK_PERM=1 TSval=3195617463 TSecr=0 WS=512

Frame 21: 76 bytes on wire (608 bits), 76 bytes captured (608 bits) on interface any, id 0
Linux cooked capture
Internet Protocol Version 4, Src: 127.0.0.1, Dst: 127.0.0.1
Transmission Control Protocol, Src Port: 42744, Dst Port: 5037, Seq: 0, Len: 0

No.     Time           Source                Destination           Protocol Length Info
     22 4.693626812    127.0.0.1             127.0.0.1             TCP      56     5037 → 42744 [RST, ACK] Seq=1 Ack=1 Win=0 Len=0

Frame 22: 56 bytes on wire (448 bits), 56 bytes captured (448 bits) on interface any, id 0
Linux cooked capture
Internet Protocol Version 4, Src: 127.0.0.1, Dst: 127.0.0.1
Transmission Control Protocol, Src Port: 5037, Dst Port: 42744, Seq: 1, Ack: 1, Len: 0

No.     Time           Source                Destination           Protocol Length Info
     23 4.694836430    127.0.0.1             127.0.0.1             TCP      76     42754 → 5037 [SYN] Seq=0 Win=43690 Len=0 MSS=65495 SACK_PERM=1 TSval=3195617464 TSecr=0 WS=512

Frame 23: 76 bytes on wire (608 bits), 76 bytes captured (608 bits) on interface any, id 0
Linux cooked capture
Internet Protocol Version 4, Src: 127.0.0.1, Dst: 127.0.0.1
Transmission Control Protocol, Src Port: 42754, Dst Port: 5037, Seq: 0, Len: 0

No.     Time           Source                Destination           Protocol Length Info
     24 4.694845434    127.0.0.1             127.0.0.1             TCP      56     5037 → 42754 [RST, ACK] Seq=1 Ack=1 Win=0 Len=0

Frame 24: 56 bytes on wire (448 bits), 56 bytes captured (448 bits) on interface any, id 0
Linux cooked capture
Internet Protocol Version 4, Src: 127.0.0.1, Dst: 127.0.0.1
Transmission Control Protocol, Src Port: 5037, Dst Port: 42754, Seq: 1, Ack: 1, Len: 0

No.     Time           Source                Destination           Protocol Length Info
     25 4.697164961    127.0.0.1             127.0.0.1             TCP      76     42770 → 5037 [SYN] Seq=0 Win=43690 Len=0 MSS=65495 SACK_PERM=1 TSval=3195617467 TSecr=0 WS=512

Frame 25: 76 bytes on wire (608 bits), 76 bytes captured (608 bits) on interface any, id 0
Linux cooked capture
Internet Protocol Version 4, Src: 127.0.0.1, Dst: 127.0.0.1
Transmission Control Protocol, Src Port: 42770, Dst Port: 5037, Seq: 0, Len: 0

No.     Time           Source                Destination           Protocol Length Info
     26 4.697176202    127.0.0.1             127.0.0.1             TCP      56     5037 → 42770 [RST, ACK] Seq=1 Ack=1 Win=0 Len=0

Frame 26: 56 bytes on wire (448 bits), 56 bytes captured (448 bits) on interface any, id 0
Linux cooked capture
Internet Protocol Version 4, Src: 127.0.0.1, Dst: 127.0.0.1
Transmission Control Protocol, Src Port: 5037, Dst Port: 42770, Seq: 1, Ack: 1, Len: 0

No.     Time           Source                Destination           Protocol Length Info
     27 4.698646862    127.0.0.1             127.0.0.1             TCP      76     42784 → 5037 [SYN] Seq=0 Win=43690 Len=0 MSS=65495 SACK_PERM=1 TSval=3195617468 TSecr=0 WS=512

Frame 27: 76 bytes on wire (608 bits), 76 bytes captured (608 bits) on interface any, id 0
Linux cooked capture
Internet Protocol Version 4, Src: 127.0.0.1, Dst: 127.0.0.1
Transmission Control Protocol, Src Port: 42784, Dst Port: 5037, Seq: 0, Len: 0

No.     Time           Source                Destination           Protocol Length Info
     28 4.698671084    127.0.0.1             127.0.0.1             TCP      56     5037 → 42784 [RST, ACK] Seq=1 Ack=1 Win=0 Len=0

Frame 28: 56 bytes on wire (448 bits), 56 bytes captured (448 bits) on interface any, id 0
Linux cooked capture
Internet Protocol Version 4, Src: 127.0.0.1, Dst: 127.0.0.1
Transmission Control Protocol, Src Port: 5037, Dst Port: 42784, Seq: 1, Ack: 1, Len: 0

No.     Time           Source                Destination           Protocol Length Info
     29 4.700025682    127.0.0.1             127.0.0.1             TCP      76     42796 → 5037 [SYN] Seq=0 Win=43690 Len=0 MSS=65495 SACK_PERM=1 TSval=3195617469 TSecr=0 WS=512

Frame 29: 76 bytes on wire (608 bits), 76 bytes captured (608 bits) on interface any, id 0
Linux cooked capture
Internet Protocol Version 4, Src: 127.0.0.1, Dst: 127.0.0.1
Transmission Control Protocol, Src Port: 42796, Dst Port: 5037, Seq: 0, Len: 0

No.     Time           Source                Destination           Protocol Length Info
     30 4.700038391    127.0.0.1             127.0.0.1             TCP      56     5037 → 42796 [RST, ACK] Seq=1 Ack=1 Win=0 Len=0

Frame 30: 56 bytes on wire (448 bits), 56 bytes captured (448 bits) on interface any, id 0
Linux cooked capture
Internet Protocol Version 4, Src: 127.0.0.1, Dst: 127.0.0.1
Transmission Control Protocol, Src Port: 5037, Dst Port: 42796, Seq: 1, Ack: 1, Len: 0

No.     Time           Source                Destination           Protocol Length Info
     31 4.702399361    127.0.0.1             127.0.0.1             TCP      76     42808 → 5037 [SYN] Seq=0 Win=43690 Len=0 MSS=65495 SACK_PERM=1 TSval=3195617472 TSecr=0 WS=512

Frame 31: 76 bytes on wire (608 bits), 76 bytes captured (608 bits) on interface any, id 0
Linux cooked capture
Internet Protocol Version 4, Src: 127.0.0.1, Dst: 127.0.0.1
Transmission Control Protocol, Src Port: 42808, Dst Port: 5037, Seq: 0, Len: 0

No.     Time           Source                Destination           Protocol Length Info
     32 4.702423153    127.0.0.1             127.0.0.1             TCP      56     5037 → 42808 [RST, ACK] Seq=1 Ack=1 Win=0 Len=0

Frame 32: 56 bytes on wire (448 bits), 56 bytes captured (448 bits) on interface any, id 0
Linux cooked capture
Internet Protocol Version 4, Src: 127.0.0.1, Dst: 127.0.0.1
Transmission Control Protocol, Src Port: 5037, Dst Port: 42808, Seq: 1, Ack: 1, Len: 0

No.     Time           Source                Destination           Protocol Length Info
     33 4.704559851    127.0.0.1             127.0.0.1             TCP      76     42822 → 5037 [SYN] Seq=0 Win=43690 Len=0 MSS=65495 SACK_PERM=1 TSval=3195617474 TSecr=0 WS=512

Frame 33: 76 bytes on wire (608 bits), 76 bytes captured (608 bits) on interface any, id 0
Linux cooked capture
Internet Protocol Version 4, Src: 127.0.0.1, Dst: 127.0.0.1
Transmission Control Protocol, Src Port: 42822, Dst Port: 5037, Seq: 0, Len: 0

No.     Time           Source                Destination           Protocol Length Info
     34 4.704599312    127.0.0.1             127.0.0.1             TCP      56     5037 → 42822 [RST, ACK] Seq=1 Ack=1 Win=0 Len=0

Frame 34: 56 bytes on wire (448 bits), 56 bytes captured (448 bits) on interface any, id 0
Linux cooked capture
Internet Protocol Version 4, Src: 127.0.0.1, Dst: 127.0.0.1
Transmission Control Protocol, Src Port: 5037, Dst Port: 42822, Seq: 1, Ack: 1, Len: 0

No.     Time           Source                Destination           Protocol Length Info
     35 4.708807338    127.0.0.1             127.0.0.1             TCP      76     42834 → 5037 [SYN] Seq=0 Win=43690 Len=0 MSS=65495 SACK_PERM=1 TSval=3195617478 TSecr=0 WS=512

Frame 35: 76 bytes on wire (608 bits), 76 bytes captured (608 bits) on interface any, id 0
Linux cooked capture
Internet Protocol Version 4, Src: 127.0.0.1, Dst: 127.0.0.1
Transmission Control Protocol, Src Port: 42834, Dst Port: 5037, Seq: 0, Len: 0

No.     Time           Source                Destination           Protocol Length Info
     36 4.708832115    127.0.0.1             127.0.0.1             TCP      56     5037 → 42834 [RST, ACK] Seq=1 Ack=1 Win=0 Len=0

Frame 36: 56 bytes on wire (448 bits), 56 bytes captured (448 bits) on interface any, id 0
Linux cooked capture
Internet Protocol Version 4, Src: 127.0.0.1, Dst: 127.0.0.1
Transmission Control Protocol, Src Port: 5037, Dst Port: 42834, Seq: 1, Ack: 1, Len: 0

No.     Time           Source                Destination           Protocol Length Info
     37 4.738143897    ::                    ff02::16              ICMPv6   92     Multicast Listener Report Message v2

Frame 37: 92 bytes on wire (736 bits), 92 bytes captured (736 bits) on interface any, id 0
Linux cooked capture
Internet Protocol Version 6, Src: ::, Dst: ff02::16
Internet Control Message Protocol v6

No.     Time           Source                Destination           Protocol Length Info
     38 4.738162190    ::                    ff02::16              ICMPv6   112    Multicast Listener Report Message v2

Frame 38: 112 bytes on wire (896 bits), 112 bytes captured (896 bits) on interface any, id 0
Linux cooked capture
Internet Protocol Version 6, Src: ::, Dst: ff02::16
Internet Control Message Protocol v6

No.     Time           Source                Destination           Protocol Length Info
     39 4.833434512    127.0.0.1             127.0.0.1             TCP      76     46794 → 6653 [SYN] Seq=0 Win=43690 Len=0 MSS=65495 SACK_PERM=1 TSval=3195617603 TSecr=0 WS=512

Frame 39: 76 bytes on wire (608 bits), 76 bytes captured (608 bits) on interface any, id 0
Linux cooked capture
Internet Protocol Version 4, Src: 127.0.0.1, Dst: 127.0.0.1
Transmission Control Protocol, Src Port: 46794, Dst Port: 6653, Seq: 0, Len: 0

No.     Time           Source                Destination           Protocol Length Info
     40 4.833457650    127.0.0.1             127.0.0.1             TCP      76     6653 → 46794 [SYN, ACK] Seq=0 Ack=1 Win=43690 Len=0 MSS=65495 SACK_PERM=1 TSval=3195617603 TSecr=3195617603 WS=512

Frame 40: 76 bytes on wire (608 bits), 76 bytes captured (608 bits) on interface any, id 0
Linux cooked capture
Internet Protocol Version 4, Src: 127.0.0.1, Dst: 127.0.0.1
Transmission Control Protocol, Src Port: 6653, Dst Port: 46794, Seq: 0, Ack: 1, Len: 0

No.     Time           Source                Destination           Protocol Length Info
     41 4.833473367    127.0.0.1             127.0.0.1             TCP      68     46794 → 6653 [ACK] Seq=1 Ack=1 Win=44032 Len=0 TSval=3195617603 TSecr=3195617603

Frame 41: 68 bytes on wire (544 bits), 68 bytes captured (544 bits) on interface any, id 0
Linux cooked capture
Internet Protocol Version 4, Src: 127.0.0.1, Dst: 127.0.0.1
Transmission Control Protocol, Src Port: 46794, Dst Port: 6653, Seq: 1, Ack: 1, Len: 0

No.     Time           Source                Destination           Protocol Length Info
     42 4.834550445    127.0.0.1             127.0.0.1             OpenFlow 76     Type: OFPT_HELLO

Frame 42: 76 bytes on wire (608 bits), 76 bytes captured (608 bits) on interface any, id 0
Linux cooked capture
Internet Protocol Version 4, Src: 127.0.0.1, Dst: 127.0.0.1
Transmission Control Protocol, Src Port: 6653, Dst Port: 46794, Seq: 1, Ack: 1, Len: 8
OpenFlow 1.3

No.     Time           Source                Destination           Protocol Length Info
     43 4.834568893    127.0.0.1             127.0.0.1             TCP      68     46794 → 6653 [ACK] Seq=1 Ack=9 Win=44032 Len=0 TSval=3195617604 TSecr=3195617604

Frame 43: 68 bytes on wire (544 bits), 68 bytes captured (544 bits) on interface any, id 0
Linux cooked capture
Internet Protocol Version 4, Src: 127.0.0.1, Dst: 127.0.0.1
Transmission Control Protocol, Src Port: 46794, Dst Port: 6653, Seq: 1, Ack: 9, Len: 0

No.     Time           Source                Destination           Protocol Length Info
     44 4.836885736    127.0.0.1             127.0.0.1             OpenFlow 84     Type: OFPT_HELLO

Frame 44: 84 bytes on wire (672 bits), 84 bytes captured (672 bits) on interface any, id 0
Linux cooked capture
Internet Protocol Version 4, Src: 127.0.0.1, Dst: 127.0.0.1
Transmission Control Protocol, Src Port: 46794, Dst Port: 6653, Seq: 1, Ack: 9, Len: 16
OpenFlow 1.3

No.     Time           Source                Destination           Protocol Length Info
     45 4.836898624    127.0.0.1             127.0.0.1             TCP      68     6653 → 46794 [ACK] Seq=9 Ack=17 Win=44032 Len=0 TSval=3195617607 TSecr=3195617607

Frame 45: 68 bytes on wire (544 bits), 68 bytes captured (544 bits) on interface any, id 0
Linux cooked capture
Internet Protocol Version 4, Src: 127.0.0.1, Dst: 127.0.0.1
Transmission Control Protocol, Src Port: 6653, Dst Port: 46794, Seq: 9, Ack: 17, Len: 0

No.     Time           Source                Destination           Protocol Length Info
     46 4.837971546    127.0.0.1             127.0.0.1             OpenFlow 76     Type: OFPT_FEATURES_REQUEST

Frame 46: 76 bytes on wire (608 bits), 76 bytes captured (608 bits) on interface any, id 0
Linux cooked capture
Internet Protocol Version 4, Src: 127.0.0.1, Dst: 127.0.0.1
Transmission Control Protocol, Src Port: 6653, Dst Port: 46794, Seq: 9, Ack: 17, Len: 8
OpenFlow 1.3

No.     Time           Source                Destination           Protocol Length Info
     47 4.838689921    127.0.0.1             127.0.0.1             OpenFlow 148    Type: OFPT_PORT_STATUS

Frame 47: 148 bytes on wire (1184 bits), 148 bytes captured (1184 bits) on interface any, id 0
Linux cooked capture
Internet Protocol Version 4, Src: 127.0.0.1, Dst: 127.0.0.1
Transmission Control Protocol, Src Port: 46794, Dst Port: 6653, Seq: 17, Ack: 17, Len: 80
OpenFlow 1.3

No.     Time           Source                Destination           Protocol Length Info
     48 4.839912095    127.0.0.1             127.0.0.1             OpenFlow 100    Type: OFPT_FEATURES_REPLY

Frame 48: 100 bytes on wire (800 bits), 100 bytes captured (800 bits) on interface any, id 0
Linux cooked capture
Internet Protocol Version 4, Src: 127.0.0.1, Dst: 127.0.0.1
Transmission Control Protocol, Src Port: 46794, Dst Port: 6653, Seq: 97, Ack: 17, Len: 32
OpenFlow 1.3

No.     Time           Source                Destination           Protocol Length Info
     49 4.840031775    127.0.0.1             127.0.0.1             TCP      68     6653 → 46794 [ACK] Seq=17 Ack=129 Win=44032 Len=0 TSval=3195617610 TSecr=3195617608

Frame 49: 68 bytes on wire (544 bits), 68 bytes captured (544 bits) on interface any, id 0
Linux cooked capture
Internet Protocol Version 4, Src: 127.0.0.1, Dst: 127.0.0.1
Transmission Control Protocol, Src Port: 6653, Dst Port: 46794, Seq: 17, Ack: 129, Len: 0

No.     Time           Source                Destination           Protocol Length Info
     50 4.841237218    127.0.0.1             127.0.0.1             OpenFlow 84     Type: OFPT_MULTIPART_REQUEST, OFPMP_PORT_DESC

Frame 50: 84 bytes on wire (672 bits), 84 bytes captured (672 bits) on interface any, id 0
Linux cooked capture
Internet Protocol Version 4, Src: 127.0.0.1, Dst: 127.0.0.1
Transmission Control Protocol, Src Port: 6653, Dst Port: 46794, Seq: 17, Ack: 129, Len: 16
OpenFlow 1.3

No.     Time           Source                Destination           Protocol Length Info
     51 4.841263197    127.0.0.1             127.0.0.1             OpenFlow 148    Type: OFPT_FLOW_MOD

Frame 51: 148 bytes on wire (1184 bits), 148 bytes captured (1184 bits) on interface any, id 0
Linux cooked capture
Internet Protocol Version 4, Src: 127.0.0.1, Dst: 127.0.0.1
Transmission Control Protocol, Src Port: 6653, Dst Port: 46794, Seq: 33, Ack: 129, Len: 80
OpenFlow 1.3

No.     Time           Source                Destination           Protocol Length Info
     52 4.841772460    127.0.0.1             127.0.0.1             OpenFlow 276    Type: OFPT_MULTIPART_REPLY, OFPMP_PORT_DESC

Frame 52: 276 bytes on wire (2208 bits), 276 bytes captured (2208 bits) on interface any, id 0
Linux cooked capture
Internet Protocol Version 4, Src: 127.0.0.1, Dst: 127.0.0.1
Transmission Control Protocol, Src Port: 46794, Dst Port: 6653, Seq: 129, Ack: 113, Len: 208
OpenFlow 1.3

No.     Time           Source                Destination           Protocol Length Info
     53 4.844371549    127.0.0.1             127.0.0.1             OpenFlow 132    Type: OFPT_FLOW_MOD

Frame 53: 132 bytes on wire (1056 bits), 132 bytes captured (1056 bits) on interface any, id 0
Linux cooked capture
Internet Protocol Version 4, Src: 127.0.0.1, Dst: 127.0.0.1
Transmission Control Protocol, Src Port: 6653, Dst Port: 46794, Seq: 113, Ack: 337, Len: 64
OpenFlow 1.3

No.     Time           Source                Destination           Protocol Length Info
     54 4.848506793    ::                    ff02::16              ICMPv6   92     Multicast Listener Report Message v2

Frame 54: 92 bytes on wire (736 bits), 92 bytes captured (736 bits) on interface any, id 0
Linux cooked capture
Internet Protocol Version 6, Src: ::, Dst: ff02::16
Internet Control Message Protocol v6

No.     Time           Source                Destination           Protocol Length Info
     55 4.888342764    127.0.0.1             127.0.0.1             TCP      68     46794 → 6653 [ACK] Seq=337 Ack=177 Win=44032 Len=0 TSval=3195617658 TSecr=3195617614

Frame 55: 68 bytes on wire (544 bits), 68 bytes captured (544 bits) on interface any, id 0
Linux cooked capture
Internet Protocol Version 4, Src: 127.0.0.1, Dst: 127.0.0.1
Transmission Control Protocol, Src Port: 46794, Dst Port: 6653, Seq: 337, Ack: 177, Len: 0

No.     Time           Source                Destination           Protocol Length Info
     56 4.896308818    ::                    ff02::1:ff60:3ec      ICMPv6   88     Neighbor Solicitation for fe80::6c72:d6ff:fe60:3ec

Frame 56: 88 bytes on wire (704 bits), 88 bytes captured (704 bits) on interface any, id 0
Linux cooked capture
Internet Protocol Version 6, Src: ::, Dst: ff02::1:ff60:3ec
Internet Control Message Protocol v6

No.     Time           Source                Destination           Protocol Length Info
     57 4.929195811    ::                    ff02::1:ff00:1        ICMPv6   88     Neighbor Solicitation for fe80::200:ff:fe00:1

Frame 57: 88 bytes on wire (704 bits), 88 bytes captured (704 bits) on interface any, id 0
Linux cooked capture
Internet Protocol Version 6, Src: ::, Dst: ff02::1:ff00:1
Internet Control Message Protocol v6

No.     Time           Source                Destination           Protocol Length Info
     58 4.929602094    127.0.0.1             127.0.0.1             OpenFlow 196    Type: OFPT_PACKET_IN

Frame 58: 196 bytes on wire (1568 bits), 196 bytes captured (1568 bits) on interface any, id 0
Linux cooked capture
Internet Protocol Version 4, Src: 127.0.0.1, Dst: 127.0.0.1
Transmission Control Protocol, Src Port: 46794, Dst Port: 6653, Seq: 337, Ack: 177, Len: 128
OpenFlow 1.3

No.     Time           Source                Destination           Protocol Length Info
     59 4.931176526    127.0.0.1             127.0.0.1             OpenFlow 194    Type: OFPT_PACKET_OUT

Frame 59: 194 bytes on wire (1552 bits), 194 bytes captured (1552 bits) on interface any, id 0
Linux cooked capture
Internet Protocol Version 4, Src: 127.0.0.1, Dst: 127.0.0.1
Transmission Control Protocol, Src Port: 6653, Dst Port: 46794, Seq: 177, Ack: 465, Len: 126
OpenFlow 1.3

No.     Time           Source                Destination           Protocol Length Info
     60 4.931196475    127.0.0.1             127.0.0.1             TCP      68     46794 → 6653 [ACK] Seq=465 Ack=303 Win=44032 Len=0 TSval=3195617701 TSecr=3195617701

Frame 60: 68 bytes on wire (544 bits), 68 bytes captured (544 bits) on interface any, id 0
Linux cooked capture
Internet Protocol Version 4, Src: 127.0.0.1, Dst: 127.0.0.1
Transmission Control Protocol, Src Port: 46794, Dst Port: 6653, Seq: 465, Ack: 303, Len: 0

No.     Time           Source                Destination           Protocol Length Info
     61 4.931410554    ::                    ff02::1:ff00:1        ICMPv6   88     Neighbor Solicitation for fe80::200:ff:fe00:1

Frame 61: 88 bytes on wire (704 bits), 88 bytes captured (704 bits) on interface any, id 0
Linux cooked capture
Internet Protocol Version 6, Src: ::, Dst: ff02::1:ff00:1
Internet Control Message Protocol v6

No.     Time           Source                Destination           Protocol Length Info
     62 5.091967529    ::                    ff02::16              ICMPv6   112    Multicast Listener Report Message v2

Frame 62: 112 bytes on wire (896 bits), 112 bytes captured (896 bits) on interface any, id 0
Linux cooked capture
Internet Protocol Version 6, Src: ::, Dst: ff02::16
Internet Control Message Protocol v6

No.     Time           Source                Destination           Protocol Length Info
     63 5.093303900    127.0.0.1             127.0.0.1             OpenFlow 220    Type: OFPT_PACKET_IN

Frame 63: 220 bytes on wire (1760 bits), 220 bytes captured (1760 bits) on interface any, id 0
Linux cooked capture
Internet Protocol Version 4, Src: 127.0.0.1, Dst: 127.0.0.1
Transmission Control Protocol, Src Port: 46794, Dst Port: 6653, Seq: 465, Ack: 303, Len: 152
OpenFlow 1.3

No.     Time           Source                Destination           Protocol Length Info
     64 5.094295256    127.0.0.1             127.0.0.1             OpenFlow 218    Type: OFPT_PACKET_OUT

Frame 64: 218 bytes on wire (1744 bits), 218 bytes captured (1744 bits) on interface any, id 0
Linux cooked capture
Internet Protocol Version 4, Src: 127.0.0.1, Dst: 127.0.0.1
Transmission Control Protocol, Src Port: 6653, Dst Port: 46794, Seq: 303, Ack: 617, Len: 150
OpenFlow 1.3

No.     Time           Source                Destination           Protocol Length Info
     65 5.094306795    127.0.0.1             127.0.0.1             TCP      68     46794 → 6653 [ACK] Seq=617 Ack=453 Win=44032 Len=0 TSval=3195617864 TSecr=3195617864

Frame 65: 68 bytes on wire (544 bits), 68 bytes captured (544 bits) on interface any, id 0
Linux cooked capture
Internet Protocol Version 4, Src: 127.0.0.1, Dst: 127.0.0.1
Transmission Control Protocol, Src Port: 46794, Dst Port: 6653, Seq: 617, Ack: 453, Len: 0

No.     Time           Source                Destination           Protocol Length Info
     66 5.094504062    ::                    ff02::16              ICMPv6   112    Multicast Listener Report Message v2

Frame 66: 112 bytes on wire (896 bits), 112 bytes captured (896 bits) on interface any, id 0
Linux cooked capture
Internet Protocol Version 6, Src: ::, Dst: ff02::16
Internet Control Message Protocol v6

No.     Time           Source                Destination           Protocol Length Info
     67 5.152356324    ::                    ff02::1:ff00:2        ICMPv6   88     Neighbor Solicitation for fe80::200:ff:fe00:2

Frame 67: 88 bytes on wire (704 bits), 88 bytes captured (704 bits) on interface any, id 0
Linux cooked capture
Internet Protocol Version 6, Src: ::, Dst: ff02::1:ff00:2
Internet Control Message Protocol v6

No.     Time           Source                Destination           Protocol Length Info
     68 5.152814832    127.0.0.1             127.0.0.1             OpenFlow 196    Type: OFPT_PACKET_IN

Frame 68: 196 bytes on wire (1568 bits), 196 bytes captured (1568 bits) on interface any, id 0
Linux cooked capture
Internet Protocol Version 4, Src: 127.0.0.1, Dst: 127.0.0.1
Transmission Control Protocol, Src Port: 46794, Dst Port: 6653, Seq: 617, Ack: 453, Len: 128
OpenFlow 1.3

No.     Time           Source                Destination           Protocol Length Info
     69 5.154083118    127.0.0.1             127.0.0.1             OpenFlow 194    Type: OFPT_PACKET_OUT

Frame 69: 194 bytes on wire (1552 bits), 194 bytes captured (1552 bits) on interface any, id 0
Linux cooked capture
Internet Protocol Version 4, Src: 127.0.0.1, Dst: 127.0.0.1
Transmission Control Protocol, Src Port: 6653, Dst Port: 46794, Seq: 453, Ack: 745, Len: 126
OpenFlow 1.3

No.     Time           Source                Destination           Protocol Length Info
     70 5.154099130    127.0.0.1             127.0.0.1             TCP      68     46794 → 6653 [ACK] Seq=745 Ack=579 Win=44032 Len=0 TSval=3195617924 TSecr=3195617924

Frame 70: 68 bytes on wire (544 bits), 68 bytes captured (544 bits) on interface any, id 0
Linux cooked capture
Internet Protocol Version 4, Src: 127.0.0.1, Dst: 127.0.0.1
Transmission Control Protocol, Src Port: 46794, Dst Port: 6653, Seq: 745, Ack: 579, Len: 0

No.     Time           Source                Destination           Protocol Length Info
     71 5.154264109    ::                    ff02::1:ff00:2        ICMPv6   88     Neighbor Solicitation for fe80::200:ff:fe00:2

Frame 71: 88 bytes on wire (704 bits), 88 bytes captured (704 bits) on interface any, id 0
Linux cooked capture
Internet Protocol Version 6, Src: ::, Dst: ff02::1:ff00:2
Internet Control Message Protocol v6

No.     Time           Source                Destination           Protocol Length Info
     72 5.376424882    ::                    ff02::16              ICMPv6   92     Multicast Listener Report Message v2

Frame 72: 92 bytes on wire (736 bits), 92 bytes captured (736 bits) on interface any, id 0
Linux cooked capture
Internet Protocol Version 6, Src: ::, Dst: ff02::16
Internet Control Message Protocol v6

No.     Time           Source                Destination           Protocol Length Info
     73 5.543457437    ::                    ff02::1:ff60:dc65     ICMPv6   88     Neighbor Solicitation for fe80::5015:3fff:fe60:dc65

Frame 73: 88 bytes on wire (704 bits), 88 bytes captured (704 bits) on interface any, id 0
Linux cooked capture
Internet Protocol Version 6, Src: ::, Dst: ff02::1:ff60:dc65
Internet Control Message Protocol v6

No.     Time           Source                Destination           Protocol Length Info
     74 5.572006822    ::                    ff02::16              ICMPv6   112    Multicast Listener Report Message v2

Frame 74: 112 bytes on wire (896 bits), 112 bytes captured (896 bits) on interface any, id 0
Linux cooked capture
Internet Protocol Version 6, Src: ::, Dst: ff02::16
Internet Control Message Protocol v6

No.     Time           Source                Destination           Protocol Length Info
     75 5.572233814    127.0.0.1             127.0.0.1             OpenFlow 220    Type: OFPT_PACKET_IN

Frame 75: 220 bytes on wire (1760 bits), 220 bytes captured (1760 bits) on interface any, id 0
Linux cooked capture
Internet Protocol Version 4, Src: 127.0.0.1, Dst: 127.0.0.1
Transmission Control Protocol, Src Port: 46794, Dst Port: 6653, Seq: 745, Ack: 579, Len: 152
OpenFlow 1.3

No.     Time           Source                Destination           Protocol Length Info
     76 5.573241935    127.0.0.1             127.0.0.1             OpenFlow 218    Type: OFPT_PACKET_OUT

Frame 76: 218 bytes on wire (1744 bits), 218 bytes captured (1744 bits) on interface any, id 0
Linux cooked capture
Internet Protocol Version 4, Src: 127.0.0.1, Dst: 127.0.0.1
Transmission Control Protocol, Src Port: 6653, Dst Port: 46794, Seq: 579, Ack: 897, Len: 150
OpenFlow 1.3

No.     Time           Source                Destination           Protocol Length Info
     77 5.573260877    127.0.0.1             127.0.0.1             TCP      68     46794 → 6653 [ACK] Seq=897 Ack=729 Win=44032 Len=0 TSval=3195618343 TSecr=3195618343

Frame 77: 68 bytes on wire (544 bits), 68 bytes captured (544 bits) on interface any, id 0
Linux cooked capture
Internet Protocol Version 4, Src: 127.0.0.1, Dst: 127.0.0.1
Transmission Control Protocol, Src Port: 46794, Dst Port: 6653, Seq: 897, Ack: 729, Len: 0

No.     Time           Source                Destination           Protocol Length Info
     78 5.573575826    ::                    ff02::16              ICMPv6   112    Multicast Listener Report Message v2

Frame 78: 112 bytes on wire (896 bits), 112 bytes captured (896 bits) on interface any, id 0
Linux cooked capture
Internet Protocol Version 6, Src: ::, Dst: ff02::16
Internet Control Message Protocol v6

No.     Time           Source                Destination           Protocol Length Info
     79 5.656595978    127.0.0.1             127.0.0.53            DNS      89     Standard query 0xdf54 A daisy.ubuntu.com OPT

Frame 79: 89 bytes on wire (712 bits), 89 bytes captured (712 bits) on interface any, id 0
Linux cooked capture
Internet Protocol Version 4, Src: 127.0.0.1, Dst: 127.0.0.53
User Datagram Protocol, Src Port: 55743, Dst Port: 53
Domain Name System (query)

No.     Time           Source                Destination           Protocol Length Info
     80 5.656665625    127.0.0.1             127.0.0.53            DNS      89     Standard query 0xf150 AAAA daisy.ubuntu.com OPT

Frame 80: 89 bytes on wire (712 bits), 89 bytes captured (712 bits) on interface any, id 0
Linux cooked capture
Internet Protocol Version 4, Src: 127.0.0.1, Dst: 127.0.0.53
User Datagram Protocol, Src Port: 55743, Dst Port: 53
Domain Name System (query)

No.     Time           Source                Destination           Protocol Length Info
     81 5.657064234    127.0.0.53            127.0.0.1             DNS      121    Standard query response 0xdf54 A daisy.ubuntu.com A 162.213.35.25 A 162.213.35.24 OPT

Frame 81: 121 bytes on wire (968 bits), 121 bytes captured (968 bits) on interface any, id 0
Linux cooked capture
Internet Protocol Version 4, Src: 127.0.0.53, Dst: 127.0.0.1
User Datagram Protocol, Src Port: 53, Dst Port: 55743
Domain Name System (response)

No.     Time           Source                Destination           Protocol Length Info
     82 5.657423635    10.0.2.15             10.101.1.10           DNS      89     Standard query 0xbad0 AAAA daisy.ubuntu.com OPT

Frame 82: 89 bytes on wire (712 bits), 89 bytes captured (712 bits) on interface any, id 0
Linux cooked capture
Internet Protocol Version 4, Src: 10.0.2.15, Dst: 10.101.1.10
User Datagram Protocol, Src Port: 49486, Dst Port: 53
Domain Name System (query)

No.     Time           Source                Destination           Protocol Length Info
     83 5.660418129    10.101.1.10           10.0.2.15             DNS      150    Standard query response 0xbad0 AAAA daisy.ubuntu.com SOA ns1.canonical.com OPT

Frame 83: 150 bytes on wire (1200 bits), 150 bytes captured (1200 bits) on interface any, id 0
Linux cooked capture
Internet Protocol Version 4, Src: 10.101.1.10, Dst: 10.0.2.15
User Datagram Protocol, Src Port: 53, Dst Port: 49486
Domain Name System (response)

No.     Time           Source                Destination           Protocol Length Info
     84 5.660792932    127.0.0.53            127.0.0.1             DNS      89     Standard query response 0xf150 AAAA daisy.ubuntu.com OPT

Frame 84: 89 bytes on wire (712 bits), 89 bytes captured (712 bits) on interface any, id 0
Linux cooked capture
Internet Protocol Version 4, Src: 127.0.0.53, Dst: 127.0.0.1
User Datagram Protocol, Src Port: 53, Dst Port: 55743
Domain Name System (response)

