No.     Time           Source                Destination           Protocol Length Info
      1 0.000000000    10.0.2.15             10.101.1.10           DNS      102    Standard query 0x9fb8 A connectivity-check.ubuntu.com OPT

Frame 1: 102 bytes on wire (816 bits), 102 bytes captured (816 bits) on interface any, id 0
Linux cooked capture
Internet Protocol Version 4, Src: 10.0.2.15, Dst: 10.101.1.10
User Datagram Protocol, Src Port: 55814, Dst Port: 53
Domain Name System (query)

No.     Time           Source                Destination           Protocol Length Info
      2 0.002545065    10.101.1.10           10.0.2.15             DNS      294    Standard query response 0x9fb8 A connectivity-check.ubuntu.com A 91.189.91.98 A 185.125.190.17 A 185.125.190.18 A 185.125.190.48 A 185.125.190.49 A 185.125.190.96 A 185.125.190.97 A 185.125.190.98 A 91.189.91.48 A 91.189.91.49 A 91.189.91.96 A 91.189.91.97 OPT

Frame 2: 294 bytes on wire (2352 bits), 294 bytes captured (2352 bits) on interface any, id 0
Linux cooked capture
Internet Protocol Version 4, Src: 10.101.1.10, Dst: 10.0.2.15
User Datagram Protocol, Src Port: 53, Dst Port: 55814
Domain Name System (response)

No.     Time           Source                Destination           Protocol Length Info
      3 0.004409291    10.0.2.15             91.189.91.97          TCP      76     54068 → 80 [SYN] Seq=0 Win=42340 Len=0 MSS=1460 SACK_PERM=1 TSval=1102949915 TSecr=0 WS=512

Frame 3: 76 bytes on wire (608 bits), 76 bytes captured (608 bits) on interface any, id 0
Linux cooked capture
Internet Protocol Version 4, Src: 10.0.2.15, Dst: 91.189.91.97
Transmission Control Protocol, Src Port: 54068, Dst Port: 80, Seq: 0, Len: 0

No.     Time           Source                Destination           Protocol Length Info
      4 0.007250466    91.189.91.97          10.0.2.15             TCP      62     80 → 54068 [SYN, ACK] Seq=0 Ack=1 Win=65535 Len=0 MSS=1460

Frame 4: 62 bytes on wire (496 bits), 62 bytes captured (496 bits) on interface any, id 0
Linux cooked capture
Internet Protocol Version 4, Src: 91.189.91.97, Dst: 10.0.2.15
Transmission Control Protocol, Src Port: 80, Dst Port: 54068, Seq: 0, Ack: 1, Len: 0
VSS Monitoring Ethernet trailer, Source Port: 0

No.     Time           Source                Destination           Protocol Length Info
      5 0.007386673    10.0.2.15             91.189.91.97          TCP      56     54068 → 80 [ACK] Seq=1 Ack=1 Win=42340 Len=0

Frame 5: 56 bytes on wire (448 bits), 56 bytes captured (448 bits) on interface any, id 0
Linux cooked capture
Internet Protocol Version 4, Src: 10.0.2.15, Dst: 91.189.91.97
Transmission Control Protocol, Src Port: 54068, Dst Port: 80, Seq: 1, Ack: 1, Len: 0

No.     Time           Source                Destination           Protocol Length Info
      6 0.007892829    10.0.2.15             91.189.91.97          HTTP     143    GET / HTTP/1.1 

Frame 6: 143 bytes on wire (1144 bits), 143 bytes captured (1144 bits) on interface any, id 0
Linux cooked capture
Internet Protocol Version 4, Src: 10.0.2.15, Dst: 91.189.91.97
Transmission Control Protocol, Src Port: 54068, Dst Port: 80, Seq: 1, Ack: 1, Len: 87
Hypertext Transfer Protocol

No.     Time           Source                Destination           Protocol Length Info
      7 0.008374422    91.189.91.97          10.0.2.15             TCP      62     80 → 54068 [ACK] Seq=1 Ack=88 Win=65535 Len=0

Frame 7: 62 bytes on wire (496 bits), 62 bytes captured (496 bits) on interface any, id 0
Linux cooked capture
Internet Protocol Version 4, Src: 91.189.91.97, Dst: 10.0.2.15
Transmission Control Protocol, Src Port: 80, Dst Port: 54068, Seq: 1, Ack: 88, Len: 0
VSS Monitoring Ethernet trailer, Source Port: 0

No.     Time           Source                Destination           Protocol Length Info
      8 0.512338936    91.189.91.97          10.0.2.15             HTTP     241    HTTP/1.1 204 No Content 

Frame 8: 241 bytes on wire (1928 bits), 241 bytes captured (1928 bits) on interface any, id 0
Linux cooked capture
Internet Protocol Version 4, Src: 91.189.91.97, Dst: 10.0.2.15
Transmission Control Protocol, Src Port: 80, Dst Port: 54068, Seq: 1, Ack: 88, Len: 185
Hypertext Transfer Protocol

No.     Time           Source                Destination           Protocol Length Info
      9 0.512427396    10.0.2.15             91.189.91.97          TCP      56     54068 → 80 [ACK] Seq=88 Ack=186 Win=42155 Len=0

Frame 9: 56 bytes on wire (448 bits), 56 bytes captured (448 bits) on interface any, id 0
Linux cooked capture
Internet Protocol Version 4, Src: 10.0.2.15, Dst: 91.189.91.97
Transmission Control Protocol, Src Port: 54068, Dst Port: 80, Seq: 88, Ack: 186, Len: 0

No.     Time           Source                Destination           Protocol Length Info
     10 0.512339179    91.189.91.97          10.0.2.15             TCP      62     80 → 54068 [FIN, ACK] Seq=186 Ack=88 Win=65535 Len=0

Frame 10: 62 bytes on wire (496 bits), 62 bytes captured (496 bits) on interface any, id 0
Linux cooked capture
Internet Protocol Version 4, Src: 91.189.91.97, Dst: 10.0.2.15
Transmission Control Protocol, Src Port: 80, Dst Port: 54068, Seq: 186, Ack: 88, Len: 0
VSS Monitoring Ethernet trailer, Source Port: 0

No.     Time           Source                Destination           Protocol Length Info
     11 0.512813446    10.0.2.15             91.189.91.97          TCP      56     54068 → 80 [FIN, ACK] Seq=88 Ack=187 Win=42155 Len=0

Frame 11: 56 bytes on wire (448 bits), 56 bytes captured (448 bits) on interface any, id 0
Linux cooked capture
Internet Protocol Version 4, Src: 10.0.2.15, Dst: 91.189.91.97
Transmission Control Protocol, Src Port: 54068, Dst Port: 80, Seq: 88, Ack: 187, Len: 0

No.     Time           Source                Destination           Protocol Length Info
     12 0.513130121    91.189.91.97          10.0.2.15             TCP      62     80 → 54068 [ACK] Seq=187 Ack=89 Win=65535 Len=0

Frame 12: 62 bytes on wire (496 bits), 62 bytes captured (496 bits) on interface any, id 0
Linux cooked capture
Internet Protocol Version 4, Src: 91.189.91.97, Dst: 10.0.2.15
Transmission Control Protocol, Src Port: 80, Dst Port: 54068, Seq: 187, Ack: 89, Len: 0
VSS Monitoring Ethernet trailer, Source Port: 0

No.     Time           Source                Destination           Protocol Length Info
     13 7.946788375    127.0.0.1             127.0.0.1             TCP      76     47418 → 6653 [SYN] Seq=0 Win=43690 Len=0 MSS=65495 SACK_PERM=1 TSval=3195705481 TSecr=0 WS=512

Frame 13: 76 bytes on wire (608 bits), 76 bytes captured (608 bits) on interface any, id 0
Linux cooked capture
Internet Protocol Version 4, Src: 127.0.0.1, Dst: 127.0.0.1
Transmission Control Protocol, Src Port: 47418, Dst Port: 6653, Seq: 0, Len: 0

No.     Time           Source                Destination           Protocol Length Info
     14 7.946816107    127.0.0.1             127.0.0.1             TCP      76     6653 → 47418 [SYN, ACK] Seq=0 Ack=1 Win=43690 Len=0 MSS=65495 SACK_PERM=1 TSval=3195705481 TSecr=3195705481 WS=512

Frame 14: 76 bytes on wire (608 bits), 76 bytes captured (608 bits) on interface any, id 0
Linux cooked capture
Internet Protocol Version 4, Src: 127.0.0.1, Dst: 127.0.0.1
Transmission Control Protocol, Src Port: 6653, Dst Port: 47418, Seq: 0, Ack: 1, Len: 0

No.     Time           Source                Destination           Protocol Length Info
     15 7.946831172    127.0.0.1             127.0.0.1             TCP      68     47418 → 6653 [ACK] Seq=1 Ack=1 Win=44032 Len=0 TSval=3195705481 TSecr=3195705481

Frame 15: 68 bytes on wire (544 bits), 68 bytes captured (544 bits) on interface any, id 0
Linux cooked capture
Internet Protocol Version 4, Src: 127.0.0.1, Dst: 127.0.0.1
Transmission Control Protocol, Src Port: 47418, Dst Port: 6653, Seq: 1, Ack: 1, Len: 0

No.     Time           Source                Destination           Protocol Length Info
     16 7.947124409    127.0.0.1             127.0.0.1             TCP      68     47418 → 6653 [FIN, ACK] Seq=1 Ack=1 Win=44032 Len=0 TSval=3195705481 TSecr=3195705481

Frame 16: 68 bytes on wire (544 bits), 68 bytes captured (544 bits) on interface any, id 0
Linux cooked capture
Internet Protocol Version 4, Src: 127.0.0.1, Dst: 127.0.0.1
Transmission Control Protocol, Src Port: 47418, Dst Port: 6653, Seq: 1, Ack: 1, Len: 0

No.     Time           Source                Destination           Protocol Length Info
     17 7.961514975    127.0.0.1             127.0.0.1             TCP      68     6653 → 47418 [ACK] Seq=1 Ack=2 Win=44032 Len=0 TSval=3195705495 TSecr=3195705481

Frame 17: 68 bytes on wire (544 bits), 68 bytes captured (544 bits) on interface any, id 0
Linux cooked capture
Internet Protocol Version 4, Src: 127.0.0.1, Dst: 127.0.0.1
Transmission Control Protocol, Src Port: 6653, Dst Port: 47418, Seq: 1, Ack: 2, Len: 0

No.     Time           Source                Destination           Protocol Length Info
     18 7.964992431    127.0.0.1             127.0.0.1             TCP      68     6653 → 47418 [FIN, ACK] Seq=1 Ack=2 Win=44032 Len=0 TSval=3195705499 TSecr=3195705481

Frame 18: 68 bytes on wire (544 bits), 68 bytes captured (544 bits) on interface any, id 0
Linux cooked capture
Internet Protocol Version 4, Src: 127.0.0.1, Dst: 127.0.0.1
Transmission Control Protocol, Src Port: 6653, Dst Port: 47418, Seq: 1, Ack: 2, Len: 0

No.     Time           Source                Destination           Protocol Length Info
     19 7.965051488    127.0.0.1             127.0.0.1             TCP      68     47418 → 6653 [ACK] Seq=2 Ack=2 Win=44032 Len=0 TSval=3195705499 TSecr=3195705499

Frame 19: 68 bytes on wire (544 bits), 68 bytes captured (544 bits) on interface any, id 0
Linux cooked capture
Internet Protocol Version 4, Src: 127.0.0.1, Dst: 127.0.0.1
Transmission Control Protocol, Src Port: 47418, Dst Port: 6653, Seq: 2, Ack: 2, Len: 0

No.     Time           Source                Destination           Protocol Length Info
     20 8.135822228    ::                    ff02::16              ICMPv6   92     Multicast Listener Report Message v2

Frame 20: 92 bytes on wire (736 bits), 92 bytes captured (736 bits) on interface any, id 0
Linux cooked capture
Internet Protocol Version 6, Src: ::, Dst: ff02::16
Internet Control Message Protocol v6

No.     Time           Source                Destination           Protocol Length Info
     21 8.135807876    ::                    ff02::16              ICMPv6   92     Multicast Listener Report Message v2

Frame 21: 92 bytes on wire (736 bits), 92 bytes captured (736 bits) on interface any, id 0
Linux cooked capture
Internet Protocol Version 6, Src: ::, Dst: ff02::16
Internet Control Message Protocol v6

No.     Time           Source                Destination           Protocol Length Info
     22 8.163891141    ::                    ff02::16              ICMPv6   92     Multicast Listener Report Message v2

Frame 22: 92 bytes on wire (736 bits), 92 bytes captured (736 bits) on interface any, id 0
Linux cooked capture
Internet Protocol Version 6, Src: ::, Dst: ff02::16
Internet Control Message Protocol v6

No.     Time           Source                Destination           Protocol Length Info
     23 8.163918268    ::                    ff02::16              ICMPv6   92     Multicast Listener Report Message v2

Frame 23: 92 bytes on wire (736 bits), 92 bytes captured (736 bits) on interface any, id 0
Linux cooked capture
Internet Protocol Version 6, Src: ::, Dst: ff02::16
Internet Control Message Protocol v6

No.     Time           Source                Destination           Protocol Length Info
     24 8.212706782    ::                    ff02::16              ICMPv6   92     Multicast Listener Report Message v2

Frame 24: 92 bytes on wire (736 bits), 92 bytes captured (736 bits) on interface any, id 0
Linux cooked capture
Internet Protocol Version 6, Src: ::, Dst: ff02::16
Internet Control Message Protocol v6

No.     Time           Source                Destination           Protocol Length Info
     25 8.212758798    ::                    ff02::16              ICMPv6   112    Multicast Listener Report Message v2

Frame 25: 112 bytes on wire (896 bits), 112 bytes captured (896 bits) on interface any, id 0
Linux cooked capture
Internet Protocol Version 6, Src: ::, Dst: ff02::16
Internet Control Message Protocol v6

No.     Time           Source                Destination           Protocol Length Info
     26 8.265132847    ::                    ff02::16              ICMPv6   92     Multicast Listener Report Message v2

Frame 26: 92 bytes on wire (736 bits), 92 bytes captured (736 bits) on interface any, id 0
Linux cooked capture
Internet Protocol Version 6, Src: ::, Dst: ff02::16
Internet Control Message Protocol v6

No.     Time           Source                Destination           Protocol Length Info
     27 8.265157765    ::                    ff02::16              ICMPv6   112    Multicast Listener Report Message v2

Frame 27: 112 bytes on wire (896 bits), 112 bytes captured (896 bits) on interface any, id 0
Linux cooked capture
Internet Protocol Version 6, Src: ::, Dst: ff02::16
Internet Control Message Protocol v6

No.     Time           Source                Destination           Protocol Length Info
     28 8.313379220    127.0.0.1             127.0.0.1             TCP      76     47878 → 5037 [SYN] Seq=0 Win=43690 Len=0 MSS=65495 SACK_PERM=1 TSval=3195705847 TSecr=0 WS=512

Frame 28: 76 bytes on wire (608 bits), 76 bytes captured (608 bits) on interface any, id 0
Linux cooked capture
Internet Protocol Version 4, Src: 127.0.0.1, Dst: 127.0.0.1
Transmission Control Protocol, Src Port: 47878, Dst Port: 5037, Seq: 0, Len: 0

No.     Time           Source                Destination           Protocol Length Info
     29 8.313393392    127.0.0.1             127.0.0.1             TCP      56     5037 → 47878 [RST, ACK] Seq=1 Ack=1 Win=0 Len=0

Frame 29: 56 bytes on wire (448 bits), 56 bytes captured (448 bits) on interface any, id 0
Linux cooked capture
Internet Protocol Version 4, Src: 127.0.0.1, Dst: 127.0.0.1
Transmission Control Protocol, Src Port: 5037, Dst Port: 47878, Seq: 1, Ack: 1, Len: 0

No.     Time           Source                Destination           Protocol Length Info
     30 8.316181679    127.0.0.1             127.0.0.1             TCP      76     47886 → 5037 [SYN] Seq=0 Win=43690 Len=0 MSS=65495 SACK_PERM=1 TSval=3195705850 TSecr=0 WS=512

Frame 30: 76 bytes on wire (608 bits), 76 bytes captured (608 bits) on interface any, id 0
Linux cooked capture
Internet Protocol Version 4, Src: 127.0.0.1, Dst: 127.0.0.1
Transmission Control Protocol, Src Port: 47886, Dst Port: 5037, Seq: 0, Len: 0

No.     Time           Source                Destination           Protocol Length Info
     31 8.316213199    127.0.0.1             127.0.0.1             TCP      56     5037 → 47886 [RST, ACK] Seq=1 Ack=1 Win=0 Len=0

Frame 31: 56 bytes on wire (448 bits), 56 bytes captured (448 bits) on interface any, id 0
Linux cooked capture
Internet Protocol Version 4, Src: 127.0.0.1, Dst: 127.0.0.1
Transmission Control Protocol, Src Port: 5037, Dst Port: 47886, Seq: 1, Ack: 1, Len: 0

No.     Time           Source                Destination           Protocol Length Info
     32 8.318302216    127.0.0.1             127.0.0.1             TCP      76     47900 → 5037 [SYN] Seq=0 Win=43690 Len=0 MSS=65495 SACK_PERM=1 TSval=3195705852 TSecr=0 WS=512

Frame 32: 76 bytes on wire (608 bits), 76 bytes captured (608 bits) on interface any, id 0
Linux cooked capture
Internet Protocol Version 4, Src: 127.0.0.1, Dst: 127.0.0.1
Transmission Control Protocol, Src Port: 47900, Dst Port: 5037, Seq: 0, Len: 0

No.     Time           Source                Destination           Protocol Length Info
     33 8.318314472    127.0.0.1             127.0.0.1             TCP      56     5037 → 47900 [RST, ACK] Seq=1 Ack=1 Win=0 Len=0

Frame 33: 56 bytes on wire (448 bits), 56 bytes captured (448 bits) on interface any, id 0
Linux cooked capture
Internet Protocol Version 4, Src: 127.0.0.1, Dst: 127.0.0.1
Transmission Control Protocol, Src Port: 5037, Dst Port: 47900, Seq: 1, Ack: 1, Len: 0

No.     Time           Source                Destination           Protocol Length Info
     34 8.320098099    127.0.0.1             127.0.0.1             TCP      76     47908 → 5037 [SYN] Seq=0 Win=43690 Len=0 MSS=65495 SACK_PERM=1 TSval=3195705854 TSecr=0 WS=512

Frame 34: 76 bytes on wire (608 bits), 76 bytes captured (608 bits) on interface any, id 0
Linux cooked capture
Internet Protocol Version 4, Src: 127.0.0.1, Dst: 127.0.0.1
Transmission Control Protocol, Src Port: 47908, Dst Port: 5037, Seq: 0, Len: 0

No.     Time           Source                Destination           Protocol Length Info
     35 8.320112131    127.0.0.1             127.0.0.1             TCP      56     5037 → 47908 [RST, ACK] Seq=1 Ack=1 Win=0 Len=0

Frame 35: 56 bytes on wire (448 bits), 56 bytes captured (448 bits) on interface any, id 0
Linux cooked capture
Internet Protocol Version 4, Src: 127.0.0.1, Dst: 127.0.0.1
Transmission Control Protocol, Src Port: 5037, Dst Port: 47908, Seq: 1, Ack: 1, Len: 0

No.     Time           Source                Destination           Protocol Length Info
     36 8.321432171    127.0.0.1             127.0.0.1             TCP      76     47914 → 5037 [SYN] Seq=0 Win=43690 Len=0 MSS=65495 SACK_PERM=1 TSval=3195705855 TSecr=0 WS=512

Frame 36: 76 bytes on wire (608 bits), 76 bytes captured (608 bits) on interface any, id 0
Linux cooked capture
Internet Protocol Version 4, Src: 127.0.0.1, Dst: 127.0.0.1
Transmission Control Protocol, Src Port: 47914, Dst Port: 5037, Seq: 0, Len: 0

No.     Time           Source                Destination           Protocol Length Info
     37 8.321448758    127.0.0.1             127.0.0.1             TCP      56     5037 → 47914 [RST, ACK] Seq=1 Ack=1 Win=0 Len=0

Frame 37: 56 bytes on wire (448 bits), 56 bytes captured (448 bits) on interface any, id 0
Linux cooked capture
Internet Protocol Version 4, Src: 127.0.0.1, Dst: 127.0.0.1
Transmission Control Protocol, Src Port: 5037, Dst Port: 47914, Seq: 1, Ack: 1, Len: 0

No.     Time           Source                Destination           Protocol Length Info
     38 8.322654782    127.0.0.1             127.0.0.1             TCP      76     47922 → 5037 [SYN] Seq=0 Win=43690 Len=0 MSS=65495 SACK_PERM=1 TSval=3195705857 TSecr=0 WS=512

Frame 38: 76 bytes on wire (608 bits), 76 bytes captured (608 bits) on interface any, id 0
Linux cooked capture
Internet Protocol Version 4, Src: 127.0.0.1, Dst: 127.0.0.1
Transmission Control Protocol, Src Port: 47922, Dst Port: 5037, Seq: 0, Len: 0

No.     Time           Source                Destination           Protocol Length Info
     39 8.322664483    127.0.0.1             127.0.0.1             TCP      56     5037 → 47922 [RST, ACK] Seq=1 Ack=1 Win=0 Len=0

Frame 39: 56 bytes on wire (448 bits), 56 bytes captured (448 bits) on interface any, id 0
Linux cooked capture
Internet Protocol Version 4, Src: 127.0.0.1, Dst: 127.0.0.1
Transmission Control Protocol, Src Port: 5037, Dst Port: 47922, Seq: 1, Ack: 1, Len: 0

No.     Time           Source                Destination           Protocol Length Info
     40 8.329326630    127.0.0.1             127.0.0.1             TCP      76     47928 → 5037 [SYN] Seq=0 Win=43690 Len=0 MSS=65495 SACK_PERM=1 TSval=3195705863 TSecr=0 WS=512

Frame 40: 76 bytes on wire (608 bits), 76 bytes captured (608 bits) on interface any, id 0
Linux cooked capture
Internet Protocol Version 4, Src: 127.0.0.1, Dst: 127.0.0.1
Transmission Control Protocol, Src Port: 47928, Dst Port: 5037, Seq: 0, Len: 0

No.     Time           Source                Destination           Protocol Length Info
     41 8.329368098    127.0.0.1             127.0.0.1             TCP      56     5037 → 47928 [RST, ACK] Seq=1 Ack=1 Win=0 Len=0

Frame 41: 56 bytes on wire (448 bits), 56 bytes captured (448 bits) on interface any, id 0
Linux cooked capture
Internet Protocol Version 4, Src: 127.0.0.1, Dst: 127.0.0.1
Transmission Control Protocol, Src Port: 5037, Dst Port: 47928, Seq: 1, Ack: 1, Len: 0

No.     Time           Source                Destination           Protocol Length Info
     42 8.330650114    127.0.0.1             127.0.0.1             TCP      76     47930 → 5037 [SYN] Seq=0 Win=43690 Len=0 MSS=65495 SACK_PERM=1 TSval=3195705865 TSecr=0 WS=512

Frame 42: 76 bytes on wire (608 bits), 76 bytes captured (608 bits) on interface any, id 0
Linux cooked capture
Internet Protocol Version 4, Src: 127.0.0.1, Dst: 127.0.0.1
Transmission Control Protocol, Src Port: 47930, Dst Port: 5037, Seq: 0, Len: 0

No.     Time           Source                Destination           Protocol Length Info
     43 8.330665247    127.0.0.1             127.0.0.1             TCP      56     5037 → 47930 [RST, ACK] Seq=1 Ack=1 Win=0 Len=0

Frame 43: 56 bytes on wire (448 bits), 56 bytes captured (448 bits) on interface any, id 0
Linux cooked capture
Internet Protocol Version 4, Src: 127.0.0.1, Dst: 127.0.0.1
Transmission Control Protocol, Src Port: 5037, Dst Port: 47930, Seq: 1, Ack: 1, Len: 0

No.     Time           Source                Destination           Protocol Length Info
     44 8.331967161    127.0.0.1             127.0.0.1             TCP      76     47936 → 5037 [SYN] Seq=0 Win=43690 Len=0 MSS=65495 SACK_PERM=1 TSval=3195705866 TSecr=0 WS=512

Frame 44: 76 bytes on wire (608 bits), 76 bytes captured (608 bits) on interface any, id 0
Linux cooked capture
Internet Protocol Version 4, Src: 127.0.0.1, Dst: 127.0.0.1
Transmission Control Protocol, Src Port: 47936, Dst Port: 5037, Seq: 0, Len: 0

No.     Time           Source                Destination           Protocol Length Info
     45 8.331987016    127.0.0.1             127.0.0.1             TCP      56     5037 → 47936 [RST, ACK] Seq=1 Ack=1 Win=0 Len=0

Frame 45: 56 bytes on wire (448 bits), 56 bytes captured (448 bits) on interface any, id 0
Linux cooked capture
Internet Protocol Version 4, Src: 127.0.0.1, Dst: 127.0.0.1
Transmission Control Protocol, Src Port: 5037, Dst Port: 47936, Seq: 1, Ack: 1, Len: 0

No.     Time           Source                Destination           Protocol Length Info
     46 8.333238376    127.0.0.1             127.0.0.1             TCP      76     47950 → 5037 [SYN] Seq=0 Win=43690 Len=0 MSS=65495 SACK_PERM=1 TSval=3195705867 TSecr=0 WS=512

Frame 46: 76 bytes on wire (608 bits), 76 bytes captured (608 bits) on interface any, id 0
Linux cooked capture
Internet Protocol Version 4, Src: 127.0.0.1, Dst: 127.0.0.1
Transmission Control Protocol, Src Port: 47950, Dst Port: 5037, Seq: 0, Len: 0

No.     Time           Source                Destination           Protocol Length Info
     47 8.333252045    127.0.0.1             127.0.0.1             TCP      56     5037 → 47950 [RST, ACK] Seq=1 Ack=1 Win=0 Len=0

Frame 47: 56 bytes on wire (448 bits), 56 bytes captured (448 bits) on interface any, id 0
Linux cooked capture
Internet Protocol Version 4, Src: 127.0.0.1, Dst: 127.0.0.1
Transmission Control Protocol, Src Port: 5037, Dst Port: 47950, Seq: 1, Ack: 1, Len: 0

No.     Time           Source                Destination           Protocol Length Info
     48 8.377088084    127.0.0.1             127.0.0.1             TCP      76     47428 → 6653 [SYN] Seq=0 Win=43690 Len=0 MSS=65495 SACK_PERM=1 TSval=3195705911 TSecr=0 WS=512

Frame 48: 76 bytes on wire (608 bits), 76 bytes captured (608 bits) on interface any, id 0
Linux cooked capture
Internet Protocol Version 4, Src: 127.0.0.1, Dst: 127.0.0.1
Transmission Control Protocol, Src Port: 47428, Dst Port: 6653, Seq: 0, Len: 0

No.     Time           Source                Destination           Protocol Length Info
     49 8.377109577    127.0.0.1             127.0.0.1             TCP      76     6653 → 47428 [SYN, ACK] Seq=0 Ack=1 Win=43690 Len=0 MSS=65495 SACK_PERM=1 TSval=3195705911 TSecr=3195705911 WS=512

Frame 49: 76 bytes on wire (608 bits), 76 bytes captured (608 bits) on interface any, id 0
Linux cooked capture
Internet Protocol Version 4, Src: 127.0.0.1, Dst: 127.0.0.1
Transmission Control Protocol, Src Port: 6653, Dst Port: 47428, Seq: 0, Ack: 1, Len: 0

No.     Time           Source                Destination           Protocol Length Info
     50 8.377126480    127.0.0.1             127.0.0.1             TCP      68     47428 → 6653 [ACK] Seq=1 Ack=1 Win=44032 Len=0 TSval=3195705911 TSecr=3195705911

Frame 50: 68 bytes on wire (544 bits), 68 bytes captured (544 bits) on interface any, id 0
Linux cooked capture
Internet Protocol Version 4, Src: 127.0.0.1, Dst: 127.0.0.1
Transmission Control Protocol, Src Port: 47428, Dst Port: 6653, Seq: 1, Ack: 1, Len: 0

No.     Time           Source                Destination           Protocol Length Info
     51 8.381608467    127.0.0.1             127.0.0.1             OpenFlow 84     Type: OFPT_HELLO

Frame 51: 84 bytes on wire (672 bits), 84 bytes captured (672 bits) on interface any, id 0
Linux cooked capture
Internet Protocol Version 4, Src: 127.0.0.1, Dst: 127.0.0.1
Transmission Control Protocol, Src Port: 47428, Dst Port: 6653, Seq: 1, Ack: 1, Len: 16
OpenFlow 1.3

No.     Time           Source                Destination           Protocol Length Info
     52 8.381628801    127.0.0.1             127.0.0.1             TCP      68     6653 → 47428 [ACK] Seq=1 Ack=17 Win=44032 Len=0 TSval=3195705916 TSecr=3195705916

Frame 52: 68 bytes on wire (544 bits), 68 bytes captured (544 bits) on interface any, id 0
Linux cooked capture
Internet Protocol Version 4, Src: 127.0.0.1, Dst: 127.0.0.1
Transmission Control Protocol, Src Port: 6653, Dst Port: 47428, Seq: 1, Ack: 17, Len: 0

No.     Time           Source                Destination           Protocol Length Info
     53 8.382286482    127.0.0.1             127.0.0.1             OpenFlow 76     Type: OFPT_HELLO

Frame 53: 76 bytes on wire (608 bits), 76 bytes captured (608 bits) on interface any, id 0
Linux cooked capture
Internet Protocol Version 4, Src: 127.0.0.1, Dst: 127.0.0.1
Transmission Control Protocol, Src Port: 6653, Dst Port: 47428, Seq: 1, Ack: 17, Len: 8
OpenFlow 1.3

No.     Time           Source                Destination           Protocol Length Info
     54 8.382297758    127.0.0.1             127.0.0.1             TCP      68     47428 → 6653 [ACK] Seq=17 Ack=9 Win=44032 Len=0 TSval=3195705916 TSecr=3195705916

Frame 54: 68 bytes on wire (544 bits), 68 bytes captured (544 bits) on interface any, id 0
Linux cooked capture
Internet Protocol Version 4, Src: 127.0.0.1, Dst: 127.0.0.1
Transmission Control Protocol, Src Port: 47428, Dst Port: 6653, Seq: 17, Ack: 9, Len: 0

No.     Time           Source                Destination           Protocol Length Info
     55 8.382315276    127.0.0.1             127.0.0.1             OpenFlow 76     Type: OFPT_FEATURES_REQUEST

Frame 55: 76 bytes on wire (608 bits), 76 bytes captured (608 bits) on interface any, id 0
Linux cooked capture
Internet Protocol Version 4, Src: 127.0.0.1, Dst: 127.0.0.1
Transmission Control Protocol, Src Port: 6653, Dst Port: 47428, Seq: 9, Ack: 17, Len: 8
OpenFlow 1.3

No.     Time           Source                Destination           Protocol Length Info
     56 8.382318227    127.0.0.1             127.0.0.1             TCP      68     47428 → 6653 [ACK] Seq=17 Ack=17 Win=44032 Len=0 TSval=3195705916 TSecr=3195705916

Frame 56: 68 bytes on wire (544 bits), 68 bytes captured (544 bits) on interface any, id 0
Linux cooked capture
Internet Protocol Version 4, Src: 127.0.0.1, Dst: 127.0.0.1
Transmission Control Protocol, Src Port: 47428, Dst Port: 6653, Seq: 17, Ack: 17, Len: 0

No.     Time           Source                Destination           Protocol Length Info
     57 8.397943503    127.0.0.1             127.0.0.1             OpenFlow 100    Type: OFPT_FEATURES_REPLY

Frame 57: 100 bytes on wire (800 bits), 100 bytes captured (800 bits) on interface any, id 0
Linux cooked capture
Internet Protocol Version 4, Src: 127.0.0.1, Dst: 127.0.0.1
Transmission Control Protocol, Src Port: 47428, Dst Port: 6653, Seq: 17, Ack: 17, Len: 32
OpenFlow 1.3

No.     Time           Source                Destination           Protocol Length Info
     58 8.407318646    127.0.0.1             127.0.0.1             OpenFlow 84     Type: OFPT_MULTIPART_REQUEST, OFPMP_PORT_DESC

Frame 58: 84 bytes on wire (672 bits), 84 bytes captured (672 bits) on interface any, id 0
Linux cooked capture
Internet Protocol Version 4, Src: 127.0.0.1, Dst: 127.0.0.1
Transmission Control Protocol, Src Port: 6653, Dst Port: 47428, Seq: 17, Ack: 49, Len: 16
OpenFlow 1.3

No.     Time           Source                Destination           Protocol Length Info
     59 8.407607331    127.0.0.1             127.0.0.1             OpenFlow 148    Type: OFPT_FLOW_MOD

Frame 59: 148 bytes on wire (1184 bits), 148 bytes captured (1184 bits) on interface any, id 0
Linux cooked capture
Internet Protocol Version 4, Src: 127.0.0.1, Dst: 127.0.0.1
Transmission Control Protocol, Src Port: 6653, Dst Port: 47428, Seq: 33, Ack: 49, Len: 80
OpenFlow 1.3

No.     Time           Source                Destination           Protocol Length Info
     60 8.411821019    127.0.0.1             127.0.0.1             TCP      148    [TCP Retransmission] 6653 → 47428 [PSH, ACK] Seq=33 Ack=49 Win=44032 Len=80 TSval=3195705946 TSecr=3195705932

Frame 60: 148 bytes on wire (1184 bits), 148 bytes captured (1184 bits) on interface any, id 0
Linux cooked capture
Internet Protocol Version 4, Src: 127.0.0.1, Dst: 127.0.0.1
Transmission Control Protocol, Src Port: 6653, Dst Port: 47428, Seq: 33, Ack: 49, Len: 80

No.     Time           Source                Destination           Protocol Length Info
     61 8.411854917    127.0.0.1             127.0.0.1             TCP      80     47428 → 6653 [ACK] Seq=49 Ack=113 Win=44032 Len=0 TSval=3195705946 TSecr=3195705941 SLE=33 SRE=113

Frame 61: 80 bytes on wire (640 bits), 80 bytes captured (640 bits) on interface any, id 0
Linux cooked capture
Internet Protocol Version 4, Src: 127.0.0.1, Dst: 127.0.0.1
Transmission Control Protocol, Src Port: 47428, Dst Port: 6653, Seq: 49, Ack: 113, Len: 0

No.     Time           Source                Destination           Protocol Length Info
     62 8.421126740    127.0.0.1             127.0.0.1             OpenFlow 276    Type: OFPT_MULTIPART_REPLY, OFPMP_PORT_DESC

Frame 62: 276 bytes on wire (2208 bits), 276 bytes captured (2208 bits) on interface any, id 0
Linux cooked capture
Internet Protocol Version 4, Src: 127.0.0.1, Dst: 127.0.0.1
Transmission Control Protocol, Src Port: 47428, Dst Port: 6653, Seq: 49, Ack: 113, Len: 208
OpenFlow 1.3

No.     Time           Source                Destination           Protocol Length Info
     63 8.430027091    127.0.0.1             127.0.0.1             OpenFlow 132    Type: OFPT_FLOW_MOD

Frame 63: 132 bytes on wire (1056 bits), 132 bytes captured (1056 bits) on interface any, id 0
Linux cooked capture
Internet Protocol Version 4, Src: 127.0.0.1, Dst: 127.0.0.1
Transmission Control Protocol, Src Port: 6653, Dst Port: 47428, Seq: 113, Ack: 257, Len: 64
OpenFlow 1.3

No.     Time           Source                Destination           Protocol Length Info
     64 8.467687631    127.0.0.1             127.0.0.1             TCP      68     47428 → 6653 [ACK] Seq=257 Ack=177 Win=44032 Len=0 TSval=3195706002 TSecr=3195705964

Frame 64: 68 bytes on wire (544 bits), 68 bytes captured (544 bits) on interface any, id 0
Linux cooked capture
Internet Protocol Version 4, Src: 127.0.0.1, Dst: 127.0.0.1
Transmission Control Protocol, Src Port: 47428, Dst Port: 6653, Seq: 257, Ack: 177, Len: 0

No.     Time           Source                Destination           Protocol Length Info
     65 8.467726144    ::                    ff02::1:ff00:2        ICMPv6   88     Neighbor Solicitation for fe80::200:ff:fe00:2

Frame 65: 88 bytes on wire (704 bits), 88 bytes captured (704 bits) on interface any, id 0
Linux cooked capture
Internet Protocol Version 6, Src: ::, Dst: ff02::1:ff00:2
Internet Control Message Protocol v6

No.     Time           Source                Destination           Protocol Length Info
     66 8.468810976    127.0.0.1             127.0.0.1             OpenFlow 196    Type: OFPT_PACKET_IN

Frame 66: 196 bytes on wire (1568 bits), 196 bytes captured (1568 bits) on interface any, id 0
Linux cooked capture
Internet Protocol Version 4, Src: 127.0.0.1, Dst: 127.0.0.1
Transmission Control Protocol, Src Port: 47428, Dst Port: 6653, Seq: 257, Ack: 177, Len: 128
OpenFlow 1.3

No.     Time           Source                Destination           Protocol Length Info
     67 8.470592902    127.0.0.1             127.0.0.1             OpenFlow 194    Type: OFPT_PACKET_OUT

Frame 67: 194 bytes on wire (1552 bits), 194 bytes captured (1552 bits) on interface any, id 0
Linux cooked capture
Internet Protocol Version 4, Src: 127.0.0.1, Dst: 127.0.0.1
Transmission Control Protocol, Src Port: 6653, Dst Port: 47428, Seq: 177, Ack: 385, Len: 126
OpenFlow 1.3

No.     Time           Source                Destination           Protocol Length Info
     68 8.470612087    127.0.0.1             127.0.0.1             TCP      68     47428 → 6653 [ACK] Seq=385 Ack=303 Win=44032 Len=0 TSval=3195706005 TSecr=3195706005

Frame 68: 68 bytes on wire (544 bits), 68 bytes captured (544 bits) on interface any, id 0
Linux cooked capture
Internet Protocol Version 4, Src: 127.0.0.1, Dst: 127.0.0.1
Transmission Control Protocol, Src Port: 47428, Dst Port: 6653, Seq: 385, Ack: 303, Len: 0

No.     Time           Source                Destination           Protocol Length Info
     69 8.470981924    ::                    ff02::1:ff00:2        ICMPv6   88     Neighbor Solicitation for fe80::200:ff:fe00:2

Frame 69: 88 bytes on wire (704 bits), 88 bytes captured (704 bits) on interface any, id 0
Linux cooked capture
Internet Protocol Version 6, Src: ::, Dst: ff02::1:ff00:2
Internet Control Message Protocol v6

No.     Time           Source                Destination           Protocol Length Info
     70 8.547779071    ::                    ff02::1:ff3f:9dae     ICMPv6   88     Neighbor Solicitation for fe80::24b8:1bff:fe3f:9dae

Frame 70: 88 bytes on wire (704 bits), 88 bytes captured (704 bits) on interface any, id 0
Linux cooked capture
Internet Protocol Version 6, Src: ::, Dst: ff02::1:ff3f:9dae
Internet Control Message Protocol v6

No.     Time           Source                Destination           Protocol Length Info
     71 8.720934351    ::                    ff02::16              ICMPv6   92     Multicast Listener Report Message v2

Frame 71: 92 bytes on wire (736 bits), 92 bytes captured (736 bits) on interface any, id 0
Linux cooked capture
Internet Protocol Version 6, Src: ::, Dst: ff02::16
Internet Control Message Protocol v6

No.     Time           Source                Destination           Protocol Length Info
     72 8.720958114    ::                    ff02::1:ff00:1        ICMPv6   88     Neighbor Solicitation for fe80::200:ff:fe00:1

Frame 72: 88 bytes on wire (704 bits), 88 bytes captured (704 bits) on interface any, id 0
Linux cooked capture
Internet Protocol Version 6, Src: ::, Dst: ff02::1:ff00:1
Internet Control Message Protocol v6

No.     Time           Source                Destination           Protocol Length Info
     73 8.721415032    127.0.0.1             127.0.0.1             OpenFlow 196    Type: OFPT_PACKET_IN

Frame 73: 196 bytes on wire (1568 bits), 196 bytes captured (1568 bits) on interface any, id 0
Linux cooked capture
Internet Protocol Version 4, Src: 127.0.0.1, Dst: 127.0.0.1
Transmission Control Protocol, Src Port: 47428, Dst Port: 6653, Seq: 385, Ack: 303, Len: 128
OpenFlow 1.3

No.     Time           Source                Destination           Protocol Length Info
     74 8.722356426    127.0.0.1             127.0.0.1             OpenFlow 194    Type: OFPT_PACKET_OUT

Frame 74: 194 bytes on wire (1552 bits), 194 bytes captured (1552 bits) on interface any, id 0
Linux cooked capture
Internet Protocol Version 4, Src: 127.0.0.1, Dst: 127.0.0.1
Transmission Control Protocol, Src Port: 6653, Dst Port: 47428, Seq: 303, Ack: 513, Len: 126
OpenFlow 1.3

No.     Time           Source                Destination           Protocol Length Info
     75 8.722370969    127.0.0.1             127.0.0.1             TCP      68     47428 → 6653 [ACK] Seq=513 Ack=429 Win=44032 Len=0 TSval=3195706256 TSecr=3195706256

Frame 75: 68 bytes on wire (544 bits), 68 bytes captured (544 bits) on interface any, id 0
Linux cooked capture
Internet Protocol Version 4, Src: 127.0.0.1, Dst: 127.0.0.1
Transmission Control Protocol, Src Port: 47428, Dst Port: 6653, Seq: 513, Ack: 429, Len: 0

No.     Time           Source                Destination           Protocol Length Info
     76 8.722606575    ::                    ff02::1:ff00:1        ICMPv6   88     Neighbor Solicitation for fe80::200:ff:fe00:1

Frame 76: 88 bytes on wire (704 bits), 88 bytes captured (704 bits) on interface any, id 0
Linux cooked capture
Internet Protocol Version 6, Src: ::, Dst: ff02::1:ff00:1
Internet Control Message Protocol v6

No.     Time           Source                Destination           Protocol Length Info
     77 8.965765956    ::                    ff02::16              ICMPv6   112    Multicast Listener Report Message v2

Frame 77: 112 bytes on wire (896 bits), 112 bytes captured (896 bits) on interface any, id 0
Linux cooked capture
Internet Protocol Version 6, Src: ::, Dst: ff02::16
Internet Control Message Protocol v6

No.     Time           Source                Destination           Protocol Length Info
     78 8.966159029    127.0.0.1             127.0.0.1             OpenFlow 220    Type: OFPT_PACKET_IN

Frame 78: 220 bytes on wire (1760 bits), 220 bytes captured (1760 bits) on interface any, id 0
Linux cooked capture
Internet Protocol Version 4, Src: 127.0.0.1, Dst: 127.0.0.1
Transmission Control Protocol, Src Port: 47428, Dst Port: 6653, Seq: 513, Ack: 429, Len: 152
OpenFlow 1.3

No.     Time           Source                Destination           Protocol Length Info
     79 8.968494763    127.0.0.1             127.0.0.1             OpenFlow 218    Type: OFPT_PACKET_OUT

Frame 79: 218 bytes on wire (1744 bits), 218 bytes captured (1744 bits) on interface any, id 0
Linux cooked capture
Internet Protocol Version 4, Src: 127.0.0.1, Dst: 127.0.0.1
Transmission Control Protocol, Src Port: 6653, Dst Port: 47428, Seq: 429, Ack: 665, Len: 150
OpenFlow 1.3

No.     Time           Source                Destination           Protocol Length Info
     80 8.968509447    127.0.0.1             127.0.0.1             TCP      68     47428 → 6653 [ACK] Seq=665 Ack=579 Win=44032 Len=0 TSval=3195706503 TSecr=3195706502

Frame 80: 68 bytes on wire (544 bits), 68 bytes captured (544 bits) on interface any, id 0
Linux cooked capture
Internet Protocol Version 4, Src: 127.0.0.1, Dst: 127.0.0.1
Transmission Control Protocol, Src Port: 47428, Dst Port: 6653, Seq: 665, Ack: 579, Len: 0

No.     Time           Source                Destination           Protocol Length Info
     81 8.968768378    ::                    ff02::16              ICMPv6   112    Multicast Listener Report Message v2

Frame 81: 112 bytes on wire (896 bits), 112 bytes captured (896 bits) on interface any, id 0
Linux cooked capture
Internet Protocol Version 6, Src: ::, Dst: ff02::16
Internet Control Message Protocol v6

No.     Time           Source                Destination           Protocol Length Info
     82 9.124377605    ::                    ff02::1:ffb6:87f7     ICMPv6   88     Neighbor Solicitation for fe80::9492:70ff:feb6:87f7

Frame 82: 88 bytes on wire (704 bits), 88 bytes captured (704 bits) on interface any, id 0
Linux cooked capture
Internet Protocol Version 6, Src: ::, Dst: ff02::1:ffb6:87f7
Internet Control Message Protocol v6

