No.     Time           Source                Destination           Protocol Length Info
      1 0.000000000    127.0.0.1             127.0.0.1             TCP      76     47230 → 6653 [SYN] Seq=0 Win=43690 Len=0 MSS=65495 SACK_PERM=1 TSval=3195767708 TSecr=0 WS=512

Frame 1: 76 bytes on wire (608 bits), 76 bytes captured (608 bits) on interface any, id 0
Linux cooked capture
Internet Protocol Version 4, Src: 127.0.0.1, Dst: 127.0.0.1
Transmission Control Protocol, Src Port: 47230, Dst Port: 6653, Seq: 0, Len: 0

No.     Time           Source                Destination           Protocol Length Info
      2 0.000045372    127.0.0.1             127.0.0.1             TCP      76     6653 → 47230 [SYN, ACK] Seq=0 Ack=1 Win=43690 Len=0 MSS=65495 SACK_PERM=1 TSval=3195767708 TSecr=3195767708 WS=512

Frame 2: 76 bytes on wire (608 bits), 76 bytes captured (608 bits) on interface any, id 0
Linux cooked capture
Internet Protocol Version 4, Src: 127.0.0.1, Dst: 127.0.0.1
Transmission Control Protocol, Src Port: 6653, Dst Port: 47230, Seq: 0, Ack: 1, Len: 0

No.     Time           Source                Destination           Protocol Length Info
      3 0.000068974    127.0.0.1             127.0.0.1             TCP      68     47230 → 6653 [ACK] Seq=1 Ack=1 Win=44032 Len=0 TSval=3195767708 TSecr=3195767708

Frame 3: 68 bytes on wire (544 bits), 68 bytes captured (544 bits) on interface any, id 0
Linux cooked capture
Internet Protocol Version 4, Src: 127.0.0.1, Dst: 127.0.0.1
Transmission Control Protocol, Src Port: 47230, Dst Port: 6653, Seq: 1, Ack: 1, Len: 0

No.     Time           Source                Destination           Protocol Length Info
      4 0.000303010    127.0.0.1             127.0.0.1             TCP      68     47230 → 6653 [FIN, ACK] Seq=1 Ack=1 Win=44032 Len=0 TSval=3195767708 TSecr=3195767708

Frame 4: 68 bytes on wire (544 bits), 68 bytes captured (544 bits) on interface any, id 0
Linux cooked capture
Internet Protocol Version 4, Src: 127.0.0.1, Dst: 127.0.0.1
Transmission Control Protocol, Src Port: 47230, Dst Port: 6653, Seq: 1, Ack: 1, Len: 0

No.     Time           Source                Destination           Protocol Length Info
      5 0.001973538    127.0.0.1             127.0.0.1             TCP      68     6653 → 47230 [FIN, ACK] Seq=1 Ack=2 Win=44032 Len=0 TSval=3195767710 TSecr=3195767708

Frame 5: 68 bytes on wire (544 bits), 68 bytes captured (544 bits) on interface any, id 0
Linux cooked capture
Internet Protocol Version 4, Src: 127.0.0.1, Dst: 127.0.0.1
Transmission Control Protocol, Src Port: 6653, Dst Port: 47230, Seq: 1, Ack: 2, Len: 0

No.     Time           Source                Destination           Protocol Length Info
      6 0.002004461    127.0.0.1             127.0.0.1             TCP      68     47230 → 6653 [ACK] Seq=2 Ack=2 Win=44032 Len=0 TSval=3195767710 TSecr=3195767710

Frame 6: 68 bytes on wire (544 bits), 68 bytes captured (544 bits) on interface any, id 0
Linux cooked capture
Internet Protocol Version 4, Src: 127.0.0.1, Dst: 127.0.0.1
Transmission Control Protocol, Src Port: 47230, Dst Port: 6653, Seq: 2, Ack: 2, Len: 0

No.     Time           Source                Destination           Protocol Length Info
      7 0.161688956    ::                    ff02::16              ICMPv6   92     Multicast Listener Report Message v2

Frame 7: 92 bytes on wire (736 bits), 92 bytes captured (736 bits) on interface any, id 0
Linux cooked capture
Internet Protocol Version 6, Src: ::, Dst: ff02::16
Internet Control Message Protocol v6

No.     Time           Source                Destination           Protocol Length Info
      8 0.161719112    ::                    ff02::16              ICMPv6   92     Multicast Listener Report Message v2

Frame 8: 92 bytes on wire (736 bits), 92 bytes captured (736 bits) on interface any, id 0
Linux cooked capture
Internet Protocol Version 6, Src: ::, Dst: ff02::16
Internet Control Message Protocol v6

No.     Time           Source                Destination           Protocol Length Info
      9 0.233993605    ::                    ff02::16              ICMPv6   92     Multicast Listener Report Message v2

Frame 9: 92 bytes on wire (736 bits), 92 bytes captured (736 bits) on interface any, id 0
Linux cooked capture
Internet Protocol Version 6, Src: ::, Dst: ff02::16
Internet Control Message Protocol v6

No.     Time           Source                Destination           Protocol Length Info
     10 0.233978738    ::                    ff02::16              ICMPv6   92     Multicast Listener Report Message v2

Frame 10: 92 bytes on wire (736 bits), 92 bytes captured (736 bits) on interface any, id 0
Linux cooked capture
Internet Protocol Version 6, Src: ::, Dst: ff02::16
Internet Control Message Protocol v6

No.     Time           Source                Destination           Protocol Length Info
     11 0.246253984    ::                    ff02::16              ICMPv6   92     Multicast Listener Report Message v2

Frame 11: 92 bytes on wire (736 bits), 92 bytes captured (736 bits) on interface any, id 0
Linux cooked capture
Internet Protocol Version 6, Src: ::, Dst: ff02::16
Internet Control Message Protocol v6

No.     Time           Source                Destination           Protocol Length Info
     12 0.277573424    ::                    ff02::16              ICMPv6   92     Multicast Listener Report Message v2

Frame 12: 92 bytes on wire (736 bits), 92 bytes captured (736 bits) on interface any, id 0
Linux cooked capture
Internet Protocol Version 6, Src: ::, Dst: ff02::16
Internet Control Message Protocol v6

No.     Time           Source                Destination           Protocol Length Info
     13 0.277594022    ::                    ff02::16              ICMPv6   112    Multicast Listener Report Message v2

Frame 13: 112 bytes on wire (896 bits), 112 bytes captured (896 bits) on interface any, id 0
Linux cooked capture
Internet Protocol Version 6, Src: ::, Dst: ff02::16
Internet Control Message Protocol v6

No.     Time           Source                Destination           Protocol Length Info
     14 0.305651937    ::                    ff02::16              ICMPv6   92     Multicast Listener Report Message v2

Frame 14: 92 bytes on wire (736 bits), 92 bytes captured (736 bits) on interface any, id 0
Linux cooked capture
Internet Protocol Version 6, Src: ::, Dst: ff02::16
Internet Control Message Protocol v6

No.     Time           Source                Destination           Protocol Length Info
     15 0.305684149    ::                    ff02::16              ICMPv6   112    Multicast Listener Report Message v2

Frame 15: 112 bytes on wire (896 bits), 112 bytes captured (896 bits) on interface any, id 0
Linux cooked capture
Internet Protocol Version 6, Src: ::, Dst: ff02::16
Internet Control Message Protocol v6

No.     Time           Source                Destination           Protocol Length Info
     16 0.322576179    127.0.0.1             127.0.0.1             TCP      76     44848 → 5037 [SYN] Seq=0 Win=43690 Len=0 MSS=65495 SACK_PERM=1 TSval=3195768031 TSecr=0 WS=512

Frame 16: 76 bytes on wire (608 bits), 76 bytes captured (608 bits) on interface any, id 0
Linux cooked capture
Internet Protocol Version 4, Src: 127.0.0.1, Dst: 127.0.0.1
Transmission Control Protocol, Src Port: 44848, Dst Port: 5037, Seq: 0, Len: 0

No.     Time           Source                Destination           Protocol Length Info
     17 0.322607845    127.0.0.1             127.0.0.1             TCP      56     5037 → 44848 [RST, ACK] Seq=1 Ack=1 Win=0 Len=0

Frame 17: 56 bytes on wire (448 bits), 56 bytes captured (448 bits) on interface any, id 0
Linux cooked capture
Internet Protocol Version 4, Src: 127.0.0.1, Dst: 127.0.0.1
Transmission Control Protocol, Src Port: 5037, Dst Port: 44848, Seq: 1, Ack: 1, Len: 0

No.     Time           Source                Destination           Protocol Length Info
     18 0.326273099    127.0.0.1             127.0.0.1             TCP      76     44858 → 5037 [SYN] Seq=0 Win=43690 Len=0 MSS=65495 SACK_PERM=1 TSval=3195768034 TSecr=0 WS=512

Frame 18: 76 bytes on wire (608 bits), 76 bytes captured (608 bits) on interface any, id 0
Linux cooked capture
Internet Protocol Version 4, Src: 127.0.0.1, Dst: 127.0.0.1
Transmission Control Protocol, Src Port: 44858, Dst Port: 5037, Seq: 0, Len: 0

No.     Time           Source                Destination           Protocol Length Info
     19 0.326284866    127.0.0.1             127.0.0.1             TCP      56     5037 → 44858 [RST, ACK] Seq=1 Ack=1 Win=0 Len=0

Frame 19: 56 bytes on wire (448 bits), 56 bytes captured (448 bits) on interface any, id 0
Linux cooked capture
Internet Protocol Version 4, Src: 127.0.0.1, Dst: 127.0.0.1
Transmission Control Protocol, Src Port: 5037, Dst Port: 44858, Seq: 1, Ack: 1, Len: 0

No.     Time           Source                Destination           Protocol Length Info
     20 0.327944724    127.0.0.1             127.0.0.1             TCP      76     44864 → 5037 [SYN] Seq=0 Win=43690 Len=0 MSS=65495 SACK_PERM=1 TSval=3195768036 TSecr=0 WS=512

Frame 20: 76 bytes on wire (608 bits), 76 bytes captured (608 bits) on interface any, id 0
Linux cooked capture
Internet Protocol Version 4, Src: 127.0.0.1, Dst: 127.0.0.1
Transmission Control Protocol, Src Port: 44864, Dst Port: 5037, Seq: 0, Len: 0

No.     Time           Source                Destination           Protocol Length Info
     21 0.327967089    127.0.0.1             127.0.0.1             TCP      56     5037 → 44864 [RST, ACK] Seq=1 Ack=1 Win=0 Len=0

Frame 21: 56 bytes on wire (448 bits), 56 bytes captured (448 bits) on interface any, id 0
Linux cooked capture
Internet Protocol Version 4, Src: 127.0.0.1, Dst: 127.0.0.1
Transmission Control Protocol, Src Port: 5037, Dst Port: 44864, Seq: 1, Ack: 1, Len: 0

No.     Time           Source                Destination           Protocol Length Info
     22 0.329801277    127.0.0.1             127.0.0.1             TCP      76     44872 → 5037 [SYN] Seq=0 Win=43690 Len=0 MSS=65495 SACK_PERM=1 TSval=3195768038 TSecr=0 WS=512

Frame 22: 76 bytes on wire (608 bits), 76 bytes captured (608 bits) on interface any, id 0
Linux cooked capture
Internet Protocol Version 4, Src: 127.0.0.1, Dst: 127.0.0.1
Transmission Control Protocol, Src Port: 44872, Dst Port: 5037, Seq: 0, Len: 0

No.     Time           Source                Destination           Protocol Length Info
     23 0.329816251    127.0.0.1             127.0.0.1             TCP      56     5037 → 44872 [RST, ACK] Seq=1 Ack=1 Win=0 Len=0

Frame 23: 56 bytes on wire (448 bits), 56 bytes captured (448 bits) on interface any, id 0
Linux cooked capture
Internet Protocol Version 4, Src: 127.0.0.1, Dst: 127.0.0.1
Transmission Control Protocol, Src Port: 5037, Dst Port: 44872, Seq: 1, Ack: 1, Len: 0

No.     Time           Source                Destination           Protocol Length Info
     24 0.329849326    ::                    ff02::1:ff01:dafa     ICMPv6   88     Neighbor Solicitation for fe80::70d6:9cff:fe01:dafa

Frame 24: 88 bytes on wire (704 bits), 88 bytes captured (704 bits) on interface any, id 0
Linux cooked capture
Internet Protocol Version 6, Src: ::, Dst: ff02::1:ff01:dafa
Internet Control Message Protocol v6

No.     Time           Source                Destination           Protocol Length Info
     25 0.331394297    127.0.0.1             127.0.0.1             TCP      76     44882 → 5037 [SYN] Seq=0 Win=43690 Len=0 MSS=65495 SACK_PERM=1 TSval=3195768039 TSecr=0 WS=512

Frame 25: 76 bytes on wire (608 bits), 76 bytes captured (608 bits) on interface any, id 0
Linux cooked capture
Internet Protocol Version 4, Src: 127.0.0.1, Dst: 127.0.0.1
Transmission Control Protocol, Src Port: 44882, Dst Port: 5037, Seq: 0, Len: 0

No.     Time           Source                Destination           Protocol Length Info
     26 0.331411433    127.0.0.1             127.0.0.1             TCP      56     5037 → 44882 [RST, ACK] Seq=1 Ack=1 Win=0 Len=0

Frame 26: 56 bytes on wire (448 bits), 56 bytes captured (448 bits) on interface any, id 0
Linux cooked capture
Internet Protocol Version 4, Src: 127.0.0.1, Dst: 127.0.0.1
Transmission Control Protocol, Src Port: 5037, Dst Port: 44882, Seq: 1, Ack: 1, Len: 0

No.     Time           Source                Destination           Protocol Length Info
     27 0.332773133    127.0.0.1             127.0.0.1             TCP      76     44896 → 5037 [SYN] Seq=0 Win=43690 Len=0 MSS=65495 SACK_PERM=1 TSval=3195768041 TSecr=0 WS=512

Frame 27: 76 bytes on wire (608 bits), 76 bytes captured (608 bits) on interface any, id 0
Linux cooked capture
Internet Protocol Version 4, Src: 127.0.0.1, Dst: 127.0.0.1
Transmission Control Protocol, Src Port: 44896, Dst Port: 5037, Seq: 0, Len: 0

No.     Time           Source                Destination           Protocol Length Info
     28 0.332790728    127.0.0.1             127.0.0.1             TCP      56     5037 → 44896 [RST, ACK] Seq=1 Ack=1 Win=0 Len=0

Frame 28: 56 bytes on wire (448 bits), 56 bytes captured (448 bits) on interface any, id 0
Linux cooked capture
Internet Protocol Version 4, Src: 127.0.0.1, Dst: 127.0.0.1
Transmission Control Protocol, Src Port: 5037, Dst Port: 44896, Seq: 1, Ack: 1, Len: 0

No.     Time           Source                Destination           Protocol Length Info
     29 0.333797062    ::                    ff02::16              ICMPv6   92     Multicast Listener Report Message v2

Frame 29: 92 bytes on wire (736 bits), 92 bytes captured (736 bits) on interface any, id 0
Linux cooked capture
Internet Protocol Version 6, Src: ::, Dst: ff02::16
Internet Control Message Protocol v6

No.     Time           Source                Destination           Protocol Length Info
     30 0.338050152    127.0.0.1             127.0.0.1             TCP      76     44904 → 5037 [SYN] Seq=0 Win=43690 Len=0 MSS=65495 SACK_PERM=1 TSval=3195768046 TSecr=0 WS=512

Frame 30: 76 bytes on wire (608 bits), 76 bytes captured (608 bits) on interface any, id 0
Linux cooked capture
Internet Protocol Version 4, Src: 127.0.0.1, Dst: 127.0.0.1
Transmission Control Protocol, Src Port: 44904, Dst Port: 5037, Seq: 0, Len: 0

No.     Time           Source                Destination           Protocol Length Info
     31 0.338074058    127.0.0.1             127.0.0.1             TCP      56     5037 → 44904 [RST, ACK] Seq=1 Ack=1 Win=0 Len=0

Frame 31: 56 bytes on wire (448 bits), 56 bytes captured (448 bits) on interface any, id 0
Linux cooked capture
Internet Protocol Version 4, Src: 127.0.0.1, Dst: 127.0.0.1
Transmission Control Protocol, Src Port: 5037, Dst Port: 44904, Seq: 1, Ack: 1, Len: 0

No.     Time           Source                Destination           Protocol Length Info
     32 0.347536544    127.0.0.1             127.0.0.1             TCP      76     44916 → 5037 [SYN] Seq=0 Win=43690 Len=0 MSS=65495 SACK_PERM=1 TSval=3195768056 TSecr=0 WS=512

Frame 32: 76 bytes on wire (608 bits), 76 bytes captured (608 bits) on interface any, id 0
Linux cooked capture
Internet Protocol Version 4, Src: 127.0.0.1, Dst: 127.0.0.1
Transmission Control Protocol, Src Port: 44916, Dst Port: 5037, Seq: 0, Len: 0

No.     Time           Source                Destination           Protocol Length Info
     33 0.347578959    127.0.0.1             127.0.0.1             TCP      56     5037 → 44916 [RST, ACK] Seq=1 Ack=1 Win=0 Len=0

Frame 33: 56 bytes on wire (448 bits), 56 bytes captured (448 bits) on interface any, id 0
Linux cooked capture
Internet Protocol Version 4, Src: 127.0.0.1, Dst: 127.0.0.1
Transmission Control Protocol, Src Port: 5037, Dst Port: 44916, Seq: 1, Ack: 1, Len: 0

No.     Time           Source                Destination           Protocol Length Info
     34 0.349142728    127.0.0.1             127.0.0.1             TCP      76     44928 → 5037 [SYN] Seq=0 Win=43690 Len=0 MSS=65495 SACK_PERM=1 TSval=3195768057 TSecr=0 WS=512

Frame 34: 76 bytes on wire (608 bits), 76 bytes captured (608 bits) on interface any, id 0
Linux cooked capture
Internet Protocol Version 4, Src: 127.0.0.1, Dst: 127.0.0.1
Transmission Control Protocol, Src Port: 44928, Dst Port: 5037, Seq: 0, Len: 0

No.     Time           Source                Destination           Protocol Length Info
     35 0.349164090    127.0.0.1             127.0.0.1             TCP      56     5037 → 44928 [RST, ACK] Seq=1 Ack=1 Win=0 Len=0

Frame 35: 56 bytes on wire (448 bits), 56 bytes captured (448 bits) on interface any, id 0
Linux cooked capture
Internet Protocol Version 4, Src: 127.0.0.1, Dst: 127.0.0.1
Transmission Control Protocol, Src Port: 5037, Dst Port: 44928, Seq: 1, Ack: 1, Len: 0

No.     Time           Source                Destination           Protocol Length Info
     36 0.356937530    127.0.0.1             127.0.0.1             TCP      76     44940 → 5037 [SYN] Seq=0 Win=43690 Len=0 MSS=65495 SACK_PERM=1 TSval=3195768065 TSecr=0 WS=512

Frame 36: 76 bytes on wire (608 bits), 76 bytes captured (608 bits) on interface any, id 0
Linux cooked capture
Internet Protocol Version 4, Src: 127.0.0.1, Dst: 127.0.0.1
Transmission Control Protocol, Src Port: 44940, Dst Port: 5037, Seq: 0, Len: 0

No.     Time           Source                Destination           Protocol Length Info
     37 0.356949884    127.0.0.1             127.0.0.1             TCP      56     5037 → 44940 [RST, ACK] Seq=1 Ack=1 Win=0 Len=0

Frame 37: 56 bytes on wire (448 bits), 56 bytes captured (448 bits) on interface any, id 0
Linux cooked capture
Internet Protocol Version 4, Src: 127.0.0.1, Dst: 127.0.0.1
Transmission Control Protocol, Src Port: 5037, Dst Port: 44940, Seq: 1, Ack: 1, Len: 0

No.     Time           Source                Destination           Protocol Length Info
     38 0.365241423    127.0.0.1             127.0.0.1             TCP      76     47236 → 6653 [SYN] Seq=0 Win=43690 Len=0 MSS=65495 SACK_PERM=1 TSval=3195768073 TSecr=0 WS=512

Frame 38: 76 bytes on wire (608 bits), 76 bytes captured (608 bits) on interface any, id 0
Linux cooked capture
Internet Protocol Version 4, Src: 127.0.0.1, Dst: 127.0.0.1
Transmission Control Protocol, Src Port: 47236, Dst Port: 6653, Seq: 0, Len: 0

No.     Time           Source                Destination           Protocol Length Info
     39 0.365272902    127.0.0.1             127.0.0.1             TCP      76     6653 → 47236 [SYN, ACK] Seq=0 Ack=1 Win=43690 Len=0 MSS=65495 SACK_PERM=1 TSval=3195768073 TSecr=3195768073 WS=512

Frame 39: 76 bytes on wire (608 bits), 76 bytes captured (608 bits) on interface any, id 0
Linux cooked capture
Internet Protocol Version 4, Src: 127.0.0.1, Dst: 127.0.0.1
Transmission Control Protocol, Src Port: 6653, Dst Port: 47236, Seq: 0, Ack: 1, Len: 0

No.     Time           Source                Destination           Protocol Length Info
     40 0.365291288    127.0.0.1             127.0.0.1             TCP      68     47236 → 6653 [ACK] Seq=1 Ack=1 Win=44032 Len=0 TSval=3195768073 TSecr=3195768073

Frame 40: 68 bytes on wire (544 bits), 68 bytes captured (544 bits) on interface any, id 0
Linux cooked capture
Internet Protocol Version 4, Src: 127.0.0.1, Dst: 127.0.0.1
Transmission Control Protocol, Src Port: 47236, Dst Port: 6653, Seq: 1, Ack: 1, Len: 0

No.     Time           Source                Destination           Protocol Length Info
     41 0.366809890    127.0.0.1             127.0.0.1             OpenFlow 76     Type: OFPT_HELLO

Frame 41: 76 bytes on wire (608 bits), 76 bytes captured (608 bits) on interface any, id 0
Linux cooked capture
Internet Protocol Version 4, Src: 127.0.0.1, Dst: 127.0.0.1
Transmission Control Protocol, Src Port: 6653, Dst Port: 47236, Seq: 1, Ack: 1, Len: 8
OpenFlow 1.3

No.     Time           Source                Destination           Protocol Length Info
     42 0.366837808    127.0.0.1             127.0.0.1             TCP      68     47236 → 6653 [ACK] Seq=1 Ack=9 Win=44032 Len=0 TSval=3195768075 TSecr=3195768075

Frame 42: 68 bytes on wire (544 bits), 68 bytes captured (544 bits) on interface any, id 0
Linux cooked capture
Internet Protocol Version 4, Src: 127.0.0.1, Dst: 127.0.0.1
Transmission Control Protocol, Src Port: 47236, Dst Port: 6653, Seq: 1, Ack: 9, Len: 0

No.     Time           Source                Destination           Protocol Length Info
     43 0.374681866    127.0.0.1             127.0.0.1             OpenFlow 84     Type: OFPT_HELLO

Frame 43: 84 bytes on wire (672 bits), 84 bytes captured (672 bits) on interface any, id 0
Linux cooked capture
Internet Protocol Version 4, Src: 127.0.0.1, Dst: 127.0.0.1
Transmission Control Protocol, Src Port: 47236, Dst Port: 6653, Seq: 1, Ack: 9, Len: 16
OpenFlow 1.3

No.     Time           Source                Destination           Protocol Length Info
     44 0.374694376    127.0.0.1             127.0.0.1             TCP      68     6653 → 47236 [ACK] Seq=9 Ack=17 Win=44032 Len=0 TSval=3195768083 TSecr=3195768083

Frame 44: 68 bytes on wire (544 bits), 68 bytes captured (544 bits) on interface any, id 0
Linux cooked capture
Internet Protocol Version 4, Src: 127.0.0.1, Dst: 127.0.0.1
Transmission Control Protocol, Src Port: 6653, Dst Port: 47236, Seq: 9, Ack: 17, Len: 0

No.     Time           Source                Destination           Protocol Length Info
     45 0.375772946    127.0.0.1             127.0.0.1             OpenFlow 76     Type: OFPT_FEATURES_REQUEST

Frame 45: 76 bytes on wire (608 bits), 76 bytes captured (608 bits) on interface any, id 0
Linux cooked capture
Internet Protocol Version 4, Src: 127.0.0.1, Dst: 127.0.0.1
Transmission Control Protocol, Src Port: 6653, Dst Port: 47236, Seq: 9, Ack: 17, Len: 8
OpenFlow 1.3

No.     Time           Source                Destination           Protocol Length Info
     46 0.376757653    127.0.0.1             127.0.0.1             OpenFlow 148    Type: OFPT_PORT_STATUS

Frame 46: 148 bytes on wire (1184 bits), 148 bytes captured (1184 bits) on interface any, id 0
Linux cooked capture
Internet Protocol Version 4, Src: 127.0.0.1, Dst: 127.0.0.1
Transmission Control Protocol, Src Port: 47236, Dst Port: 6653, Seq: 17, Ack: 17, Len: 80
OpenFlow 1.3

No.     Time           Source                Destination           Protocol Length Info
     47 0.377202209    127.0.0.1             127.0.0.1             OpenFlow 100    Type: OFPT_FEATURES_REPLY

Frame 47: 100 bytes on wire (800 bits), 100 bytes captured (800 bits) on interface any, id 0
Linux cooked capture
Internet Protocol Version 4, Src: 127.0.0.1, Dst: 127.0.0.1
Transmission Control Protocol, Src Port: 47236, Dst Port: 6653, Seq: 97, Ack: 17, Len: 32
OpenFlow 1.3

No.     Time           Source                Destination           Protocol Length Info
     48 0.378762444    127.0.0.1             127.0.0.1             TCP      68     6653 → 47236 [ACK] Seq=17 Ack=129 Win=44032 Len=0 TSval=3195768087 TSecr=3195768085

Frame 48: 68 bytes on wire (544 bits), 68 bytes captured (544 bits) on interface any, id 0
Linux cooked capture
Internet Protocol Version 4, Src: 127.0.0.1, Dst: 127.0.0.1
Transmission Control Protocol, Src Port: 6653, Dst Port: 47236, Seq: 17, Ack: 129, Len: 0

No.     Time           Source                Destination           Protocol Length Info
     49 0.379738148    127.0.0.1             127.0.0.1             OpenFlow 84     Type: OFPT_MULTIPART_REQUEST, OFPMP_PORT_DESC

Frame 49: 84 bytes on wire (672 bits), 84 bytes captured (672 bits) on interface any, id 0
Linux cooked capture
Internet Protocol Version 4, Src: 127.0.0.1, Dst: 127.0.0.1
Transmission Control Protocol, Src Port: 6653, Dst Port: 47236, Seq: 17, Ack: 129, Len: 16
OpenFlow 1.3

No.     Time           Source                Destination           Protocol Length Info
     50 0.379775618    127.0.0.1             127.0.0.1             OpenFlow 148    Type: OFPT_FLOW_MOD

Frame 50: 148 bytes on wire (1184 bits), 148 bytes captured (1184 bits) on interface any, id 0
Linux cooked capture
Internet Protocol Version 4, Src: 127.0.0.1, Dst: 127.0.0.1
Transmission Control Protocol, Src Port: 6653, Dst Port: 47236, Seq: 33, Ack: 129, Len: 80
OpenFlow 1.3

No.     Time           Source                Destination           Protocol Length Info
     51 0.382740362    127.0.0.1             127.0.0.1             OpenFlow 276    Type: OFPT_MULTIPART_REPLY, OFPMP_PORT_DESC

Frame 51: 276 bytes on wire (2208 bits), 276 bytes captured (2208 bits) on interface any, id 0
Linux cooked capture
Internet Protocol Version 4, Src: 127.0.0.1, Dst: 127.0.0.1
Transmission Control Protocol, Src Port: 47236, Dst Port: 6653, Seq: 129, Ack: 113, Len: 208
OpenFlow 1.3

No.     Time           Source                Destination           Protocol Length Info
     52 0.386588719    127.0.0.1             127.0.0.1             OpenFlow 132    Type: OFPT_FLOW_MOD

Frame 52: 132 bytes on wire (1056 bits), 132 bytes captured (1056 bits) on interface any, id 0
Linux cooked capture
Internet Protocol Version 4, Src: 127.0.0.1, Dst: 127.0.0.1
Transmission Control Protocol, Src Port: 6653, Dst Port: 47236, Seq: 113, Ack: 337, Len: 64
OpenFlow 1.3

No.     Time           Source                Destination           Protocol Length Info
     53 0.429822854    127.0.0.1             127.0.0.1             TCP      68     47236 → 6653 [ACK] Seq=337 Ack=177 Win=44032 Len=0 TSval=3195768138 TSecr=3195768095

Frame 53: 68 bytes on wire (544 bits), 68 bytes captured (544 bits) on interface any, id 0
Linux cooked capture
Internet Protocol Version 4, Src: 127.0.0.1, Dst: 127.0.0.1
Transmission Control Protocol, Src Port: 47236, Dst Port: 6653, Seq: 337, Ack: 177, Len: 0

No.     Time           Source                Destination           Protocol Length Info
     54 0.490175373    ::                    ff02::1:ff00:1        ICMPv6   88     Neighbor Solicitation for fe80::200:ff:fe00:1

Frame 54: 88 bytes on wire (704 bits), 88 bytes captured (704 bits) on interface any, id 0
Linux cooked capture
Internet Protocol Version 6, Src: ::, Dst: ff02::1:ff00:1
Internet Control Message Protocol v6

No.     Time           Source                Destination           Protocol Length Info
     55 0.490774704    127.0.0.1             127.0.0.1             OpenFlow 196    Type: OFPT_PACKET_IN

Frame 55: 196 bytes on wire (1568 bits), 196 bytes captured (1568 bits) on interface any, id 0
Linux cooked capture
Internet Protocol Version 4, Src: 127.0.0.1, Dst: 127.0.0.1
Transmission Control Protocol, Src Port: 47236, Dst Port: 6653, Seq: 337, Ack: 177, Len: 128
OpenFlow 1.3

No.     Time           Source                Destination           Protocol Length Info
     56 0.491877934    127.0.0.1             127.0.0.1             OpenFlow 194    Type: OFPT_PACKET_OUT

Frame 56: 194 bytes on wire (1552 bits), 194 bytes captured (1552 bits) on interface any, id 0
Linux cooked capture
Internet Protocol Version 4, Src: 127.0.0.1, Dst: 127.0.0.1
Transmission Control Protocol, Src Port: 6653, Dst Port: 47236, Seq: 177, Ack: 465, Len: 126
OpenFlow 1.3

No.     Time           Source                Destination           Protocol Length Info
     57 0.491891620    127.0.0.1             127.0.0.1             TCP      68     47236 → 6653 [ACK] Seq=465 Ack=303 Win=44032 Len=0 TSval=3195768200 TSecr=3195768200

Frame 57: 68 bytes on wire (544 bits), 68 bytes captured (544 bits) on interface any, id 0
Linux cooked capture
Internet Protocol Version 4, Src: 127.0.0.1, Dst: 127.0.0.1
Transmission Control Protocol, Src Port: 47236, Dst Port: 6653, Seq: 465, Ack: 303, Len: 0

No.     Time           Source                Destination           Protocol Length Info
     58 0.492202466    ::                    ff02::1:ff00:1        ICMPv6   88     Neighbor Solicitation for fe80::200:ff:fe00:1

Frame 58: 88 bytes on wire (704 bits), 88 bytes captured (704 bits) on interface any, id 0
Linux cooked capture
Internet Protocol Version 6, Src: ::, Dst: ff02::1:ff00:1
Internet Control Message Protocol v6

No.     Time           Source                Destination           Protocol Length Info
     59 0.534688470    ::                    ff02::16              ICMPv6   92     Multicast Listener Report Message v2

Frame 59: 92 bytes on wire (736 bits), 92 bytes captured (736 bits) on interface any, id 0
Linux cooked capture
Internet Protocol Version 6, Src: ::, Dst: ff02::16
Internet Control Message Protocol v6

No.     Time           Source                Destination           Protocol Length Info
     60 0.741991166    ::                    ff02::1:ff29:f6e1     ICMPv6   88     Neighbor Solicitation for fe80::e881:48ff:fe29:f6e1

Frame 60: 88 bytes on wire (704 bits), 88 bytes captured (704 bits) on interface any, id 0
Linux cooked capture
Internet Protocol Version 6, Src: ::, Dst: ff02::1:ff29:f6e1
Internet Control Message Protocol v6

No.     Time           Source                Destination           Protocol Length Info
     61 1.062050544    ::                    ff02::1:ff00:2        ICMPv6   88     Neighbor Solicitation for fe80::200:ff:fe00:2

Frame 61: 88 bytes on wire (704 bits), 88 bytes captured (704 bits) on interface any, id 0
Linux cooked capture
Internet Protocol Version 6, Src: ::, Dst: ff02::1:ff00:2
Internet Control Message Protocol v6

No.     Time           Source                Destination           Protocol Length Info
     62 1.070822666    127.0.0.1             127.0.0.1             OpenFlow 196    Type: OFPT_PACKET_IN

Frame 62: 196 bytes on wire (1568 bits), 196 bytes captured (1568 bits) on interface any, id 0
Linux cooked capture
Internet Protocol Version 4, Src: 127.0.0.1, Dst: 127.0.0.1
Transmission Control Protocol, Src Port: 47236, Dst Port: 6653, Seq: 465, Ack: 303, Len: 128
OpenFlow 1.3

No.     Time           Source                Destination           Protocol Length Info
     63 1.072671277    127.0.0.1             127.0.0.1             OpenFlow 194    Type: OFPT_PACKET_OUT

Frame 63: 194 bytes on wire (1552 bits), 194 bytes captured (1552 bits) on interface any, id 0
Linux cooked capture
Internet Protocol Version 4, Src: 127.0.0.1, Dst: 127.0.0.1
Transmission Control Protocol, Src Port: 6653, Dst Port: 47236, Seq: 303, Ack: 593, Len: 126
OpenFlow 1.3

No.     Time           Source                Destination           Protocol Length Info
     64 1.072693540    127.0.0.1             127.0.0.1             TCP      68     47236 → 6653 [ACK] Seq=593 Ack=429 Win=44032 Len=0 TSval=3195768781 TSecr=3195768781

Frame 64: 68 bytes on wire (544 bits), 68 bytes captured (544 bits) on interface any, id 0
Linux cooked capture
Internet Protocol Version 4, Src: 127.0.0.1, Dst: 127.0.0.1
Transmission Control Protocol, Src Port: 47236, Dst Port: 6653, Seq: 593, Ack: 429, Len: 0

No.     Time           Source                Destination           Protocol Length Info
     65 1.072857969    ::                    ff02::1:ff00:2        ICMPv6   88     Neighbor Solicitation for fe80::200:ff:fe00:2

Frame 65: 88 bytes on wire (704 bits), 88 bytes captured (704 bits) on interface any, id 0
Linux cooked capture
Internet Protocol Version 6, Src: ::, Dst: ff02::1:ff00:2
Internet Control Message Protocol v6

No.     Time           Source                Destination           Protocol Length Info
     66 1.222446701    ::                    ff02::16              ICMPv6   112    Multicast Listener Report Message v2

Frame 66: 112 bytes on wire (896 bits), 112 bytes captured (896 bits) on interface any, id 0
Linux cooked capture
Internet Protocol Version 6, Src: ::, Dst: ff02::16
Internet Control Message Protocol v6

No.     Time           Source                Destination           Protocol Length Info
     67 1.222815053    127.0.0.1             127.0.0.1             OpenFlow 220    Type: OFPT_PACKET_IN

Frame 67: 220 bytes on wire (1760 bits), 220 bytes captured (1760 bits) on interface any, id 0
Linux cooked capture
Internet Protocol Version 4, Src: 127.0.0.1, Dst: 127.0.0.1
Transmission Control Protocol, Src Port: 47236, Dst Port: 6653, Seq: 593, Ack: 429, Len: 152
OpenFlow 1.3

No.     Time           Source                Destination           Protocol Length Info
     68 1.224303525    127.0.0.1             127.0.0.1             OpenFlow 218    Type: OFPT_PACKET_OUT

Frame 68: 218 bytes on wire (1744 bits), 218 bytes captured (1744 bits) on interface any, id 0
Linux cooked capture
Internet Protocol Version 4, Src: 127.0.0.1, Dst: 127.0.0.1
Transmission Control Protocol, Src Port: 6653, Dst Port: 47236, Seq: 429, Ack: 745, Len: 150
OpenFlow 1.3

No.     Time           Source                Destination           Protocol Length Info
     69 1.224322310    127.0.0.1             127.0.0.1             TCP      68     47236 → 6653 [ACK] Seq=745 Ack=579 Win=44032 Len=0 TSval=3195768932 TSecr=3195768932

Frame 69: 68 bytes on wire (544 bits), 68 bytes captured (544 bits) on interface any, id 0
Linux cooked capture
Internet Protocol Version 4, Src: 127.0.0.1, Dst: 127.0.0.1
Transmission Control Protocol, Src Port: 47236, Dst Port: 6653, Seq: 745, Ack: 579, Len: 0

No.     Time           Source                Destination           Protocol Length Info
     70 1.224626206    ::                    ff02::16              ICMPv6   112    Multicast Listener Report Message v2

Frame 70: 112 bytes on wire (896 bits), 112 bytes captured (896 bits) on interface any, id 0
Linux cooked capture
Internet Protocol Version 6, Src: ::, Dst: ff02::16
Internet Control Message Protocol v6

No.     Time           Source                Destination           Protocol Length Info
     71 1.260394266    ::                    ff02::16              ICMPv6   112    Multicast Listener Report Message v2

Frame 71: 112 bytes on wire (896 bits), 112 bytes captured (896 bits) on interface any, id 0
Linux cooked capture
Internet Protocol Version 6, Src: ::, Dst: ff02::16
Internet Control Message Protocol v6

No.     Time           Source                Destination           Protocol Length Info
     72 1.260889465    127.0.0.1             127.0.0.1             OpenFlow 220    Type: OFPT_PACKET_IN

Frame 72: 220 bytes on wire (1760 bits), 220 bytes captured (1760 bits) on interface any, id 0
Linux cooked capture
Internet Protocol Version 4, Src: 127.0.0.1, Dst: 127.0.0.1
Transmission Control Protocol, Src Port: 47236, Dst Port: 6653, Seq: 745, Ack: 579, Len: 152
OpenFlow 1.3

No.     Time           Source                Destination           Protocol Length Info
     73 1.262663266    127.0.0.1             127.0.0.1             OpenFlow 218    Type: OFPT_PACKET_OUT

Frame 73: 218 bytes on wire (1744 bits), 218 bytes captured (1744 bits) on interface any, id 0
Linux cooked capture
Internet Protocol Version 4, Src: 127.0.0.1, Dst: 127.0.0.1
Transmission Control Protocol, Src Port: 6653, Dst Port: 47236, Seq: 579, Ack: 897, Len: 150
OpenFlow 1.3

No.     Time           Source                Destination           Protocol Length Info
     74 1.263098345    ::                    ff02::16              ICMPv6   112    Multicast Listener Report Message v2

Frame 74: 112 bytes on wire (896 bits), 112 bytes captured (896 bits) on interface any, id 0
Linux cooked capture
Internet Protocol Version 6, Src: ::, Dst: ff02::16
Internet Control Message Protocol v6

No.     Time           Source                Destination           Protocol Length Info
     75 1.309801475    127.0.0.1             127.0.0.1             TCP      68     47236 → 6653 [ACK] Seq=897 Ack=729 Win=44032 Len=0 TSval=3195769018 TSecr=3195768971

Frame 75: 68 bytes on wire (544 bits), 68 bytes captured (544 bits) on interface any, id 0
Linux cooked capture
Internet Protocol Version 4, Src: 127.0.0.1, Dst: 127.0.0.1
Transmission Control Protocol, Src Port: 47236, Dst Port: 6653, Seq: 897, Ack: 729, Len: 0

No.     Time           Source                Destination           Protocol Length Info
     76 1.351826874    fe80::70d6:9cff:fe01:dafa ff02::16              ICMPv6   92     Multicast Listener Report Message v2

Frame 76: 92 bytes on wire (736 bits), 92 bytes captured (736 bits) on interface any, id 0
Linux cooked capture
Internet Protocol Version 6, Src: fe80::70d6:9cff:fe01:dafa, Dst: ff02::16
Internet Control Message Protocol v6

No.     Time           Source                Destination           Protocol Length Info
     77 1.351860091    fe80::70d6:9cff:fe01:dafa ff02::2               ICMPv6   72     Router Solicitation from 72:d6:9c:01:da:fa

Frame 77: 72 bytes on wire (576 bits), 72 bytes captured (576 bits) on interface any, id 0
Linux cooked capture
Internet Protocol Version 6, Src: fe80::70d6:9cff:fe01:dafa, Dst: ff02::2
Internet Control Message Protocol v6

No.     Time           Source                Destination           Protocol Length Info
     78 1.353195115    127.0.0.1             127.0.0.53            DNS      89     Standard query 0xdda2 A daisy.ubuntu.com OPT

Frame 78: 89 bytes on wire (712 bits), 89 bytes captured (712 bits) on interface any, id 0
Linux cooked capture
Internet Protocol Version 4, Src: 127.0.0.1, Dst: 127.0.0.53
User Datagram Protocol, Src Port: 34193, Dst Port: 53
Domain Name System (query)

No.     Time           Source                Destination           Protocol Length Info
     79 1.353565049    127.0.0.1             127.0.0.53            DNS      89     Standard query 0xa2ad AAAA daisy.ubuntu.com OPT

Frame 79: 89 bytes on wire (712 bits), 89 bytes captured (712 bits) on interface any, id 0
Linux cooked capture
Internet Protocol Version 4, Src: 127.0.0.1, Dst: 127.0.0.53
User Datagram Protocol, Src Port: 34193, Dst Port: 53
Domain Name System (query)

No.     Time           Source                Destination           Protocol Length Info
     80 1.353867945    127.0.0.53            127.0.0.1             DNS      121    Standard query response 0xdda2 A daisy.ubuntu.com A 162.213.35.24 A 162.213.35.25 OPT

Frame 80: 121 bytes on wire (968 bits), 121 bytes captured (968 bits) on interface any, id 0
Linux cooked capture
Internet Protocol Version 4, Src: 127.0.0.53, Dst: 127.0.0.1
User Datagram Protocol, Src Port: 53, Dst Port: 34193
Domain Name System (response)

No.     Time           Source                Destination           Protocol Length Info
     81 1.354127491    10.0.2.15             10.101.1.10           DNS      89     Standard query 0x3fdb AAAA daisy.ubuntu.com OPT

Frame 81: 89 bytes on wire (712 bits), 89 bytes captured (712 bits) on interface any, id 0
Linux cooked capture
Internet Protocol Version 4, Src: 10.0.2.15, Dst: 10.101.1.10
User Datagram Protocol, Src Port: 39592, Dst Port: 53
Domain Name System (query)

No.     Time           Source                Destination           Protocol Length Info
     82 1.359837138    10.101.1.10           10.0.2.15             DNS      150    Standard query response 0x3fdb AAAA daisy.ubuntu.com SOA ns1.canonical.com OPT

Frame 82: 150 bytes on wire (1200 bits), 150 bytes captured (1200 bits) on interface any, id 0
Linux cooked capture
Internet Protocol Version 4, Src: 10.101.1.10, Dst: 10.0.2.15
User Datagram Protocol, Src Port: 53, Dst Port: 39592
Domain Name System (response)

No.     Time           Source                Destination           Protocol Length Info
     83 1.360144883    127.0.0.53            127.0.0.1             DNS      89     Standard query response 0xa2ad AAAA daisy.ubuntu.com OPT

Frame 83: 89 bytes on wire (712 bits), 89 bytes captured (712 bits) on interface any, id 0
Linux cooked capture
Internet Protocol Version 4, Src: 127.0.0.53, Dst: 127.0.0.1
User Datagram Protocol, Src Port: 53, Dst Port: 34193
Domain Name System (response)

No.     Time           Source                Destination           Protocol Length Info
     84 1.366873704    fe80::70d6:9cff:fe01:dafa ff02::16              ICMPv6   92     Multicast Listener Report Message v2

Frame 84: 92 bytes on wire (736 bits), 92 bytes captured (736 bits) on interface any, id 0
Linux cooked capture
Internet Protocol Version 6, Src: fe80::70d6:9cff:fe01:dafa, Dst: ff02::16
Internet Control Message Protocol v6

