No.     Time           Source                Destination           Protocol Length Info
      1 0.000000000    127.0.0.1             127.0.0.1             TCP      76     39208 → 6653 [SYN] Seq=0 Win=43690 Len=0 MSS=65495 SACK_PERM=1 TSval=3195877349 TSecr=0 WS=512

Frame 1: 76 bytes on wire (608 bits), 76 bytes captured (608 bits) on interface any, id 0
Linux cooked capture
Internet Protocol Version 4, Src: 127.0.0.1, Dst: 127.0.0.1
Transmission Control Protocol, Src Port: 39208, Dst Port: 6653, Seq: 0, Len: 0

No.     Time           Source                Destination           Protocol Length Info
      2 0.000036527    127.0.0.1             127.0.0.1             TCP      76     6653 → 39208 [SYN, ACK] Seq=0 Ack=1 Win=43690 Len=0 MSS=65495 SACK_PERM=1 TSval=3195877349 TSecr=3195877349 WS=512

Frame 2: 76 bytes on wire (608 bits), 76 bytes captured (608 bits) on interface any, id 0
Linux cooked capture
Internet Protocol Version 4, Src: 127.0.0.1, Dst: 127.0.0.1
Transmission Control Protocol, Src Port: 6653, Dst Port: 39208, Seq: 0, Ack: 1, Len: 0

No.     Time           Source                Destination           Protocol Length Info
      3 0.000055380    127.0.0.1             127.0.0.1             TCP      68     39208 → 6653 [ACK] Seq=1 Ack=1 Win=44032 Len=0 TSval=3195877349 TSecr=3195877349

Frame 3: 68 bytes on wire (544 bits), 68 bytes captured (544 bits) on interface any, id 0
Linux cooked capture
Internet Protocol Version 4, Src: 127.0.0.1, Dst: 127.0.0.1
Transmission Control Protocol, Src Port: 39208, Dst Port: 6653, Seq: 1, Ack: 1, Len: 0

No.     Time           Source                Destination           Protocol Length Info
      4 0.001415742    127.0.0.1             127.0.0.1             OpenFlow 76     Type: OFPT_HELLO

Frame 4: 76 bytes on wire (608 bits), 76 bytes captured (608 bits) on interface any, id 0
Linux cooked capture
Internet Protocol Version 4, Src: 127.0.0.1, Dst: 127.0.0.1
Transmission Control Protocol, Src Port: 6653, Dst Port: 39208, Seq: 1, Ack: 1, Len: 8
OpenFlow 1.3

No.     Time           Source                Destination           Protocol Length Info
      5 0.001474759    127.0.0.1             127.0.0.1             TCP      68     39208 → 6653 [ACK] Seq=1 Ack=9 Win=44032 Len=0 TSval=3195877351 TSecr=3195877351

Frame 5: 68 bytes on wire (544 bits), 68 bytes captured (544 bits) on interface any, id 0
Linux cooked capture
Internet Protocol Version 4, Src: 127.0.0.1, Dst: 127.0.0.1
Transmission Control Protocol, Src Port: 39208, Dst Port: 6653, Seq: 1, Ack: 9, Len: 0

No.     Time           Source                Destination           Protocol Length Info
      6 0.002113204    127.0.0.1             127.0.0.1             TCP      68     39208 → 6653 [FIN, ACK] Seq=1 Ack=9 Win=44032 Len=0 TSval=3195877351 TSecr=3195877351

Frame 6: 68 bytes on wire (544 bits), 68 bytes captured (544 bits) on interface any, id 0
Linux cooked capture
Internet Protocol Version 4, Src: 127.0.0.1, Dst: 127.0.0.1
Transmission Control Protocol, Src Port: 39208, Dst Port: 6653, Seq: 1, Ack: 9, Len: 0

No.     Time           Source                Destination           Protocol Length Info
      7 0.002214078    127.0.0.1             127.0.0.1             TCP      68     6653 → 39208 [FIN, ACK] Seq=9 Ack=2 Win=44032 Len=0 TSval=3195877352 TSecr=3195877351

Frame 7: 68 bytes on wire (544 bits), 68 bytes captured (544 bits) on interface any, id 0
Linux cooked capture
Internet Protocol Version 4, Src: 127.0.0.1, Dst: 127.0.0.1
Transmission Control Protocol, Src Port: 6653, Dst Port: 39208, Seq: 9, Ack: 2, Len: 0

No.     Time           Source                Destination           Protocol Length Info
      8 0.002218486    127.0.0.1             127.0.0.1             TCP      68     39208 → 6653 [ACK] Seq=2 Ack=10 Win=44032 Len=0 TSval=3195877352 TSecr=3195877352

Frame 8: 68 bytes on wire (544 bits), 68 bytes captured (544 bits) on interface any, id 0
Linux cooked capture
Internet Protocol Version 4, Src: 127.0.0.1, Dst: 127.0.0.1
Transmission Control Protocol, Src Port: 39208, Dst Port: 6653, Seq: 2, Ack: 10, Len: 0

No.     Time           Source                Destination           Protocol Length Info
      9 0.216449167    ::                    ff02::16              ICMPv6   92     Multicast Listener Report Message v2

Frame 9: 92 bytes on wire (736 bits), 92 bytes captured (736 bits) on interface any, id 0
Linux cooked capture
Internet Protocol Version 6, Src: ::, Dst: ff02::16
Internet Control Message Protocol v6

No.     Time           Source                Destination           Protocol Length Info
     10 0.216486620    ::                    ff02::16              ICMPv6   92     Multicast Listener Report Message v2

Frame 10: 92 bytes on wire (736 bits), 92 bytes captured (736 bits) on interface any, id 0
Linux cooked capture
Internet Protocol Version 6, Src: ::, Dst: ff02::16
Internet Control Message Protocol v6

No.     Time           Source                Destination           Protocol Length Info
     11 0.327097007    ::                    ff02::16              ICMPv6   92     Multicast Listener Report Message v2

Frame 11: 92 bytes on wire (736 bits), 92 bytes captured (736 bits) on interface any, id 0
Linux cooked capture
Internet Protocol Version 6, Src: ::, Dst: ff02::16
Internet Control Message Protocol v6

No.     Time           Source                Destination           Protocol Length Info
     12 0.327389545    ::                    ff02::16              ICMPv6   92     Multicast Listener Report Message v2

Frame 12: 92 bytes on wire (736 bits), 92 bytes captured (736 bits) on interface any, id 0
Linux cooked capture
Internet Protocol Version 6, Src: ::, Dst: ff02::16
Internet Control Message Protocol v6

No.     Time           Source                Destination           Protocol Length Info
     13 0.327465156    ::                    ff02::16              ICMPv6   92     Multicast Listener Report Message v2

Frame 13: 92 bytes on wire (736 bits), 92 bytes captured (736 bits) on interface any, id 0
Linux cooked capture
Internet Protocol Version 6, Src: ::, Dst: ff02::16
Internet Control Message Protocol v6

No.     Time           Source                Destination           Protocol Length Info
     14 0.412515164    ::                    ff02::16              ICMPv6   92     Multicast Listener Report Message v2

Frame 14: 92 bytes on wire (736 bits), 92 bytes captured (736 bits) on interface any, id 0
Linux cooked capture
Internet Protocol Version 6, Src: ::, Dst: ff02::16
Internet Control Message Protocol v6

No.     Time           Source                Destination           Protocol Length Info
     15 0.412537811    ::                    ff02::16              ICMPv6   112    Multicast Listener Report Message v2

Frame 15: 112 bytes on wire (896 bits), 112 bytes captured (896 bits) on interface any, id 0
Linux cooked capture
Internet Protocol Version 6, Src: ::, Dst: ff02::16
Internet Control Message Protocol v6

No.     Time           Source                Destination           Protocol Length Info
     16 0.504883188    127.0.0.1             127.0.0.1             TCP      76     41092 → 5037 [SYN] Seq=0 Win=43690 Len=0 MSS=65495 SACK_PERM=1 TSval=3195877854 TSecr=0 WS=512

Frame 16: 76 bytes on wire (608 bits), 76 bytes captured (608 bits) on interface any, id 0
Linux cooked capture
Internet Protocol Version 4, Src: 127.0.0.1, Dst: 127.0.0.1
Transmission Control Protocol, Src Port: 41092, Dst Port: 5037, Seq: 0, Len: 0

No.     Time           Source                Destination           Protocol Length Info
     17 0.504920813    127.0.0.1             127.0.0.1             TCP      56     5037 → 41092 [RST, ACK] Seq=1 Ack=1 Win=0 Len=0

Frame 17: 56 bytes on wire (448 bits), 56 bytes captured (448 bits) on interface any, id 0
Linux cooked capture
Internet Protocol Version 4, Src: 127.0.0.1, Dst: 127.0.0.1
Transmission Control Protocol, Src Port: 5037, Dst Port: 41092, Seq: 1, Ack: 1, Len: 0

No.     Time           Source                Destination           Protocol Length Info
     18 0.506708176    127.0.0.1             127.0.0.1             TCP      76     41108 → 5037 [SYN] Seq=0 Win=43690 Len=0 MSS=65495 SACK_PERM=1 TSval=3195877856 TSecr=0 WS=512

Frame 18: 76 bytes on wire (608 bits), 76 bytes captured (608 bits) on interface any, id 0
Linux cooked capture
Internet Protocol Version 4, Src: 127.0.0.1, Dst: 127.0.0.1
Transmission Control Protocol, Src Port: 41108, Dst Port: 5037, Seq: 0, Len: 0

No.     Time           Source                Destination           Protocol Length Info
     19 0.506734241    127.0.0.1             127.0.0.1             TCP      56     5037 → 41108 [RST, ACK] Seq=1 Ack=1 Win=0 Len=0

Frame 19: 56 bytes on wire (448 bits), 56 bytes captured (448 bits) on interface any, id 0
Linux cooked capture
Internet Protocol Version 4, Src: 127.0.0.1, Dst: 127.0.0.1
Transmission Control Protocol, Src Port: 5037, Dst Port: 41108, Seq: 1, Ack: 1, Len: 0

No.     Time           Source                Destination           Protocol Length Info
     20 0.509267530    127.0.0.1             127.0.0.1             TCP      76     41112 → 5037 [SYN] Seq=0 Win=43690 Len=0 MSS=65495 SACK_PERM=1 TSval=3195877858 TSecr=0 WS=512

Frame 20: 76 bytes on wire (608 bits), 76 bytes captured (608 bits) on interface any, id 0
Linux cooked capture
Internet Protocol Version 4, Src: 127.0.0.1, Dst: 127.0.0.1
Transmission Control Protocol, Src Port: 41112, Dst Port: 5037, Seq: 0, Len: 0

No.     Time           Source                Destination           Protocol Length Info
     21 0.509314338    127.0.0.1             127.0.0.1             TCP      56     5037 → 41112 [RST, ACK] Seq=1 Ack=1 Win=0 Len=0

Frame 21: 56 bytes on wire (448 bits), 56 bytes captured (448 bits) on interface any, id 0
Linux cooked capture
Internet Protocol Version 4, Src: 127.0.0.1, Dst: 127.0.0.1
Transmission Control Protocol, Src Port: 5037, Dst Port: 41112, Seq: 1, Ack: 1, Len: 0

No.     Time           Source                Destination           Protocol Length Info
     22 0.515007471    127.0.0.1             127.0.0.1             TCP      76     41120 → 5037 [SYN] Seq=0 Win=43690 Len=0 MSS=65495 SACK_PERM=1 TSval=3195877864 TSecr=0 WS=512

Frame 22: 76 bytes on wire (608 bits), 76 bytes captured (608 bits) on interface any, id 0
Linux cooked capture
Internet Protocol Version 4, Src: 127.0.0.1, Dst: 127.0.0.1
Transmission Control Protocol, Src Port: 41120, Dst Port: 5037, Seq: 0, Len: 0

No.     Time           Source                Destination           Protocol Length Info
     23 0.515049037    127.0.0.1             127.0.0.1             TCP      56     5037 → 41120 [RST, ACK] Seq=1 Ack=1 Win=0 Len=0

Frame 23: 56 bytes on wire (448 bits), 56 bytes captured (448 bits) on interface any, id 0
Linux cooked capture
Internet Protocol Version 4, Src: 127.0.0.1, Dst: 127.0.0.1
Transmission Control Protocol, Src Port: 5037, Dst Port: 41120, Seq: 1, Ack: 1, Len: 0

No.     Time           Source                Destination           Protocol Length Info
     24 0.521972765    ::                    ff02::16              ICMPv6   92     Multicast Listener Report Message v2

Frame 24: 92 bytes on wire (736 bits), 92 bytes captured (736 bits) on interface any, id 0
Linux cooked capture
Internet Protocol Version 6, Src: ::, Dst: ff02::16
Internet Control Message Protocol v6

No.     Time           Source                Destination           Protocol Length Info
     25 0.521999718    ::                    ff02::16              ICMPv6   112    Multicast Listener Report Message v2

Frame 25: 112 bytes on wire (896 bits), 112 bytes captured (896 bits) on interface any, id 0
Linux cooked capture
Internet Protocol Version 6, Src: ::, Dst: ff02::16
Internet Control Message Protocol v6

No.     Time           Source                Destination           Protocol Length Info
     26 0.522074303    127.0.0.1             127.0.0.1             TCP      76     41130 → 5037 [SYN] Seq=0 Win=43690 Len=0 MSS=65495 SACK_PERM=1 TSval=3195877871 TSecr=0 WS=512

Frame 26: 76 bytes on wire (608 bits), 76 bytes captured (608 bits) on interface any, id 0
Linux cooked capture
Internet Protocol Version 4, Src: 127.0.0.1, Dst: 127.0.0.1
Transmission Control Protocol, Src Port: 41130, Dst Port: 5037, Seq: 0, Len: 0

No.     Time           Source                Destination           Protocol Length Info
     27 0.522098804    127.0.0.1             127.0.0.1             TCP      56     5037 → 41130 [RST, ACK] Seq=1 Ack=1 Win=0 Len=0

Frame 27: 56 bytes on wire (448 bits), 56 bytes captured (448 bits) on interface any, id 0
Linux cooked capture
Internet Protocol Version 4, Src: 127.0.0.1, Dst: 127.0.0.1
Transmission Control Protocol, Src Port: 5037, Dst Port: 41130, Seq: 1, Ack: 1, Len: 0

No.     Time           Source                Destination           Protocol Length Info
     28 0.525533054    127.0.0.1             127.0.0.1             TCP      76     41144 → 5037 [SYN] Seq=0 Win=43690 Len=0 MSS=65495 SACK_PERM=1 TSval=3195877875 TSecr=0 WS=512

Frame 28: 76 bytes on wire (608 bits), 76 bytes captured (608 bits) on interface any, id 0
Linux cooked capture
Internet Protocol Version 4, Src: 127.0.0.1, Dst: 127.0.0.1
Transmission Control Protocol, Src Port: 41144, Dst Port: 5037, Seq: 0, Len: 0

No.     Time           Source                Destination           Protocol Length Info
     29 0.525605841    127.0.0.1             127.0.0.1             TCP      56     5037 → 41144 [RST, ACK] Seq=1 Ack=1 Win=0 Len=0

Frame 29: 56 bytes on wire (448 bits), 56 bytes captured (448 bits) on interface any, id 0
Linux cooked capture
Internet Protocol Version 4, Src: 127.0.0.1, Dst: 127.0.0.1
Transmission Control Protocol, Src Port: 5037, Dst Port: 41144, Seq: 1, Ack: 1, Len: 0

No.     Time           Source                Destination           Protocol Length Info
     30 0.527277319    127.0.0.1             127.0.0.1             TCP      76     41150 → 5037 [SYN] Seq=0 Win=43690 Len=0 MSS=65495 SACK_PERM=1 TSval=3195877877 TSecr=0 WS=512

Frame 30: 76 bytes on wire (608 bits), 76 bytes captured (608 bits) on interface any, id 0
Linux cooked capture
Internet Protocol Version 4, Src: 127.0.0.1, Dst: 127.0.0.1
Transmission Control Protocol, Src Port: 41150, Dst Port: 5037, Seq: 0, Len: 0

No.     Time           Source                Destination           Protocol Length Info
     31 0.527308580    127.0.0.1             127.0.0.1             TCP      56     5037 → 41150 [RST, ACK] Seq=1 Ack=1 Win=0 Len=0

Frame 31: 56 bytes on wire (448 bits), 56 bytes captured (448 bits) on interface any, id 0
Linux cooked capture
Internet Protocol Version 4, Src: 127.0.0.1, Dst: 127.0.0.1
Transmission Control Protocol, Src Port: 5037, Dst Port: 41150, Seq: 1, Ack: 1, Len: 0

No.     Time           Source                Destination           Protocol Length Info
     32 0.529918220    127.0.0.1             127.0.0.1             TCP      76     41154 → 5037 [SYN] Seq=0 Win=43690 Len=0 MSS=65495 SACK_PERM=1 TSval=3195877879 TSecr=0 WS=512

Frame 32: 76 bytes on wire (608 bits), 76 bytes captured (608 bits) on interface any, id 0
Linux cooked capture
Internet Protocol Version 4, Src: 127.0.0.1, Dst: 127.0.0.1
Transmission Control Protocol, Src Port: 41154, Dst Port: 5037, Seq: 0, Len: 0

No.     Time           Source                Destination           Protocol Length Info
     33 0.529941199    127.0.0.1             127.0.0.1             TCP      56     5037 → 41154 [RST, ACK] Seq=1 Ack=1 Win=0 Len=0

Frame 33: 56 bytes on wire (448 bits), 56 bytes captured (448 bits) on interface any, id 0
Linux cooked capture
Internet Protocol Version 4, Src: 127.0.0.1, Dst: 127.0.0.1
Transmission Control Protocol, Src Port: 5037, Dst Port: 41154, Seq: 1, Ack: 1, Len: 0

No.     Time           Source                Destination           Protocol Length Info
     34 0.534636848    127.0.0.1             127.0.0.1             TCP      76     41164 → 5037 [SYN] Seq=0 Win=43690 Len=0 MSS=65495 SACK_PERM=1 TSval=3195877884 TSecr=0 WS=512

Frame 34: 76 bytes on wire (608 bits), 76 bytes captured (608 bits) on interface any, id 0
Linux cooked capture
Internet Protocol Version 4, Src: 127.0.0.1, Dst: 127.0.0.1
Transmission Control Protocol, Src Port: 41164, Dst Port: 5037, Seq: 0, Len: 0

No.     Time           Source                Destination           Protocol Length Info
     35 0.534844569    127.0.0.1             127.0.0.1             TCP      56     5037 → 41164 [RST, ACK] Seq=1 Ack=1 Win=0 Len=0

Frame 35: 56 bytes on wire (448 bits), 56 bytes captured (448 bits) on interface any, id 0
Linux cooked capture
Internet Protocol Version 4, Src: 127.0.0.1, Dst: 127.0.0.1
Transmission Control Protocol, Src Port: 5037, Dst Port: 41164, Seq: 1, Ack: 1, Len: 0

No.     Time           Source                Destination           Protocol Length Info
     36 0.537984448    127.0.0.1             127.0.0.1             TCP      76     41174 → 5037 [SYN] Seq=0 Win=43690 Len=0 MSS=65495 SACK_PERM=1 TSval=3195877887 TSecr=0 WS=512

Frame 36: 76 bytes on wire (608 bits), 76 bytes captured (608 bits) on interface any, id 0
Linux cooked capture
Internet Protocol Version 4, Src: 127.0.0.1, Dst: 127.0.0.1
Transmission Control Protocol, Src Port: 41174, Dst Port: 5037, Seq: 0, Len: 0

No.     Time           Source                Destination           Protocol Length Info
     37 0.538024152    127.0.0.1             127.0.0.1             TCP      56     5037 → 41174 [RST, ACK] Seq=1 Ack=1 Win=0 Len=0

Frame 37: 56 bytes on wire (448 bits), 56 bytes captured (448 bits) on interface any, id 0
Linux cooked capture
Internet Protocol Version 4, Src: 127.0.0.1, Dst: 127.0.0.1
Transmission Control Protocol, Src Port: 5037, Dst Port: 41174, Seq: 1, Ack: 1, Len: 0

No.     Time           Source                Destination           Protocol Length Info
     38 0.593038573    ::                    ff02::16              ICMPv6   112    Multicast Listener Report Message v2

Frame 38: 112 bytes on wire (896 bits), 112 bytes captured (896 bits) on interface any, id 0
Linux cooked capture
Internet Protocol Version 6, Src: ::, Dst: ff02::16
Internet Control Message Protocol v6

No.     Time           Source                Destination           Protocol Length Info
     39 0.619154306    127.0.0.1             127.0.0.1             TCP      76     39218 → 6653 [SYN] Seq=0 Win=43690 Len=0 MSS=65495 SACK_PERM=1 TSval=3195877968 TSecr=0 WS=512

Frame 39: 76 bytes on wire (608 bits), 76 bytes captured (608 bits) on interface any, id 0
Linux cooked capture
Internet Protocol Version 4, Src: 127.0.0.1, Dst: 127.0.0.1
Transmission Control Protocol, Src Port: 39218, Dst Port: 6653, Seq: 0, Len: 0

No.     Time           Source                Destination           Protocol Length Info
     40 0.619182718    127.0.0.1             127.0.0.1             TCP      76     6653 → 39218 [SYN, ACK] Seq=0 Ack=1 Win=43690 Len=0 MSS=65495 SACK_PERM=1 TSval=3195877969 TSecr=3195877968 WS=512

Frame 40: 76 bytes on wire (608 bits), 76 bytes captured (608 bits) on interface any, id 0
Linux cooked capture
Internet Protocol Version 4, Src: 127.0.0.1, Dst: 127.0.0.1
Transmission Control Protocol, Src Port: 6653, Dst Port: 39218, Seq: 0, Ack: 1, Len: 0

No.     Time           Source                Destination           Protocol Length Info
     41 0.619199419    127.0.0.1             127.0.0.1             TCP      68     39218 → 6653 [ACK] Seq=1 Ack=1 Win=44032 Len=0 TSval=3195877969 TSecr=3195877969

Frame 41: 68 bytes on wire (544 bits), 68 bytes captured (544 bits) on interface any, id 0
Linux cooked capture
Internet Protocol Version 4, Src: 127.0.0.1, Dst: 127.0.0.1
Transmission Control Protocol, Src Port: 39218, Dst Port: 6653, Seq: 1, Ack: 1, Len: 0

No.     Time           Source                Destination           Protocol Length Info
     42 0.624185819    127.0.0.1             127.0.0.1             OpenFlow 76     Type: OFPT_HELLO

Frame 42: 76 bytes on wire (608 bits), 76 bytes captured (608 bits) on interface any, id 0
Linux cooked capture
Internet Protocol Version 4, Src: 127.0.0.1, Dst: 127.0.0.1
Transmission Control Protocol, Src Port: 6653, Dst Port: 39218, Seq: 1, Ack: 1, Len: 8
OpenFlow 1.3

No.     Time           Source                Destination           Protocol Length Info
     43 0.624211581    127.0.0.1             127.0.0.1             TCP      68     39218 → 6653 [ACK] Seq=1 Ack=9 Win=44032 Len=0 TSval=3195877974 TSecr=3195877973

Frame 43: 68 bytes on wire (544 bits), 68 bytes captured (544 bits) on interface any, id 0
Linux cooked capture
Internet Protocol Version 4, Src: 127.0.0.1, Dst: 127.0.0.1
Transmission Control Protocol, Src Port: 39218, Dst Port: 6653, Seq: 1, Ack: 9, Len: 0

No.     Time           Source                Destination           Protocol Length Info
     44 0.633844247    127.0.0.1             127.0.0.1             OpenFlow 84     Type: OFPT_HELLO

Frame 44: 84 bytes on wire (672 bits), 84 bytes captured (672 bits) on interface any, id 0
Linux cooked capture
Internet Protocol Version 4, Src: 127.0.0.1, Dst: 127.0.0.1
Transmission Control Protocol, Src Port: 39218, Dst Port: 6653, Seq: 1, Ack: 9, Len: 16
OpenFlow 1.3

No.     Time           Source                Destination           Protocol Length Info
     45 0.633875376    127.0.0.1             127.0.0.1             TCP      68     6653 → 39218 [ACK] Seq=9 Ack=17 Win=44032 Len=0 TSval=3195877983 TSecr=3195877983

Frame 45: 68 bytes on wire (544 bits), 68 bytes captured (544 bits) on interface any, id 0
Linux cooked capture
Internet Protocol Version 4, Src: 127.0.0.1, Dst: 127.0.0.1
Transmission Control Protocol, Src Port: 6653, Dst Port: 39218, Seq: 9, Ack: 17, Len: 0

No.     Time           Source                Destination           Protocol Length Info
     46 0.635122585    127.0.0.1             127.0.0.1             OpenFlow 76     Type: OFPT_FEATURES_REQUEST

Frame 46: 76 bytes on wire (608 bits), 76 bytes captured (608 bits) on interface any, id 0
Linux cooked capture
Internet Protocol Version 4, Src: 127.0.0.1, Dst: 127.0.0.1
Transmission Control Protocol, Src Port: 6653, Dst Port: 39218, Seq: 9, Ack: 17, Len: 8
OpenFlow 1.3

No.     Time           Source                Destination           Protocol Length Info
     47 0.654173242    127.0.0.1             127.0.0.1             OpenFlow 148    Type: OFPT_PORT_STATUS

Frame 47: 148 bytes on wire (1184 bits), 148 bytes captured (1184 bits) on interface any, id 0
Linux cooked capture
Internet Protocol Version 4, Src: 127.0.0.1, Dst: 127.0.0.1
Transmission Control Protocol, Src Port: 39218, Dst Port: 6653, Seq: 17, Ack: 17, Len: 80
OpenFlow 1.3

No.     Time           Source                Destination           Protocol Length Info
     48 0.654578929    127.0.0.1             127.0.0.1             OpenFlow 100    Type: OFPT_FEATURES_REPLY

Frame 48: 100 bytes on wire (800 bits), 100 bytes captured (800 bits) on interface any, id 0
Linux cooked capture
Internet Protocol Version 4, Src: 127.0.0.1, Dst: 127.0.0.1
Transmission Control Protocol, Src Port: 39218, Dst Port: 6653, Seq: 97, Ack: 17, Len: 32
OpenFlow 1.3

No.     Time           Source                Destination           Protocol Length Info
     49 0.657776283    127.0.0.1             127.0.0.1             TCP      68     6653 → 39218 [ACK] Seq=17 Ack=129 Win=44032 Len=0 TSval=3195878007 TSecr=3195878003

Frame 49: 68 bytes on wire (544 bits), 68 bytes captured (544 bits) on interface any, id 0
Linux cooked capture
Internet Protocol Version 4, Src: 127.0.0.1, Dst: 127.0.0.1
Transmission Control Protocol, Src Port: 6653, Dst Port: 39218, Seq: 17, Ack: 129, Len: 0

No.     Time           Source                Destination           Protocol Length Info
     50 0.660140412    127.0.0.1             127.0.0.1             OpenFlow 84     Type: OFPT_MULTIPART_REQUEST, OFPMP_PORT_DESC

Frame 50: 84 bytes on wire (672 bits), 84 bytes captured (672 bits) on interface any, id 0
Linux cooked capture
Internet Protocol Version 4, Src: 127.0.0.1, Dst: 127.0.0.1
Transmission Control Protocol, Src Port: 6653, Dst Port: 39218, Seq: 17, Ack: 129, Len: 16
OpenFlow 1.3

No.     Time           Source                Destination           Protocol Length Info
     51 0.660176315    127.0.0.1             127.0.0.1             OpenFlow 148    Type: OFPT_FLOW_MOD

Frame 51: 148 bytes on wire (1184 bits), 148 bytes captured (1184 bits) on interface any, id 0
Linux cooked capture
Internet Protocol Version 4, Src: 127.0.0.1, Dst: 127.0.0.1
Transmission Control Protocol, Src Port: 6653, Dst Port: 39218, Seq: 33, Ack: 129, Len: 80
OpenFlow 1.3

No.     Time           Source                Destination           Protocol Length Info
     52 0.664485517    127.0.0.1             127.0.0.1             OpenFlow 276    Type: OFPT_MULTIPART_REPLY, OFPMP_PORT_DESC

Frame 52: 276 bytes on wire (2208 bits), 276 bytes captured (2208 bits) on interface any, id 0
Linux cooked capture
Internet Protocol Version 4, Src: 127.0.0.1, Dst: 127.0.0.1
Transmission Control Protocol, Src Port: 39218, Dst Port: 6653, Seq: 129, Ack: 113, Len: 208
OpenFlow 1.3

No.     Time           Source                Destination           Protocol Length Info
     53 0.666635930    127.0.0.1             127.0.0.1             OpenFlow 132    Type: OFPT_FLOW_MOD

Frame 53: 132 bytes on wire (1056 bits), 132 bytes captured (1056 bits) on interface any, id 0
Linux cooked capture
Internet Protocol Version 4, Src: 127.0.0.1, Dst: 127.0.0.1
Transmission Control Protocol, Src Port: 6653, Dst Port: 39218, Seq: 113, Ack: 337, Len: 64
OpenFlow 1.3

No.     Time           Source                Destination           Protocol Length Info
     54 0.717243422    127.0.0.1             127.0.0.1             TCP      68     39218 → 6653 [ACK] Seq=337 Ack=177 Win=44032 Len=0 TSval=3195878067 TSecr=3195878016

Frame 54: 68 bytes on wire (544 bits), 68 bytes captured (544 bits) on interface any, id 0
Linux cooked capture
Internet Protocol Version 4, Src: 127.0.0.1, Dst: 127.0.0.1
Transmission Control Protocol, Src Port: 39218, Dst Port: 6653, Seq: 337, Ack: 177, Len: 0

No.     Time           Source                Destination           Protocol Length Info
     55 0.861056323    ::                    ff02::1:ff5f:5c3a     ICMPv6   88     Neighbor Solicitation for fe80::6cf2:83ff:fe5f:5c3a

Frame 55: 88 bytes on wire (704 bits), 88 bytes captured (704 bits) on interface any, id 0
Linux cooked capture
Internet Protocol Version 6, Src: ::, Dst: ff02::1:ff5f:5c3a
Internet Control Message Protocol v6

No.     Time           Source                Destination           Protocol Length Info
     56 0.861131498    ::                    ff02::16              ICMPv6   112    Multicast Listener Report Message v2

Frame 56: 112 bytes on wire (896 bits), 112 bytes captured (896 bits) on interface any, id 0
Linux cooked capture
Internet Protocol Version 6, Src: ::, Dst: ff02::16
Internet Control Message Protocol v6

No.     Time           Source                Destination           Protocol Length Info
     57 0.861594806    127.0.0.1             127.0.0.1             OpenFlow 220    Type: OFPT_PACKET_IN

Frame 57: 220 bytes on wire (1760 bits), 220 bytes captured (1760 bits) on interface any, id 0
Linux cooked capture
Internet Protocol Version 4, Src: 127.0.0.1, Dst: 127.0.0.1
Transmission Control Protocol, Src Port: 39218, Dst Port: 6653, Seq: 337, Ack: 177, Len: 152
OpenFlow 1.3

No.     Time           Source                Destination           Protocol Length Info
     58 0.862547529    127.0.0.1             127.0.0.1             OpenFlow 218    Type: OFPT_PACKET_OUT

Frame 58: 218 bytes on wire (1744 bits), 218 bytes captured (1744 bits) on interface any, id 0
Linux cooked capture
Internet Protocol Version 4, Src: 127.0.0.1, Dst: 127.0.0.1
Transmission Control Protocol, Src Port: 6653, Dst Port: 39218, Seq: 177, Ack: 489, Len: 150
OpenFlow 1.3

No.     Time           Source                Destination           Protocol Length Info
     59 0.862559747    127.0.0.1             127.0.0.1             TCP      68     39218 → 6653 [ACK] Seq=489 Ack=327 Win=44032 Len=0 TSval=3195878212 TSecr=3195878212

Frame 59: 68 bytes on wire (544 bits), 68 bytes captured (544 bits) on interface any, id 0
Linux cooked capture
Internet Protocol Version 4, Src: 127.0.0.1, Dst: 127.0.0.1
Transmission Control Protocol, Src Port: 39218, Dst Port: 6653, Seq: 489, Ack: 327, Len: 0

No.     Time           Source                Destination           Protocol Length Info
     60 0.862658782    ::                    ff02::16              ICMPv6   112    Multicast Listener Report Message v2

Frame 60: 112 bytes on wire (896 bits), 112 bytes captured (896 bits) on interface any, id 0
Linux cooked capture
Internet Protocol Version 6, Src: ::, Dst: ff02::16
Internet Control Message Protocol v6

No.     Time           Source                Destination           Protocol Length Info
     61 0.924746881    ::                    ff02::1:ff7b:b202     ICMPv6   88     Neighbor Solicitation for fe80::c055:feff:fe7b:b202

Frame 61: 88 bytes on wire (704 bits), 88 bytes captured (704 bits) on interface any, id 0
Linux cooked capture
Internet Protocol Version 6, Src: ::, Dst: ff02::1:ff7b:b202
Internet Control Message Protocol v6

No.     Time           Source                Destination           Protocol Length Info
     62 0.992312491    ::                    ff02::1:ff00:2        ICMPv6   88     Neighbor Solicitation for fe80::200:ff:fe00:2

Frame 62: 88 bytes on wire (704 bits), 88 bytes captured (704 bits) on interface any, id 0
Linux cooked capture
Internet Protocol Version 6, Src: ::, Dst: ff02::1:ff00:2
Internet Control Message Protocol v6

No.     Time           Source                Destination           Protocol Length Info
     63 0.993319836    127.0.0.1             127.0.0.1             OpenFlow 196    Type: OFPT_PACKET_IN

Frame 63: 196 bytes on wire (1568 bits), 196 bytes captured (1568 bits) on interface any, id 0
Linux cooked capture
Internet Protocol Version 4, Src: 127.0.0.1, Dst: 127.0.0.1
Transmission Control Protocol, Src Port: 39218, Dst Port: 6653, Seq: 489, Ack: 327, Len: 128
OpenFlow 1.3

No.     Time           Source                Destination           Protocol Length Info
     64 0.994354879    127.0.0.1             127.0.0.1             OpenFlow 194    Type: OFPT_PACKET_OUT

Frame 64: 194 bytes on wire (1552 bits), 194 bytes captured (1552 bits) on interface any, id 0
Linux cooked capture
Internet Protocol Version 4, Src: 127.0.0.1, Dst: 127.0.0.1
Transmission Control Protocol, Src Port: 6653, Dst Port: 39218, Seq: 327, Ack: 617, Len: 126
OpenFlow 1.3

No.     Time           Source                Destination           Protocol Length Info
     65 0.994369637    127.0.0.1             127.0.0.1             TCP      68     39218 → 6653 [ACK] Seq=617 Ack=453 Win=44032 Len=0 TSval=3195878344 TSecr=3195878344

Frame 65: 68 bytes on wire (544 bits), 68 bytes captured (544 bits) on interface any, id 0
Linux cooked capture
Internet Protocol Version 4, Src: 127.0.0.1, Dst: 127.0.0.1
Transmission Control Protocol, Src Port: 39218, Dst Port: 6653, Seq: 617, Ack: 453, Len: 0

No.     Time           Source                Destination           Protocol Length Info
     66 0.994503436    ::                    ff02::1:ff00:2        ICMPv6   88     Neighbor Solicitation for fe80::200:ff:fe00:2

Frame 66: 88 bytes on wire (704 bits), 88 bytes captured (704 bits) on interface any, id 0
Linux cooked capture
Internet Protocol Version 6, Src: ::, Dst: ff02::1:ff00:2
Internet Control Message Protocol v6

No.     Time           Source                Destination           Protocol Length Info
     67 1.021087873    ::                    ff02::16              ICMPv6   92     Multicast Listener Report Message v2

Frame 67: 92 bytes on wire (736 bits), 92 bytes captured (736 bits) on interface any, id 0
Linux cooked capture
Internet Protocol Version 6, Src: ::, Dst: ff02::16
Internet Control Message Protocol v6

No.     Time           Source                Destination           Protocol Length Info
     68 1.079617984    127.0.0.1             127.0.0.53            DNS      89     Standard query 0x70b0 A daisy.ubuntu.com OPT

Frame 68: 89 bytes on wire (712 bits), 89 bytes captured (712 bits) on interface any, id 0
Linux cooked capture
Internet Protocol Version 4, Src: 127.0.0.1, Dst: 127.0.0.53
User Datagram Protocol, Src Port: 52265, Dst Port: 53
Domain Name System (query)

No.     Time           Source                Destination           Protocol Length Info
     69 1.079752071    127.0.0.1             127.0.0.53            DNS      89     Standard query 0xafbe AAAA daisy.ubuntu.com OPT

Frame 69: 89 bytes on wire (712 bits), 89 bytes captured (712 bits) on interface any, id 0
Linux cooked capture
Internet Protocol Version 4, Src: 127.0.0.1, Dst: 127.0.0.53
User Datagram Protocol, Src Port: 52265, Dst Port: 53
Domain Name System (query)

No.     Time           Source                Destination           Protocol Length Info
     70 1.080364197    10.0.2.15             10.101.1.10           DNS      89     Standard query 0x0e3a A daisy.ubuntu.com OPT

Frame 70: 89 bytes on wire (712 bits), 89 bytes captured (712 bits) on interface any, id 0
Linux cooked capture
Internet Protocol Version 4, Src: 10.0.2.15, Dst: 10.101.1.10
User Datagram Protocol, Src Port: 38571, Dst Port: 53
Domain Name System (query)

No.     Time           Source                Destination           Protocol Length Info
     71 1.081505497    10.0.2.15             10.101.1.10           DNS      89     Standard query 0xcf8a AAAA daisy.ubuntu.com OPT

Frame 71: 89 bytes on wire (712 bits), 89 bytes captured (712 bits) on interface any, id 0
Linux cooked capture
Internet Protocol Version 4, Src: 10.0.2.15, Dst: 10.101.1.10
User Datagram Protocol, Src Port: 51965, Dst Port: 53
Domain Name System (query)

No.     Time           Source                Destination           Protocol Length Info
     72 1.085108816    10.101.1.10           10.0.2.15             DNS      150    Standard query response 0xcf8a AAAA daisy.ubuntu.com SOA ns1.canonical.com OPT

Frame 72: 150 bytes on wire (1200 bits), 150 bytes captured (1200 bits) on interface any, id 0
Linux cooked capture
Internet Protocol Version 4, Src: 10.101.1.10, Dst: 10.0.2.15
User Datagram Protocol, Src Port: 53, Dst Port: 51965
Domain Name System (response)

No.     Time           Source                Destination           Protocol Length Info
     73 1.085424729    127.0.0.53            127.0.0.1             DNS      89     Standard query response 0xafbe AAAA daisy.ubuntu.com OPT

Frame 73: 89 bytes on wire (712 bits), 89 bytes captured (712 bits) on interface any, id 0
Linux cooked capture
Internet Protocol Version 4, Src: 127.0.0.53, Dst: 127.0.0.1
User Datagram Protocol, Src Port: 53, Dst Port: 52265
Domain Name System (response)

No.     Time           Source                Destination           Protocol Length Info
     74 1.089969949    10.101.1.10           10.0.2.15             DNS      121    Standard query response 0x0e3a A daisy.ubuntu.com A 162.213.35.24 A 162.213.35.25 OPT

Frame 74: 121 bytes on wire (968 bits), 121 bytes captured (968 bits) on interface any, id 0
Linux cooked capture
Internet Protocol Version 4, Src: 10.101.1.10, Dst: 10.0.2.15
User Datagram Protocol, Src Port: 53, Dst Port: 38571
Domain Name System (response)

No.     Time           Source                Destination           Protocol Length Info
     75 1.090552120    127.0.0.53            127.0.0.1             DNS      121    Standard query response 0x70b0 A daisy.ubuntu.com A 162.213.35.24 A 162.213.35.25 OPT

Frame 75: 121 bytes on wire (968 bits), 121 bytes captured (968 bits) on interface any, id 0
Linux cooked capture
Internet Protocol Version 4, Src: 127.0.0.53, Dst: 127.0.0.1
User Datagram Protocol, Src Port: 53, Dst Port: 52265
Domain Name System (response)

No.     Time           Source                Destination           Protocol Length Info
     76 1.217031509    ::                    ff02::16              ICMPv6   92     Multicast Listener Report Message v2

Frame 76: 92 bytes on wire (736 bits), 92 bytes captured (736 bits) on interface any, id 0
Linux cooked capture
Internet Protocol Version 6, Src: ::, Dst: ff02::16
Internet Control Message Protocol v6

No.     Time           Source                Destination           Protocol Length Info
     77 1.277401476    ::                    ff02::1:ff00:1        ICMPv6   88     Neighbor Solicitation for fe80::200:ff:fe00:1

Frame 77: 88 bytes on wire (704 bits), 88 bytes captured (704 bits) on interface any, id 0
Linux cooked capture
Internet Protocol Version 6, Src: ::, Dst: ff02::1:ff00:1
Internet Control Message Protocol v6

No.     Time           Source                Destination           Protocol Length Info
     78 1.278636199    127.0.0.1             127.0.0.1             OpenFlow 196    Type: OFPT_PACKET_IN

Frame 78: 196 bytes on wire (1568 bits), 196 bytes captured (1568 bits) on interface any, id 0
Linux cooked capture
Internet Protocol Version 4, Src: 127.0.0.1, Dst: 127.0.0.1
Transmission Control Protocol, Src Port: 39218, Dst Port: 6653, Seq: 617, Ack: 453, Len: 128
OpenFlow 1.3

No.     Time           Source                Destination           Protocol Length Info
     79 1.280775837    127.0.0.1             127.0.0.1             OpenFlow 194    Type: OFPT_PACKET_OUT

Frame 79: 194 bytes on wire (1552 bits), 194 bytes captured (1552 bits) on interface any, id 0
Linux cooked capture
Internet Protocol Version 4, Src: 127.0.0.1, Dst: 127.0.0.1
Transmission Control Protocol, Src Port: 6653, Dst Port: 39218, Seq: 453, Ack: 745, Len: 126
OpenFlow 1.3

No.     Time           Source                Destination           Protocol Length Info
     80 1.280816922    127.0.0.1             127.0.0.1             TCP      68     39218 → 6653 [ACK] Seq=745 Ack=579 Win=44032 Len=0 TSval=3195878630 TSecr=3195878630

Frame 80: 68 bytes on wire (544 bits), 68 bytes captured (544 bits) on interface any, id 0
Linux cooked capture
Internet Protocol Version 4, Src: 127.0.0.1, Dst: 127.0.0.1
Transmission Control Protocol, Src Port: 39218, Dst Port: 6653, Seq: 745, Ack: 579, Len: 0

No.     Time           Source                Destination           Protocol Length Info
     81 1.281037288    ::                    ff02::1:ff00:1        ICMPv6   88     Neighbor Solicitation for fe80::200:ff:fe00:1

Frame 81: 88 bytes on wire (704 bits), 88 bytes captured (704 bits) on interface any, id 0
Linux cooked capture
Internet Protocol Version 6, Src: ::, Dst: ff02::1:ff00:1
Internet Control Message Protocol v6

No.     Time           Source                Destination           Protocol Length Info
     82 1.885305564    fe80::6cf2:83ff:fe5f:5c3a ff02::16              ICMPv6   92     Multicast Listener Report Message v2

Frame 82: 92 bytes on wire (736 bits), 92 bytes captured (736 bits) on interface any, id 0
Linux cooked capture
Internet Protocol Version 6, Src: fe80::6cf2:83ff:fe5f:5c3a, Dst: ff02::16
Internet Control Message Protocol v6

No.     Time           Source                Destination           Protocol Length Info
     83 1.885330539    fe80::6cf2:83ff:fe5f:5c3a ff02::2               ICMPv6   72     Router Solicitation from 6e:f2:83:5f:5c:3a

Frame 83: 72 bytes on wire (576 bits), 72 bytes captured (576 bits) on interface any, id 0
Linux cooked capture
Internet Protocol Version 6, Src: fe80::6cf2:83ff:fe5f:5c3a, Dst: ff02::2
Internet Control Message Protocol v6

No.     Time           Source                Destination           Protocol Length Info
     84 1.887918130    127.0.0.1             127.0.0.53            DNS      89     Standard query 0x6f7a A daisy.ubuntu.com OPT

Frame 84: 89 bytes on wire (712 bits), 89 bytes captured (712 bits) on interface any, id 0
Linux cooked capture
Internet Protocol Version 4, Src: 127.0.0.1, Dst: 127.0.0.53
