No.     Time           Source                Destination           Protocol Length Info
      1 0.000000000    127.0.0.1             127.0.0.1             TCP      76     40062 → 6653 [SYN] Seq=0 Win=43690 Len=0 MSS=65495 SACK_PERM=1 TSval=3195974586 TSecr=0 WS=512

Frame 1: 76 bytes on wire (608 bits), 76 bytes captured (608 bits) on interface any, id 0
Linux cooked capture
Internet Protocol Version 4, Src: 127.0.0.1, Dst: 127.0.0.1
Transmission Control Protocol, Src Port: 40062, Dst Port: 6653, Seq: 0, Len: 0

No.     Time           Source                Destination           Protocol Length Info
      2 0.000037415    127.0.0.1             127.0.0.1             TCP      76     6653 → 40062 [SYN, ACK] Seq=0 Ack=1 Win=43690 Len=0 MSS=65495 SACK_PERM=1 TSval=3195974586 TSecr=3195974586 WS=512

Frame 2: 76 bytes on wire (608 bits), 76 bytes captured (608 bits) on interface any, id 0
Linux cooked capture
Internet Protocol Version 4, Src: 127.0.0.1, Dst: 127.0.0.1
Transmission Control Protocol, Src Port: 6653, Dst Port: 40062, Seq: 0, Ack: 1, Len: 0

No.     Time           Source                Destination           Protocol Length Info
      3 0.000051099    127.0.0.1             127.0.0.1             TCP      68     40062 → 6653 [ACK] Seq=1 Ack=1 Win=44032 Len=0 TSval=3195974586 TSecr=3195974586

Frame 3: 68 bytes on wire (544 bits), 68 bytes captured (544 bits) on interface any, id 0
Linux cooked capture
Internet Protocol Version 4, Src: 127.0.0.1, Dst: 127.0.0.1
Transmission Control Protocol, Src Port: 40062, Dst Port: 6653, Seq: 1, Ack: 1, Len: 0

No.     Time           Source                Destination           Protocol Length Info
      4 0.000187527    127.0.0.1             127.0.0.1             TCP      68     40062 → 6653 [FIN, ACK] Seq=1 Ack=1 Win=44032 Len=0 TSval=3195974586 TSecr=3195974586

Frame 4: 68 bytes on wire (544 bits), 68 bytes captured (544 bits) on interface any, id 0
Linux cooked capture
Internet Protocol Version 4, Src: 127.0.0.1, Dst: 127.0.0.1
Transmission Control Protocol, Src Port: 40062, Dst Port: 6653, Seq: 1, Ack: 1, Len: 0

No.     Time           Source                Destination           Protocol Length Info
      5 0.002342110    127.0.0.1             127.0.0.1             TCP      68     6653 → 40062 [FIN, ACK] Seq=1 Ack=2 Win=44032 Len=0 TSval=3195974588 TSecr=3195974586

Frame 5: 68 bytes on wire (544 bits), 68 bytes captured (544 bits) on interface any, id 0
Linux cooked capture
Internet Protocol Version 4, Src: 127.0.0.1, Dst: 127.0.0.1
Transmission Control Protocol, Src Port: 6653, Dst Port: 40062, Seq: 1, Ack: 2, Len: 0

No.     Time           Source                Destination           Protocol Length Info
      6 0.002362913    127.0.0.1             127.0.0.1             TCP      68     40062 → 6653 [ACK] Seq=2 Ack=2 Win=44032 Len=0 TSval=3195974588 TSecr=3195974588

Frame 6: 68 bytes on wire (544 bits), 68 bytes captured (544 bits) on interface any, id 0
Linux cooked capture
Internet Protocol Version 4, Src: 127.0.0.1, Dst: 127.0.0.1
Transmission Control Protocol, Src Port: 40062, Dst Port: 6653, Seq: 2, Ack: 2, Len: 0

No.     Time           Source                Destination           Protocol Length Info
      7 0.154483452    ::                    ff02::16              ICMPv6   92     Multicast Listener Report Message v2

Frame 7: 92 bytes on wire (736 bits), 92 bytes captured (736 bits) on interface any, id 0
Linux cooked capture
Internet Protocol Version 6, Src: ::, Dst: ff02::16
Internet Control Message Protocol v6

No.     Time           Source                Destination           Protocol Length Info
      8 0.154469998    ::                    ff02::16              ICMPv6   92     Multicast Listener Report Message v2

Frame 8: 92 bytes on wire (736 bits), 92 bytes captured (736 bits) on interface any, id 0
Linux cooked capture
Internet Protocol Version 6, Src: ::, Dst: ff02::16
Internet Control Message Protocol v6

No.     Time           Source                Destination           Protocol Length Info
      9 0.224320593    ::                    ff02::16              ICMPv6   92     Multicast Listener Report Message v2

Frame 9: 92 bytes on wire (736 bits), 92 bytes captured (736 bits) on interface any, id 0
Linux cooked capture
Internet Protocol Version 6, Src: ::, Dst: ff02::16
Internet Control Message Protocol v6

No.     Time           Source                Destination           Protocol Length Info
     10 0.224311235    ::                    ff02::16              ICMPv6   92     Multicast Listener Report Message v2

Frame 10: 92 bytes on wire (736 bits), 92 bytes captured (736 bits) on interface any, id 0
Linux cooked capture
Internet Protocol Version 6, Src: ::, Dst: ff02::16
Internet Control Message Protocol v6

No.     Time           Source                Destination           Protocol Length Info
     11 0.249169613    ::                    ff02::16              ICMPv6   92     Multicast Listener Report Message v2

Frame 11: 92 bytes on wire (736 bits), 92 bytes captured (736 bits) on interface any, id 0
Linux cooked capture
Internet Protocol Version 6, Src: ::, Dst: ff02::16
Internet Control Message Protocol v6

No.     Time           Source                Destination           Protocol Length Info
     12 0.249198848    ::                    ff02::16              ICMPv6   112    Multicast Listener Report Message v2

Frame 12: 112 bytes on wire (896 bits), 112 bytes captured (896 bits) on interface any, id 0
Linux cooked capture
Internet Protocol Version 6, Src: ::, Dst: ff02::16
Internet Control Message Protocol v6

No.     Time           Source                Destination           Protocol Length Info
     13 0.294785455    ::                    ff02::16              ICMPv6   92     Multicast Listener Report Message v2

Frame 13: 92 bytes on wire (736 bits), 92 bytes captured (736 bits) on interface any, id 0
Linux cooked capture
Internet Protocol Version 6, Src: ::, Dst: ff02::16
Internet Control Message Protocol v6

No.     Time           Source                Destination           Protocol Length Info
     14 0.294825017    ::                    ff02::16              ICMPv6   112    Multicast Listener Report Message v2

Frame 14: 112 bytes on wire (896 bits), 112 bytes captured (896 bits) on interface any, id 0
Linux cooked capture
Internet Protocol Version 6, Src: ::, Dst: ff02::16
Internet Control Message Protocol v6

No.     Time           Source                Destination           Protocol Length Info
     15 0.340870412    127.0.0.1             127.0.0.1             TCP      76     37088 → 5037 [SYN] Seq=0 Win=43690 Len=0 MSS=65495 SACK_PERM=1 TSval=3195974927 TSecr=0 WS=512

Frame 15: 76 bytes on wire (608 bits), 76 bytes captured (608 bits) on interface any, id 0
Linux cooked capture
Internet Protocol Version 4, Src: 127.0.0.1, Dst: 127.0.0.1
Transmission Control Protocol, Src Port: 37088, Dst Port: 5037, Seq: 0, Len: 0

No.     Time           Source                Destination           Protocol Length Info
     16 0.340887214    127.0.0.1             127.0.0.1             TCP      56     5037 → 37088 [RST, ACK] Seq=1 Ack=1 Win=0 Len=0

Frame 16: 56 bytes on wire (448 bits), 56 bytes captured (448 bits) on interface any, id 0
Linux cooked capture
Internet Protocol Version 4, Src: 127.0.0.1, Dst: 127.0.0.1
Transmission Control Protocol, Src Port: 5037, Dst Port: 37088, Seq: 1, Ack: 1, Len: 0

No.     Time           Source                Destination           Protocol Length Info
     17 0.350364737    127.0.0.1             127.0.0.1             TCP      76     37096 → 5037 [SYN] Seq=0 Win=43690 Len=0 MSS=65495 SACK_PERM=1 TSval=3195974936 TSecr=0 WS=512

Frame 17: 76 bytes on wire (608 bits), 76 bytes captured (608 bits) on interface any, id 0
Linux cooked capture
Internet Protocol Version 4, Src: 127.0.0.1, Dst: 127.0.0.1
Transmission Control Protocol, Src Port: 37096, Dst Port: 5037, Seq: 0, Len: 0

No.     Time           Source                Destination           Protocol Length Info
     18 0.350392884    127.0.0.1             127.0.0.1             TCP      56     5037 → 37096 [RST, ACK] Seq=1 Ack=1 Win=0 Len=0

Frame 18: 56 bytes on wire (448 bits), 56 bytes captured (448 bits) on interface any, id 0
Linux cooked capture
Internet Protocol Version 4, Src: 127.0.0.1, Dst: 127.0.0.1
Transmission Control Protocol, Src Port: 5037, Dst Port: 37096, Seq: 1, Ack: 1, Len: 0

No.     Time           Source                Destination           Protocol Length Info
     19 0.352213213    127.0.0.1             127.0.0.1             TCP      76     37110 → 5037 [SYN] Seq=0 Win=43690 Len=0 MSS=65495 SACK_PERM=1 TSval=3195974938 TSecr=0 WS=512

Frame 19: 76 bytes on wire (608 bits), 76 bytes captured (608 bits) on interface any, id 0
Linux cooked capture
Internet Protocol Version 4, Src: 127.0.0.1, Dst: 127.0.0.1
Transmission Control Protocol, Src Port: 37110, Dst Port: 5037, Seq: 0, Len: 0

No.     Time           Source                Destination           Protocol Length Info
     20 0.352247200    127.0.0.1             127.0.0.1             TCP      56     5037 → 37110 [RST, ACK] Seq=1 Ack=1 Win=0 Len=0

Frame 20: 56 bytes on wire (448 bits), 56 bytes captured (448 bits) on interface any, id 0
Linux cooked capture
Internet Protocol Version 4, Src: 127.0.0.1, Dst: 127.0.0.1
Transmission Control Protocol, Src Port: 5037, Dst Port: 37110, Seq: 1, Ack: 1, Len: 0

No.     Time           Source                Destination           Protocol Length Info
     21 0.355790808    127.0.0.1             127.0.0.1             TCP      76     37126 → 5037 [SYN] Seq=0 Win=43690 Len=0 MSS=65495 SACK_PERM=1 TSval=3195974942 TSecr=0 WS=512

Frame 21: 76 bytes on wire (608 bits), 76 bytes captured (608 bits) on interface any, id 0
Linux cooked capture
Internet Protocol Version 4, Src: 127.0.0.1, Dst: 127.0.0.1
Transmission Control Protocol, Src Port: 37126, Dst Port: 5037, Seq: 0, Len: 0

No.     Time           Source                Destination           Protocol Length Info
     22 0.355831374    127.0.0.1             127.0.0.1             TCP      56     5037 → 37126 [RST, ACK] Seq=1 Ack=1 Win=0 Len=0

Frame 22: 56 bytes on wire (448 bits), 56 bytes captured (448 bits) on interface any, id 0
Linux cooked capture
Internet Protocol Version 4, Src: 127.0.0.1, Dst: 127.0.0.1
Transmission Control Protocol, Src Port: 5037, Dst Port: 37126, Seq: 1, Ack: 1, Len: 0

No.     Time           Source                Destination           Protocol Length Info
     23 0.358689725    127.0.0.1             127.0.0.1             TCP      76     37136 → 5037 [SYN] Seq=0 Win=43690 Len=0 MSS=65495 SACK_PERM=1 TSval=3195974945 TSecr=0 WS=512

Frame 23: 76 bytes on wire (608 bits), 76 bytes captured (608 bits) on interface any, id 0
Linux cooked capture
Internet Protocol Version 4, Src: 127.0.0.1, Dst: 127.0.0.1
Transmission Control Protocol, Src Port: 37136, Dst Port: 5037, Seq: 0, Len: 0

No.     Time           Source                Destination           Protocol Length Info
     24 0.358728709    127.0.0.1             127.0.0.1             TCP      56     5037 → 37136 [RST, ACK] Seq=1 Ack=1 Win=0 Len=0

Frame 24: 56 bytes on wire (448 bits), 56 bytes captured (448 bits) on interface any, id 0
Linux cooked capture
Internet Protocol Version 4, Src: 127.0.0.1, Dst: 127.0.0.1
Transmission Control Protocol, Src Port: 5037, Dst Port: 37136, Seq: 1, Ack: 1, Len: 0

No.     Time           Source                Destination           Protocol Length Info
     25 0.360781301    127.0.0.1             127.0.0.1             TCP      76     37148 → 5037 [SYN] Seq=0 Win=43690 Len=0 MSS=65495 SACK_PERM=1 TSval=3195974946 TSecr=0 WS=512

Frame 25: 76 bytes on wire (608 bits), 76 bytes captured (608 bits) on interface any, id 0
Linux cooked capture
Internet Protocol Version 4, Src: 127.0.0.1, Dst: 127.0.0.1
Transmission Control Protocol, Src Port: 37148, Dst Port: 5037, Seq: 0, Len: 0

No.     Time           Source                Destination           Protocol Length Info
     26 0.360813338    127.0.0.1             127.0.0.1             TCP      56     5037 → 37148 [RST, ACK] Seq=1 Ack=1 Win=0 Len=0

Frame 26: 56 bytes on wire (448 bits), 56 bytes captured (448 bits) on interface any, id 0
Linux cooked capture
Internet Protocol Version 4, Src: 127.0.0.1, Dst: 127.0.0.1
Transmission Control Protocol, Src Port: 5037, Dst Port: 37148, Seq: 1, Ack: 1, Len: 0

No.     Time           Source                Destination           Protocol Length Info
     27 0.364175633    127.0.0.1             127.0.0.1             TCP      76     37154 → 5037 [SYN] Seq=0 Win=43690 Len=0 MSS=65495 SACK_PERM=1 TSval=3195974949 TSecr=0 WS=512

Frame 27: 76 bytes on wire (608 bits), 76 bytes captured (608 bits) on interface any, id 0
Linux cooked capture
Internet Protocol Version 4, Src: 127.0.0.1, Dst: 127.0.0.1
Transmission Control Protocol, Src Port: 37154, Dst Port: 5037, Seq: 0, Len: 0

No.     Time           Source                Destination           Protocol Length Info
     28 0.364249238    127.0.0.1             127.0.0.1             TCP      56     5037 → 37154 [RST, ACK] Seq=1 Ack=1 Win=0 Len=0

Frame 28: 56 bytes on wire (448 bits), 56 bytes captured (448 bits) on interface any, id 0
Linux cooked capture
Internet Protocol Version 4, Src: 127.0.0.1, Dst: 127.0.0.1
Transmission Control Protocol, Src Port: 5037, Dst Port: 37154, Seq: 1, Ack: 1, Len: 0

No.     Time           Source                Destination           Protocol Length Info
     29 0.365692475    127.0.0.1             127.0.0.1             TCP      76     37156 → 5037 [SYN] Seq=0 Win=43690 Len=0 MSS=65495 SACK_PERM=1 TSval=3195974952 TSecr=0 WS=512

Frame 29: 76 bytes on wire (608 bits), 76 bytes captured (608 bits) on interface any, id 0
Linux cooked capture
Internet Protocol Version 4, Src: 127.0.0.1, Dst: 127.0.0.1
Transmission Control Protocol, Src Port: 37156, Dst Port: 5037, Seq: 0, Len: 0

No.     Time           Source                Destination           Protocol Length Info
     30 0.365707950    127.0.0.1             127.0.0.1             TCP      56     5037 → 37156 [RST, ACK] Seq=1 Ack=1 Win=0 Len=0

Frame 30: 56 bytes on wire (448 bits), 56 bytes captured (448 bits) on interface any, id 0
Linux cooked capture
Internet Protocol Version 4, Src: 127.0.0.1, Dst: 127.0.0.1
Transmission Control Protocol, Src Port: 5037, Dst Port: 37156, Seq: 1, Ack: 1, Len: 0

No.     Time           Source                Destination           Protocol Length Info
     31 0.369814981    127.0.0.1             127.0.0.1             TCP      76     37166 → 5037 [SYN] Seq=0 Win=43690 Len=0 MSS=65495 SACK_PERM=1 TSval=3195974956 TSecr=0 WS=512

Frame 31: 76 bytes on wire (608 bits), 76 bytes captured (608 bits) on interface any, id 0
Linux cooked capture
Internet Protocol Version 4, Src: 127.0.0.1, Dst: 127.0.0.1
Transmission Control Protocol, Src Port: 37166, Dst Port: 5037, Seq: 0, Len: 0

No.     Time           Source                Destination           Protocol Length Info
     32 0.369834601    127.0.0.1             127.0.0.1             TCP      56     5037 → 37166 [RST, ACK] Seq=1 Ack=1 Win=0 Len=0

Frame 32: 56 bytes on wire (448 bits), 56 bytes captured (448 bits) on interface any, id 0
Linux cooked capture
Internet Protocol Version 4, Src: 127.0.0.1, Dst: 127.0.0.1
Transmission Control Protocol, Src Port: 5037, Dst Port: 37166, Seq: 1, Ack: 1, Len: 0

No.     Time           Source                Destination           Protocol Length Info
     33 0.371282594    127.0.0.1             127.0.0.1             TCP      76     37168 → 5037 [SYN] Seq=0 Win=43690 Len=0 MSS=65495 SACK_PERM=1 TSval=3195974957 TSecr=0 WS=512

Frame 33: 76 bytes on wire (608 bits), 76 bytes captured (608 bits) on interface any, id 0
Linux cooked capture
Internet Protocol Version 4, Src: 127.0.0.1, Dst: 127.0.0.1
Transmission Control Protocol, Src Port: 37168, Dst Port: 5037, Seq: 0, Len: 0

No.     Time           Source                Destination           Protocol Length Info
     34 0.371296723    127.0.0.1             127.0.0.1             TCP      56     5037 → 37168 [RST, ACK] Seq=1 Ack=1 Win=0 Len=0

Frame 34: 56 bytes on wire (448 bits), 56 bytes captured (448 bits) on interface any, id 0
Linux cooked capture
Internet Protocol Version 4, Src: 127.0.0.1, Dst: 127.0.0.1
Transmission Control Protocol, Src Port: 5037, Dst Port: 37168, Seq: 1, Ack: 1, Len: 0

No.     Time           Source                Destination           Protocol Length Info
     35 0.390397253    127.0.0.1             127.0.0.1             TCP      76     40072 → 6653 [SYN] Seq=0 Win=43690 Len=0 MSS=65495 SACK_PERM=1 TSval=3195974976 TSecr=0 WS=512

Frame 35: 76 bytes on wire (608 bits), 76 bytes captured (608 bits) on interface any, id 0
Linux cooked capture
Internet Protocol Version 4, Src: 127.0.0.1, Dst: 127.0.0.1
Transmission Control Protocol, Src Port: 40072, Dst Port: 6653, Seq: 0, Len: 0

No.     Time           Source                Destination           Protocol Length Info
     36 0.390424659    127.0.0.1             127.0.0.1             TCP      76     6653 → 40072 [SYN, ACK] Seq=0 Ack=1 Win=43690 Len=0 MSS=65495 SACK_PERM=1 TSval=3195974976 TSecr=3195974976 WS=512

Frame 36: 76 bytes on wire (608 bits), 76 bytes captured (608 bits) on interface any, id 0
Linux cooked capture
Internet Protocol Version 4, Src: 127.0.0.1, Dst: 127.0.0.1
Transmission Control Protocol, Src Port: 6653, Dst Port: 40072, Seq: 0, Ack: 1, Len: 0

No.     Time           Source                Destination           Protocol Length Info
     37 0.390440831    127.0.0.1             127.0.0.1             TCP      68     40072 → 6653 [ACK] Seq=1 Ack=1 Win=44032 Len=0 TSval=3195974976 TSecr=3195974976

Frame 37: 68 bytes on wire (544 bits), 68 bytes captured (544 bits) on interface any, id 0
Linux cooked capture
Internet Protocol Version 4, Src: 127.0.0.1, Dst: 127.0.0.1
Transmission Control Protocol, Src Port: 40072, Dst Port: 6653, Seq: 1, Ack: 1, Len: 0

No.     Time           Source                Destination           Protocol Length Info
     38 0.396350211    127.0.0.1             127.0.0.1             OpenFlow 76     Type: OFPT_HELLO

Frame 38: 76 bytes on wire (608 bits), 76 bytes captured (608 bits) on interface any, id 0
Linux cooked capture
Internet Protocol Version 4, Src: 127.0.0.1, Dst: 127.0.0.1
Transmission Control Protocol, Src Port: 6653, Dst Port: 40072, Seq: 1, Ack: 1, Len: 8
OpenFlow 1.3

No.     Time           Source                Destination           Protocol Length Info
     39 0.396369939    127.0.0.1             127.0.0.1             TCP      68     40072 → 6653 [ACK] Seq=1 Ack=9 Win=44032 Len=0 TSval=3195974982 TSecr=3195974982

Frame 39: 68 bytes on wire (544 bits), 68 bytes captured (544 bits) on interface any, id 0
Linux cooked capture
Internet Protocol Version 4, Src: 127.0.0.1, Dst: 127.0.0.1
Transmission Control Protocol, Src Port: 40072, Dst Port: 6653, Seq: 1, Ack: 9, Len: 0

No.     Time           Source                Destination           Protocol Length Info
     40 0.400731794    127.0.0.1             127.0.0.1             OpenFlow 84     Type: OFPT_HELLO

Frame 40: 84 bytes on wire (672 bits), 84 bytes captured (672 bits) on interface any, id 0
Linux cooked capture
Internet Protocol Version 4, Src: 127.0.0.1, Dst: 127.0.0.1
Transmission Control Protocol, Src Port: 40072, Dst Port: 6653, Seq: 1, Ack: 9, Len: 16
OpenFlow 1.3

No.     Time           Source                Destination           Protocol Length Info
     41 0.400760788    127.0.0.1             127.0.0.1             TCP      68     6653 → 40072 [ACK] Seq=9 Ack=17 Win=44032 Len=0 TSval=3195974987 TSecr=3195974987

Frame 41: 68 bytes on wire (544 bits), 68 bytes captured (544 bits) on interface any, id 0
Linux cooked capture
Internet Protocol Version 4, Src: 127.0.0.1, Dst: 127.0.0.1
Transmission Control Protocol, Src Port: 6653, Dst Port: 40072, Seq: 9, Ack: 17, Len: 0

No.     Time           Source                Destination           Protocol Length Info
     42 0.401700333    127.0.0.1             127.0.0.1             OpenFlow 76     Type: OFPT_FEATURES_REQUEST

Frame 42: 76 bytes on wire (608 bits), 76 bytes captured (608 bits) on interface any, id 0
Linux cooked capture
Internet Protocol Version 4, Src: 127.0.0.1, Dst: 127.0.0.1
Transmission Control Protocol, Src Port: 6653, Dst Port: 40072, Seq: 9, Ack: 17, Len: 8
OpenFlow 1.3

No.     Time           Source                Destination           Protocol Length Info
     43 0.403466003    127.0.0.1             127.0.0.1             OpenFlow 148    Type: OFPT_PORT_STATUS

Frame 43: 148 bytes on wire (1184 bits), 148 bytes captured (1184 bits) on interface any, id 0
Linux cooked capture
Internet Protocol Version 4, Src: 127.0.0.1, Dst: 127.0.0.1
Transmission Control Protocol, Src Port: 40072, Dst Port: 6653, Seq: 17, Ack: 17, Len: 80
OpenFlow 1.3

No.     Time           Source                Destination           Protocol Length Info
     44 0.403884523    127.0.0.1             127.0.0.1             OpenFlow 100    Type: OFPT_FEATURES_REPLY

Frame 44: 100 bytes on wire (800 bits), 100 bytes captured (800 bits) on interface any, id 0
Linux cooked capture
Internet Protocol Version 4, Src: 127.0.0.1, Dst: 127.0.0.1
Transmission Control Protocol, Src Port: 40072, Dst Port: 6653, Seq: 97, Ack: 17, Len: 32
OpenFlow 1.3

No.     Time           Source                Destination           Protocol Length Info
     45 0.411661496    127.0.0.1             127.0.0.1             TCP      100    [TCP Retransmission] 40072 → 6653 [PSH, ACK] Seq=97 Ack=17 Win=44032 Len=32 TSval=3195974998 TSecr=3195974988

Frame 45: 100 bytes on wire (800 bits), 100 bytes captured (800 bits) on interface any, id 0
Linux cooked capture
Internet Protocol Version 4, Src: 127.0.0.1, Dst: 127.0.0.1
Transmission Control Protocol, Src Port: 40072, Dst Port: 6653, Seq: 97, Ack: 17, Len: 32

No.     Time           Source                Destination           Protocol Length Info
     46 0.411700022    127.0.0.1             127.0.0.1             TCP      80     6653 → 40072 [ACK] Seq=17 Ack=129 Win=44032 Len=0 TSval=3195974998 TSecr=3195974989 SLE=97 SRE=129

Frame 46: 80 bytes on wire (640 bits), 80 bytes captured (640 bits) on interface any, id 0
Linux cooked capture
Internet Protocol Version 4, Src: 127.0.0.1, Dst: 127.0.0.1
Transmission Control Protocol, Src Port: 6653, Dst Port: 40072, Seq: 17, Ack: 129, Len: 0

No.     Time           Source                Destination           Protocol Length Info
     47 0.414074768    127.0.0.1             127.0.0.1             OpenFlow 84     Type: OFPT_MULTIPART_REQUEST, OFPMP_PORT_DESC

Frame 47: 84 bytes on wire (672 bits), 84 bytes captured (672 bits) on interface any, id 0
Linux cooked capture
Internet Protocol Version 4, Src: 127.0.0.1, Dst: 127.0.0.1
Transmission Control Protocol, Src Port: 6653, Dst Port: 40072, Seq: 17, Ack: 129, Len: 16
OpenFlow 1.3

No.     Time           Source                Destination           Protocol Length Info
     48 0.414456655    127.0.0.1             127.0.0.1             OpenFlow 148    Type: OFPT_FLOW_MOD

Frame 48: 148 bytes on wire (1184 bits), 148 bytes captured (1184 bits) on interface any, id 0
Linux cooked capture
Internet Protocol Version 4, Src: 127.0.0.1, Dst: 127.0.0.1
Transmission Control Protocol, Src Port: 6653, Dst Port: 40072, Seq: 33, Ack: 129, Len: 80
OpenFlow 1.3

No.     Time           Source                Destination           Protocol Length Info
     49 0.419768782    127.0.0.1             127.0.0.1             OpenFlow 276    Type: OFPT_MULTIPART_REPLY, OFPMP_PORT_DESC

Frame 49: 276 bytes on wire (2208 bits), 276 bytes captured (2208 bits) on interface any, id 0
Linux cooked capture
Internet Protocol Version 4, Src: 127.0.0.1, Dst: 127.0.0.1
Transmission Control Protocol, Src Port: 40072, Dst Port: 6653, Seq: 129, Ack: 113, Len: 208
OpenFlow 1.3

No.     Time           Source                Destination           Protocol Length Info
     50 0.432726568    127.0.0.1             127.0.0.1             OpenFlow 132    Type: OFPT_FLOW_MOD

Frame 50: 132 bytes on wire (1056 bits), 132 bytes captured (1056 bits) on interface any, id 0
Linux cooked capture
Internet Protocol Version 4, Src: 127.0.0.1, Dst: 127.0.0.1
Transmission Control Protocol, Src Port: 6653, Dst Port: 40072, Seq: 113, Ack: 337, Len: 64
OpenFlow 1.3

No.     Time           Source                Destination           Protocol Length Info
     51 0.475597439    127.0.0.1             127.0.0.1             TCP      68     40072 → 6653 [ACK] Seq=337 Ack=177 Win=44032 Len=0 TSval=3195975062 TSecr=3195975019

Frame 51: 68 bytes on wire (544 bits), 68 bytes captured (544 bits) on interface any, id 0
Linux cooked capture
Internet Protocol Version 4, Src: 127.0.0.1, Dst: 127.0.0.1
Transmission Control Protocol, Src Port: 40072, Dst Port: 6653, Seq: 337, Ack: 177, Len: 0

No.     Time           Source                Destination           Protocol Length Info
     52 0.521071552    ::                    ff02::16              ICMPv6   112    Multicast Listener Report Message v2

Frame 52: 112 bytes on wire (896 bits), 112 bytes captured (896 bits) on interface any, id 0
Linux cooked capture
Internet Protocol Version 6, Src: ::, Dst: ff02::16
Internet Control Message Protocol v6

No.     Time           Source                Destination           Protocol Length Info
     53 0.521713694    127.0.0.1             127.0.0.1             OpenFlow 220    Type: OFPT_PACKET_IN

Frame 53: 220 bytes on wire (1760 bits), 220 bytes captured (1760 bits) on interface any, id 0
Linux cooked capture
Internet Protocol Version 4, Src: 127.0.0.1, Dst: 127.0.0.1
Transmission Control Protocol, Src Port: 40072, Dst Port: 6653, Seq: 337, Ack: 177, Len: 152
OpenFlow 1.3

No.     Time           Source                Destination           Protocol Length Info
     54 0.523287944    127.0.0.1             127.0.0.1             OpenFlow 218    Type: OFPT_PACKET_OUT

Frame 54: 218 bytes on wire (1744 bits), 218 bytes captured (1744 bits) on interface any, id 0
Linux cooked capture
Internet Protocol Version 4, Src: 127.0.0.1, Dst: 127.0.0.1
Transmission Control Protocol, Src Port: 6653, Dst Port: 40072, Seq: 177, Ack: 489, Len: 150
OpenFlow 1.3

No.     Time           Source                Destination           Protocol Length Info
     55 0.523302755    127.0.0.1             127.0.0.1             TCP      68     40072 → 6653 [ACK] Seq=489 Ack=327 Win=44032 Len=0 TSval=3195975109 TSecr=3195975109

Frame 55: 68 bytes on wire (544 bits), 68 bytes captured (544 bits) on interface any, id 0
Linux cooked capture
Internet Protocol Version 4, Src: 127.0.0.1, Dst: 127.0.0.1
Transmission Control Protocol, Src Port: 40072, Dst Port: 6653, Seq: 489, Ack: 327, Len: 0

No.     Time           Source                Destination           Protocol Length Info
     56 0.523425093    ::                    ff02::16              ICMPv6   112    Multicast Listener Report Message v2

Frame 56: 112 bytes on wire (896 bits), 112 bytes captured (896 bits) on interface any, id 0
Linux cooked capture
Internet Protocol Version 6, Src: ::, Dst: ff02::16
Internet Control Message Protocol v6

No.     Time           Source                Destination           Protocol Length Info
     57 0.524739526    ::                    ff02::1:ff2d:e4c7     ICMPv6   88     Neighbor Solicitation for fe80::bcd5:e6ff:fe2d:e4c7

Frame 57: 88 bytes on wire (704 bits), 88 bytes captured (704 bits) on interface any, id 0
Linux cooked capture
Internet Protocol Version 6, Src: ::, Dst: ff02::1:ff2d:e4c7
Internet Control Message Protocol v6

No.     Time           Source                Destination           Protocol Length Info
     58 0.648186861    ::                    ff02::1:ff00:1        ICMPv6   88     Neighbor Solicitation for fe80::200:ff:fe00:1

Frame 58: 88 bytes on wire (704 bits), 88 bytes captured (704 bits) on interface any, id 0
Linux cooked capture
Internet Protocol Version 6, Src: ::, Dst: ff02::1:ff00:1
Internet Control Message Protocol v6

No.     Time           Source                Destination           Protocol Length Info
     59 0.648616961    127.0.0.1             127.0.0.1             OpenFlow 196    Type: OFPT_PACKET_IN

Frame 59: 196 bytes on wire (1568 bits), 196 bytes captured (1568 bits) on interface any, id 0
Linux cooked capture
Internet Protocol Version 4, Src: 127.0.0.1, Dst: 127.0.0.1
Transmission Control Protocol, Src Port: 40072, Dst Port: 6653, Seq: 489, Ack: 327, Len: 128
OpenFlow 1.3

No.     Time           Source                Destination           Protocol Length Info
     60 0.649986669    127.0.0.1             127.0.0.1             OpenFlow 194    Type: OFPT_PACKET_OUT

Frame 60: 194 bytes on wire (1552 bits), 194 bytes captured (1552 bits) on interface any, id 0
Linux cooked capture
Internet Protocol Version 4, Src: 127.0.0.1, Dst: 127.0.0.1
Transmission Control Protocol, Src Port: 6653, Dst Port: 40072, Seq: 327, Ack: 617, Len: 126
OpenFlow 1.3

No.     Time           Source                Destination           Protocol Length Info
     61 0.650000777    127.0.0.1             127.0.0.1             TCP      68     40072 → 6653 [ACK] Seq=617 Ack=453 Win=44032 Len=0 TSval=3195975236 TSecr=3195975236

Frame 61: 68 bytes on wire (544 bits), 68 bytes captured (544 bits) on interface any, id 0
Linux cooked capture
Internet Protocol Version 4, Src: 127.0.0.1, Dst: 127.0.0.1
Transmission Control Protocol, Src Port: 40072, Dst Port: 6653, Seq: 617, Ack: 453, Len: 0

No.     Time           Source                Destination           Protocol Length Info
     62 0.650269016    ::                    ff02::1:ff00:1        ICMPv6   88     Neighbor Solicitation for fe80::200:ff:fe00:1

Frame 62: 88 bytes on wire (704 bits), 88 bytes captured (704 bits) on interface any, id 0
Linux cooked capture
Internet Protocol Version 6, Src: ::, Dst: ff02::1:ff00:1
Internet Control Message Protocol v6

No.     Time           Source                Destination           Protocol Length Info
     63 0.847672074    ::                    ff02::16              ICMPv6   112    Multicast Listener Report Message v2

Frame 63: 112 bytes on wire (896 bits), 112 bytes captured (896 bits) on interface any, id 0
Linux cooked capture
Internet Protocol Version 6, Src: ::, Dst: ff02::16
Internet Control Message Protocol v6

No.     Time           Source                Destination           Protocol Length Info
     64 0.848130522    127.0.0.1             127.0.0.1             OpenFlow 220    Type: OFPT_PACKET_IN

Frame 64: 220 bytes on wire (1760 bits), 220 bytes captured (1760 bits) on interface any, id 0
Linux cooked capture
Internet Protocol Version 4, Src: 127.0.0.1, Dst: 127.0.0.1
Transmission Control Protocol, Src Port: 40072, Dst Port: 6653, Seq: 617, Ack: 453, Len: 152
OpenFlow 1.3

No.     Time           Source                Destination           Protocol Length Info
     65 0.849189641    127.0.0.1             127.0.0.1             OpenFlow 218    Type: OFPT_PACKET_OUT

Frame 65: 218 bytes on wire (1744 bits), 218 bytes captured (1744 bits) on interface any, id 0
Linux cooked capture
Internet Protocol Version 4, Src: 127.0.0.1, Dst: 127.0.0.1
Transmission Control Protocol, Src Port: 6653, Dst Port: 40072, Seq: 453, Ack: 769, Len: 150
OpenFlow 1.3

No.     Time           Source                Destination           Protocol Length Info
     66 0.849204304    127.0.0.1             127.0.0.1             TCP      68     40072 → 6653 [ACK] Seq=769 Ack=603 Win=44032 Len=0 TSval=3195975435 TSecr=3195975435

Frame 66: 68 bytes on wire (544 bits), 68 bytes captured (544 bits) on interface any, id 0
Linux cooked capture
Internet Protocol Version 4, Src: 127.0.0.1, Dst: 127.0.0.1
Transmission Control Protocol, Src Port: 40072, Dst Port: 6653, Seq: 769, Ack: 603, Len: 0

No.     Time           Source                Destination           Protocol Length Info
     67 0.849459715    ::                    ff02::16              ICMPv6   112    Multicast Listener Report Message v2

Frame 67: 112 bytes on wire (896 bits), 112 bytes captured (896 bits) on interface any, id 0
Linux cooked capture
Internet Protocol Version 6, Src: ::, Dst: ff02::16
Internet Control Message Protocol v6

No.     Time           Source                Destination           Protocol Length Info
     68 0.972206088    ::                    ff02::16              ICMPv6   92     Multicast Listener Report Message v2

Frame 68: 92 bytes on wire (736 bits), 92 bytes captured (736 bits) on interface any, id 0
Linux cooked capture
Internet Protocol Version 6, Src: ::, Dst: ff02::16
Internet Control Message Protocol v6

No.     Time           Source                Destination           Protocol Length Info
     69 0.999838311    ::                    ff02::1:ff00:2        ICMPv6   88     Neighbor Solicitation for fe80::200:ff:fe00:2

Frame 69: 88 bytes on wire (704 bits), 88 bytes captured (704 bits) on interface any, id 0
Linux cooked capture
Internet Protocol Version 6, Src: ::, Dst: ff02::1:ff00:2
Internet Control Message Protocol v6

No.     Time           Source                Destination           Protocol Length Info
     70 1.000176756    127.0.0.1             127.0.0.1             OpenFlow 196    Type: OFPT_PACKET_IN

Frame 70: 196 bytes on wire (1568 bits), 196 bytes captured (1568 bits) on interface any, id 0
Linux cooked capture
Internet Protocol Version 4, Src: 127.0.0.1, Dst: 127.0.0.1
Transmission Control Protocol, Src Port: 40072, Dst Port: 6653, Seq: 769, Ack: 603, Len: 128
OpenFlow 1.3

No.     Time           Source                Destination           Protocol Length Info
     71 1.001655954    127.0.0.1             127.0.0.1             OpenFlow 194    Type: OFPT_PACKET_OUT

Frame 71: 194 bytes on wire (1552 bits), 194 bytes captured (1552 bits) on interface any, id 0
Linux cooked capture
Internet Protocol Version 4, Src: 127.0.0.1, Dst: 127.0.0.1
Transmission Control Protocol, Src Port: 6653, Dst Port: 40072, Seq: 603, Ack: 897, Len: 126
OpenFlow 1.3

No.     Time           Source                Destination           Protocol Length Info
     72 1.001668330    127.0.0.1             127.0.0.1             TCP      68     40072 → 6653 [ACK] Seq=897 Ack=729 Win=44032 Len=0 TSval=3195975588 TSecr=3195975588

Frame 72: 68 bytes on wire (544 bits), 68 bytes captured (544 bits) on interface any, id 0
Linux cooked capture
Internet Protocol Version 4, Src: 127.0.0.1, Dst: 127.0.0.1
Transmission Control Protocol, Src Port: 40072, Dst Port: 6653, Seq: 897, Ack: 729, Len: 0

No.     Time           Source                Destination           Protocol Length Info
     73 1.002039812    ::                    ff02::1:ff00:2        ICMPv6   88     Neighbor Solicitation for fe80::200:ff:fe00:2

Frame 73: 88 bytes on wire (704 bits), 88 bytes captured (704 bits) on interface any, id 0
Linux cooked capture
Internet Protocol Version 6, Src: ::, Dst: ff02::1:ff00:2
Internet Control Message Protocol v6

No.     Time           Source                Destination           Protocol Length Info
     74 1.034543159    ::                    ff02::1:ff3a:769f     ICMPv6   88     Neighbor Solicitation for fe80::5c44:56ff:fe3a:769f

Frame 74: 88 bytes on wire (704 bits), 88 bytes captured (704 bits) on interface any, id 0
Linux cooked capture
Internet Protocol Version 6, Src: ::, Dst: ff02::1:ff3a:769f
Internet Control Message Protocol v6

No.     Time           Source                Destination           Protocol Length Info
     75 1.069163187    ::                    ff02::16              ICMPv6   92     Multicast Listener Report Message v2

Frame 75: 92 bytes on wire (736 bits), 92 bytes captured (736 bits) on interface any, id 0
Linux cooked capture
Internet Protocol Version 6, Src: ::, Dst: ff02::16
Internet Control Message Protocol v6

No.     Time           Source                Destination           Protocol Length Info
     76 1.552392688    fe80::bcd5:e6ff:fe2d:e4c7 ff02::16              ICMPv6   92     Multicast Listener Report Message v2

Frame 76: 92 bytes on wire (736 bits), 92 bytes captured (736 bits) on interface any, id 0
Linux cooked capture
Internet Protocol Version 6, Src: fe80::bcd5:e6ff:fe2d:e4c7, Dst: ff02::16
Internet Control Message Protocol v6

No.     Time           Source                Destination           Protocol Length Info
     77 1.552422614    fe80::bcd5:e6ff:fe2d:e4c7 ff02::2               ICMPv6   72     Router Solicitation from be:d5:e6:2d:e4:c7

Frame 77: 72 bytes on wire (576 bits), 72 bytes captured (576 bits) on interface any, id 0
Linux cooked capture
Internet Protocol Version 6, Src: fe80::bcd5:e6ff:fe2d:e4c7, Dst: ff02::2
Internet Control Message Protocol v6

No.     Time           Source                Destination           Protocol Length Info
     78 1.553761336    127.0.0.1             127.0.0.53            DNS      89     Standard query 0x1e05 A daisy.ubuntu.com OPT

Frame 78: 89 bytes on wire (712 bits), 89 bytes captured (712 bits) on interface any, id 0
Linux cooked capture
Internet Protocol Version 4, Src: 127.0.0.1, Dst: 127.0.0.53
User Datagram Protocol, Src Port: 55592, Dst Port: 53
Domain Name System (query)

No.     Time           Source                Destination           Protocol Length Info
     79 1.553791169    127.0.0.1             127.0.0.53            DNS      89     Standard query 0xf40e AAAA daisy.ubuntu.com OPT

Frame 79: 89 bytes on wire (712 bits), 89 bytes captured (712 bits) on interface any, id 0
Linux cooked capture
Internet Protocol Version 4, Src: 127.0.0.1, Dst: 127.0.0.53
User Datagram Protocol, Src Port: 55592, Dst Port: 53
Domain Name System (query)

No.     Time           Source                Destination           Protocol Length Info
     80 1.554095807    10.0.2.15             10.101.1.10           DNS      89     Standard query 0x0039 A daisy.ubuntu.com OPT

Frame 80: 89 bytes on wire (712 bits), 89 bytes captured (712 bits) on interface any, id 0
Linux cooked capture
Internet Protocol Version 4, Src: 10.0.2.15, Dst: 10.101.1.10
User Datagram Protocol, Src Port: 47522, Dst Port: 53
Domain Name System (query)

No.     Time           Source                Destination           Protocol Length Info
     81 1.554975675    10.0.2.15             10.101.1.10           DNS      89     Standard query 0x3fae AAAA daisy.ubuntu.com OPT

Frame 81: 89 bytes on wire (712 bits), 89 bytes captured (712 bits) on interface any, id 0
Linux cooked capture
Internet Protocol Version 4, Src: 10.0.2.15, Dst: 10.101.1.10
User Datagram Protocol, Src Port: 37670, Dst Port: 53
Domain Name System (query)

No.     Time           Source                Destination           Protocol Length Info
     82 1.556538148    10.101.1.10           10.0.2.15             DNS      150    Standard query response 0x3fae AAAA daisy.ubuntu.com SOA ns1.canonical.com OPT

Frame 82: 150 bytes on wire (1200 bits), 150 bytes captured (1200 bits) on interface any, id 0
Linux cooked capture
Internet Protocol Version 4, Src: 10.101.1.10, Dst: 10.0.2.15
User Datagram Protocol, Src Port: 53, Dst Port: 37670
Domain Name System (response)

No.     Time           Source                Destination           Protocol Length Info
     83 1.556743039    127.0.0.53            127.0.0.1             DNS      89     Standard query response 0xf40e AAAA daisy.ubuntu.com OPT

Frame 83: 89 bytes on wire (712 bits), 89 bytes captured (712 bits) on interface any, id 0
Linux cooked capture
Internet Protocol Version 4, Src: 127.0.0.53, Dst: 127.0.0.1
User Datagram Protocol, Src Port: 53, Dst Port: 55592
Domain Name System (response)

No.     Time           Source                Destination           Protocol Length Info
     84 1.563834395    fe80::bcd5:e6ff:fe2d:e4c7 ff02::16              ICMPv6   92     Multicast Listener Report Message v2

Frame 84: 92 bytes on wire (736 bits), 92 bytes captured (736 bits) on interface any, id 0
Linux cooked capture
