No.     Time           Source                Destination           Protocol Length Info
      1 0.000000000    127.0.0.1             127.0.0.1             TCP      76     34522 → 6653 [SYN] Seq=0 Win=43690 Len=0 MSS=65495 SACK_PERM=1 TSval=3196060283 TSecr=0 WS=512

Frame 1: 76 bytes on wire (608 bits), 76 bytes captured (608 bits) on interface any, id 0
Linux cooked capture
Internet Protocol Version 4, Src: 127.0.0.1, Dst: 127.0.0.1
Transmission Control Protocol, Src Port: 34522, Dst Port: 6653, Seq: 0, Len: 0

No.     Time           Source                Destination           Protocol Length Info
      2 0.000144196    127.0.0.1             127.0.0.1             TCP      76     6653 → 34522 [SYN, ACK] Seq=0 Ack=1 Win=43690 Len=0 MSS=65495 SACK_PERM=1 TSval=3196060283 TSecr=3196060283 WS=512

Frame 2: 76 bytes on wire (608 bits), 76 bytes captured (608 bits) on interface any, id 0
Linux cooked capture
Internet Protocol Version 4, Src: 127.0.0.1, Dst: 127.0.0.1
Transmission Control Protocol, Src Port: 6653, Dst Port: 34522, Seq: 0, Ack: 1, Len: 0

No.     Time           Source                Destination           Protocol Length Info
      3 0.000170226    127.0.0.1             127.0.0.1             TCP      68     34522 → 6653 [ACK] Seq=1 Ack=1 Win=44032 Len=0 TSval=3196060283 TSecr=3196060283

Frame 3: 68 bytes on wire (544 bits), 68 bytes captured (544 bits) on interface any, id 0
Linux cooked capture
Internet Protocol Version 4, Src: 127.0.0.1, Dst: 127.0.0.1
Transmission Control Protocol, Src Port: 34522, Dst Port: 6653, Seq: 1, Ack: 1, Len: 0

No.     Time           Source                Destination           Protocol Length Info
      4 0.000477541    127.0.0.1             127.0.0.1             TCP      68     34522 → 6653 [FIN, ACK] Seq=1 Ack=1 Win=44032 Len=0 TSval=3196060283 TSecr=3196060283

Frame 4: 68 bytes on wire (544 bits), 68 bytes captured (544 bits) on interface any, id 0
Linux cooked capture
Internet Protocol Version 4, Src: 127.0.0.1, Dst: 127.0.0.1
Transmission Control Protocol, Src Port: 34522, Dst Port: 6653, Seq: 1, Ack: 1, Len: 0

No.     Time           Source                Destination           Protocol Length Info
      5 0.001166158    127.0.0.1             127.0.0.1             TCP      68     6653 → 34522 [FIN, ACK] Seq=1 Ack=2 Win=44032 Len=0 TSval=3196060284 TSecr=3196060283

Frame 5: 68 bytes on wire (544 bits), 68 bytes captured (544 bits) on interface any, id 0
Linux cooked capture
Internet Protocol Version 4, Src: 127.0.0.1, Dst: 127.0.0.1
Transmission Control Protocol, Src Port: 6653, Dst Port: 34522, Seq: 1, Ack: 2, Len: 0

No.     Time           Source                Destination           Protocol Length Info
      6 0.001178520    127.0.0.1             127.0.0.1             TCP      68     34522 → 6653 [ACK] Seq=2 Ack=2 Win=44032 Len=0 TSval=3196060284 TSecr=3196060284

Frame 6: 68 bytes on wire (544 bits), 68 bytes captured (544 bits) on interface any, id 0
Linux cooked capture
Internet Protocol Version 4, Src: 127.0.0.1, Dst: 127.0.0.1
Transmission Control Protocol, Src Port: 34522, Dst Port: 6653, Seq: 2, Ack: 2, Len: 0

No.     Time           Source                Destination           Protocol Length Info
      7 0.172193212    ::                    ff02::16              ICMPv6   92     Multicast Listener Report Message v2

Frame 7: 92 bytes on wire (736 bits), 92 bytes captured (736 bits) on interface any, id 0
Linux cooked capture
Internet Protocol Version 6, Src: ::, Dst: ff02::16
Internet Control Message Protocol v6

No.     Time           Source                Destination           Protocol Length Info
      8 0.172227451    ::                    ff02::16              ICMPv6   92     Multicast Listener Report Message v2

Frame 8: 92 bytes on wire (736 bits), 92 bytes captured (736 bits) on interface any, id 0
Linux cooked capture
Internet Protocol Version 6, Src: ::, Dst: ff02::16
Internet Control Message Protocol v6

No.     Time           Source                Destination           Protocol Length Info
      9 0.267849794    ::                    ff02::16              ICMPv6   92     Multicast Listener Report Message v2

Frame 9: 92 bytes on wire (736 bits), 92 bytes captured (736 bits) on interface any, id 0
Linux cooked capture
Internet Protocol Version 6, Src: ::, Dst: ff02::16
Internet Control Message Protocol v6

No.     Time           Source                Destination           Protocol Length Info
     10 0.267883020    ::                    ff02::16              ICMPv6   92     Multicast Listener Report Message v2

Frame 10: 92 bytes on wire (736 bits), 92 bytes captured (736 bits) on interface any, id 0
Linux cooked capture
Internet Protocol Version 6, Src: ::, Dst: ff02::16
Internet Control Message Protocol v6

No.     Time           Source                Destination           Protocol Length Info
     11 0.283215088    ::                    ff02::16              ICMPv6   92     Multicast Listener Report Message v2

Frame 11: 92 bytes on wire (736 bits), 92 bytes captured (736 bits) on interface any, id 0
Linux cooked capture
Internet Protocol Version 6, Src: ::, Dst: ff02::16
Internet Control Message Protocol v6

No.     Time           Source                Destination           Protocol Length Info
     12 0.283262064    ::                    ff02::16              ICMPv6   112    Multicast Listener Report Message v2

Frame 12: 112 bytes on wire (896 bits), 112 bytes captured (896 bits) on interface any, id 0
Linux cooked capture
Internet Protocol Version 6, Src: ::, Dst: ff02::16
Internet Control Message Protocol v6

No.     Time           Source                Destination           Protocol Length Info
     13 0.323857936    127.0.0.1             127.0.0.1             TCP      76     56382 → 5037 [SYN] Seq=0 Win=43690 Len=0 MSS=65495 SACK_PERM=1 TSval=3196060606 TSecr=0 WS=512

Frame 13: 76 bytes on wire (608 bits), 76 bytes captured (608 bits) on interface any, id 0
Linux cooked capture
Internet Protocol Version 4, Src: 127.0.0.1, Dst: 127.0.0.1
Transmission Control Protocol, Src Port: 56382, Dst Port: 5037, Seq: 0, Len: 0

No.     Time           Source                Destination           Protocol Length Info
     14 0.323909051    127.0.0.1             127.0.0.1             TCP      56     5037 → 56382 [RST, ACK] Seq=1 Ack=1 Win=0 Len=0

Frame 14: 56 bytes on wire (448 bits), 56 bytes captured (448 bits) on interface any, id 0
Linux cooked capture
Internet Protocol Version 4, Src: 127.0.0.1, Dst: 127.0.0.1
Transmission Control Protocol, Src Port: 5037, Dst Port: 56382, Seq: 1, Ack: 1, Len: 0

No.     Time           Source                Destination           Protocol Length Info
     15 0.324450510    ::                    ff02::16              ICMPv6   92     Multicast Listener Report Message v2

Frame 15: 92 bytes on wire (736 bits), 92 bytes captured (736 bits) on interface any, id 0
Linux cooked capture
Internet Protocol Version 6, Src: ::, Dst: ff02::16
Internet Control Message Protocol v6

No.     Time           Source                Destination           Protocol Length Info
     16 0.324505934    ::                    ff02::16              ICMPv6   112    Multicast Listener Report Message v2

Frame 16: 112 bytes on wire (896 bits), 112 bytes captured (896 bits) on interface any, id 0
Linux cooked capture
Internet Protocol Version 6, Src: ::, Dst: ff02::16
Internet Control Message Protocol v6

No.     Time           Source                Destination           Protocol Length Info
     17 0.325087082    127.0.0.1             127.0.0.1             TCP      76     56384 → 5037 [SYN] Seq=0 Win=43690 Len=0 MSS=65495 SACK_PERM=1 TSval=3196060608 TSecr=0 WS=512

Frame 17: 76 bytes on wire (608 bits), 76 bytes captured (608 bits) on interface any, id 0
Linux cooked capture
Internet Protocol Version 4, Src: 127.0.0.1, Dst: 127.0.0.1
Transmission Control Protocol, Src Port: 56384, Dst Port: 5037, Seq: 0, Len: 0

No.     Time           Source                Destination           Protocol Length Info
     18 0.325100111    127.0.0.1             127.0.0.1             TCP      56     5037 → 56384 [RST, ACK] Seq=1 Ack=1 Win=0 Len=0

Frame 18: 56 bytes on wire (448 bits), 56 bytes captured (448 bits) on interface any, id 0
Linux cooked capture
Internet Protocol Version 4, Src: 127.0.0.1, Dst: 127.0.0.1
Transmission Control Protocol, Src Port: 5037, Dst Port: 56384, Seq: 1, Ack: 1, Len: 0

No.     Time           Source                Destination           Protocol Length Info
     19 0.326801102    127.0.0.1             127.0.0.1             TCP      76     56400 → 5037 [SYN] Seq=0 Win=43690 Len=0 MSS=65495 SACK_PERM=1 TSval=3196060609 TSecr=0 WS=512

Frame 19: 76 bytes on wire (608 bits), 76 bytes captured (608 bits) on interface any, id 0
Linux cooked capture
Internet Protocol Version 4, Src: 127.0.0.1, Dst: 127.0.0.1
Transmission Control Protocol, Src Port: 56400, Dst Port: 5037, Seq: 0, Len: 0

No.     Time           Source                Destination           Protocol Length Info
     20 0.327104331    127.0.0.1             127.0.0.1             TCP      56     5037 → 56400 [RST, ACK] Seq=1 Ack=1 Win=0 Len=0

Frame 20: 56 bytes on wire (448 bits), 56 bytes captured (448 bits) on interface any, id 0
Linux cooked capture
Internet Protocol Version 4, Src: 127.0.0.1, Dst: 127.0.0.1
Transmission Control Protocol, Src Port: 5037, Dst Port: 56400, Seq: 1, Ack: 1, Len: 0

No.     Time           Source                Destination           Protocol Length Info
     21 0.333228469    127.0.0.1             127.0.0.1             TCP      76     56406 → 5037 [SYN] Seq=0 Win=43690 Len=0 MSS=65495 SACK_PERM=1 TSval=3196060615 TSecr=0 WS=512

Frame 21: 76 bytes on wire (608 bits), 76 bytes captured (608 bits) on interface any, id 0
Linux cooked capture
Internet Protocol Version 4, Src: 127.0.0.1, Dst: 127.0.0.1
Transmission Control Protocol, Src Port: 56406, Dst Port: 5037, Seq: 0, Len: 0

No.     Time           Source                Destination           Protocol Length Info
     22 0.333361352    127.0.0.1             127.0.0.1             TCP      56     5037 → 56406 [RST, ACK] Seq=1 Ack=1 Win=0 Len=0

Frame 22: 56 bytes on wire (448 bits), 56 bytes captured (448 bits) on interface any, id 0
Linux cooked capture
Internet Protocol Version 4, Src: 127.0.0.1, Dst: 127.0.0.1
Transmission Control Protocol, Src Port: 5037, Dst Port: 56406, Seq: 1, Ack: 1, Len: 0

No.     Time           Source                Destination           Protocol Length Info
     23 0.336987032    127.0.0.1             127.0.0.1             TCP      76     56416 → 5037 [SYN] Seq=0 Win=43690 Len=0 MSS=65495 SACK_PERM=1 TSval=3196060619 TSecr=0 WS=512

Frame 23: 76 bytes on wire (608 bits), 76 bytes captured (608 bits) on interface any, id 0
Linux cooked capture
Internet Protocol Version 4, Src: 127.0.0.1, Dst: 127.0.0.1
Transmission Control Protocol, Src Port: 56416, Dst Port: 5037, Seq: 0, Len: 0

No.     Time           Source                Destination           Protocol Length Info
     24 0.337007982    127.0.0.1             127.0.0.1             TCP      56     5037 → 56416 [RST, ACK] Seq=1 Ack=1 Win=0 Len=0

Frame 24: 56 bytes on wire (448 bits), 56 bytes captured (448 bits) on interface any, id 0
Linux cooked capture
Internet Protocol Version 4, Src: 127.0.0.1, Dst: 127.0.0.1
Transmission Control Protocol, Src Port: 5037, Dst Port: 56416, Seq: 1, Ack: 1, Len: 0

No.     Time           Source                Destination           Protocol Length Info
     25 0.342389657    127.0.0.1             127.0.0.1             TCP      76     56420 → 5037 [SYN] Seq=0 Win=43690 Len=0 MSS=65495 SACK_PERM=1 TSval=3196060625 TSecr=0 WS=512

Frame 25: 76 bytes on wire (608 bits), 76 bytes captured (608 bits) on interface any, id 0
Linux cooked capture
Internet Protocol Version 4, Src: 127.0.0.1, Dst: 127.0.0.1
Transmission Control Protocol, Src Port: 56420, Dst Port: 5037, Seq: 0, Len: 0

No.     Time           Source                Destination           Protocol Length Info
     26 0.342410765    127.0.0.1             127.0.0.1             TCP      56     5037 → 56420 [RST, ACK] Seq=1 Ack=1 Win=0 Len=0

Frame 26: 56 bytes on wire (448 bits), 56 bytes captured (448 bits) on interface any, id 0
Linux cooked capture
Internet Protocol Version 4, Src: 127.0.0.1, Dst: 127.0.0.1
Transmission Control Protocol, Src Port: 5037, Dst Port: 56420, Seq: 1, Ack: 1, Len: 0

No.     Time           Source                Destination           Protocol Length Info
     27 0.346662548    ::                    ff02::16              ICMPv6   112    Multicast Listener Report Message v2

Frame 27: 112 bytes on wire (896 bits), 112 bytes captured (896 bits) on interface any, id 0
Linux cooked capture
Internet Protocol Version 6, Src: ::, Dst: ff02::16
Internet Control Message Protocol v6

No.     Time           Source                Destination           Protocol Length Info
     28 0.349561600    127.0.0.1             127.0.0.1             TCP      76     56436 → 5037 [SYN] Seq=0 Win=43690 Len=0 MSS=65495 SACK_PERM=1 TSval=3196060632 TSecr=0 WS=512

Frame 28: 76 bytes on wire (608 bits), 76 bytes captured (608 bits) on interface any, id 0
Linux cooked capture
Internet Protocol Version 4, Src: 127.0.0.1, Dst: 127.0.0.1
Transmission Control Protocol, Src Port: 56436, Dst Port: 5037, Seq: 0, Len: 0

No.     Time           Source                Destination           Protocol Length Info
     29 0.349576272    127.0.0.1             127.0.0.1             TCP      56     5037 → 56436 [RST, ACK] Seq=1 Ack=1 Win=0 Len=0

Frame 29: 56 bytes on wire (448 bits), 56 bytes captured (448 bits) on interface any, id 0
Linux cooked capture
Internet Protocol Version 4, Src: 127.0.0.1, Dst: 127.0.0.1
Transmission Control Protocol, Src Port: 5037, Dst Port: 56436, Seq: 1, Ack: 1, Len: 0

No.     Time           Source                Destination           Protocol Length Info
     30 0.351158831    127.0.0.1             127.0.0.1             TCP      76     56446 → 5037 [SYN] Seq=0 Win=43690 Len=0 MSS=65495 SACK_PERM=1 TSval=3196060633 TSecr=0 WS=512

Frame 30: 76 bytes on wire (608 bits), 76 bytes captured (608 bits) on interface any, id 0
Linux cooked capture
Internet Protocol Version 4, Src: 127.0.0.1, Dst: 127.0.0.1
Transmission Control Protocol, Src Port: 56446, Dst Port: 5037, Seq: 0, Len: 0

No.     Time           Source                Destination           Protocol Length Info
     31 0.351177529    127.0.0.1             127.0.0.1             TCP      56     5037 → 56446 [RST, ACK] Seq=1 Ack=1 Win=0 Len=0

Frame 31: 56 bytes on wire (448 bits), 56 bytes captured (448 bits) on interface any, id 0
Linux cooked capture
Internet Protocol Version 4, Src: 127.0.0.1, Dst: 127.0.0.1
Transmission Control Protocol, Src Port: 5037, Dst Port: 56446, Seq: 1, Ack: 1, Len: 0

No.     Time           Source                Destination           Protocol Length Info
     32 0.352465099    127.0.0.1             127.0.0.1             TCP      76     56456 → 5037 [SYN] Seq=0 Win=43690 Len=0 MSS=65495 SACK_PERM=1 TSval=3196060635 TSecr=0 WS=512

Frame 32: 76 bytes on wire (608 bits), 76 bytes captured (608 bits) on interface any, id 0
Linux cooked capture
Internet Protocol Version 4, Src: 127.0.0.1, Dst: 127.0.0.1
Transmission Control Protocol, Src Port: 56456, Dst Port: 5037, Seq: 0, Len: 0

No.     Time           Source                Destination           Protocol Length Info
     33 0.352478204    127.0.0.1             127.0.0.1             TCP      56     5037 → 56456 [RST, ACK] Seq=1 Ack=1 Win=0 Len=0

Frame 33: 56 bytes on wire (448 bits), 56 bytes captured (448 bits) on interface any, id 0
Linux cooked capture
Internet Protocol Version 4, Src: 127.0.0.1, Dst: 127.0.0.1
Transmission Control Protocol, Src Port: 5037, Dst Port: 56456, Seq: 1, Ack: 1, Len: 0

No.     Time           Source                Destination           Protocol Length Info
     34 0.354744764    127.0.0.1             127.0.0.1             TCP      76     56470 → 5037 [SYN] Seq=0 Win=43690 Len=0 MSS=65495 SACK_PERM=1 TSval=3196060637 TSecr=0 WS=512

Frame 34: 76 bytes on wire (608 bits), 76 bytes captured (608 bits) on interface any, id 0
Linux cooked capture
Internet Protocol Version 4, Src: 127.0.0.1, Dst: 127.0.0.1
Transmission Control Protocol, Src Port: 56470, Dst Port: 5037, Seq: 0, Len: 0

No.     Time           Source                Destination           Protocol Length Info
     35 0.354770475    127.0.0.1             127.0.0.1             TCP      56     5037 → 56470 [RST, ACK] Seq=1 Ack=1 Win=0 Len=0

Frame 35: 56 bytes on wire (448 bits), 56 bytes captured (448 bits) on interface any, id 0
Linux cooked capture
Internet Protocol Version 4, Src: 127.0.0.1, Dst: 127.0.0.1
Transmission Control Protocol, Src Port: 5037, Dst Port: 56470, Seq: 1, Ack: 1, Len: 0

No.     Time           Source                Destination           Protocol Length Info
     36 0.377106737    127.0.0.1             127.0.0.1             TCP      76     34536 → 6653 [SYN] Seq=0 Win=43690 Len=0 MSS=65495 SACK_PERM=1 TSval=3196060660 TSecr=0 WS=512

Frame 36: 76 bytes on wire (608 bits), 76 bytes captured (608 bits) on interface any, id 0
Linux cooked capture
Internet Protocol Version 4, Src: 127.0.0.1, Dst: 127.0.0.1
Transmission Control Protocol, Src Port: 34536, Dst Port: 6653, Seq: 0, Len: 0

No.     Time           Source                Destination           Protocol Length Info
     37 0.377123043    127.0.0.1             127.0.0.1             TCP      76     6653 → 34536 [SYN, ACK] Seq=0 Ack=1 Win=43690 Len=0 MSS=65495 SACK_PERM=1 TSval=3196060660 TSecr=3196060660 WS=512

Frame 37: 76 bytes on wire (608 bits), 76 bytes captured (608 bits) on interface any, id 0
Linux cooked capture
Internet Protocol Version 4, Src: 127.0.0.1, Dst: 127.0.0.1
Transmission Control Protocol, Src Port: 6653, Dst Port: 34536, Seq: 0, Ack: 1, Len: 0

No.     Time           Source                Destination           Protocol Length Info
     38 0.377132650    127.0.0.1             127.0.0.1             TCP      68     34536 → 6653 [ACK] Seq=1 Ack=1 Win=44032 Len=0 TSval=3196060660 TSecr=3196060660

Frame 38: 68 bytes on wire (544 bits), 68 bytes captured (544 bits) on interface any, id 0
Linux cooked capture
Internet Protocol Version 4, Src: 127.0.0.1, Dst: 127.0.0.1
Transmission Control Protocol, Src Port: 34536, Dst Port: 6653, Seq: 1, Ack: 1, Len: 0

No.     Time           Source                Destination           Protocol Length Info
     39 0.380486401    127.0.0.1             127.0.0.1             OpenFlow 84     Type: OFPT_HELLO

Frame 39: 84 bytes on wire (672 bits), 84 bytes captured (672 bits) on interface any, id 0
Linux cooked capture
Internet Protocol Version 4, Src: 127.0.0.1, Dst: 127.0.0.1
Transmission Control Protocol, Src Port: 34536, Dst Port: 6653, Seq: 1, Ack: 1, Len: 16
OpenFlow 1.3

No.     Time           Source                Destination           Protocol Length Info
     40 0.380499528    127.0.0.1             127.0.0.1             TCP      68     6653 → 34536 [ACK] Seq=1 Ack=17 Win=44032 Len=0 TSval=3196060663 TSecr=3196060663

Frame 40: 68 bytes on wire (544 bits), 68 bytes captured (544 bits) on interface any, id 0
Linux cooked capture
Internet Protocol Version 4, Src: 127.0.0.1, Dst: 127.0.0.1
Transmission Control Protocol, Src Port: 6653, Dst Port: 34536, Seq: 1, Ack: 17, Len: 0

No.     Time           Source                Destination           Protocol Length Info
     41 0.384462215    127.0.0.1             127.0.0.1             OpenFlow 76     Type: OFPT_HELLO

Frame 41: 76 bytes on wire (608 bits), 76 bytes captured (608 bits) on interface any, id 0
Linux cooked capture
Internet Protocol Version 4, Src: 127.0.0.1, Dst: 127.0.0.1
Transmission Control Protocol, Src Port: 6653, Dst Port: 34536, Seq: 1, Ack: 17, Len: 8
OpenFlow 1.3

No.     Time           Source                Destination           Protocol Length Info
     42 0.384475286    127.0.0.1             127.0.0.1             TCP      68     34536 → 6653 [ACK] Seq=17 Ack=9 Win=44032 Len=0 TSval=3196060667 TSecr=3196060667

Frame 42: 68 bytes on wire (544 bits), 68 bytes captured (544 bits) on interface any, id 0
Linux cooked capture
Internet Protocol Version 4, Src: 127.0.0.1, Dst: 127.0.0.1
Transmission Control Protocol, Src Port: 34536, Dst Port: 6653, Seq: 17, Ack: 9, Len: 0

No.     Time           Source                Destination           Protocol Length Info
     43 0.384490829    127.0.0.1             127.0.0.1             OpenFlow 76     Type: OFPT_FEATURES_REQUEST

Frame 43: 76 bytes on wire (608 bits), 76 bytes captured (608 bits) on interface any, id 0
Linux cooked capture
Internet Protocol Version 4, Src: 127.0.0.1, Dst: 127.0.0.1
Transmission Control Protocol, Src Port: 6653, Dst Port: 34536, Seq: 9, Ack: 17, Len: 8
OpenFlow 1.3

No.     Time           Source                Destination           Protocol Length Info
     44 0.384492904    127.0.0.1             127.0.0.1             TCP      68     34536 → 6653 [ACK] Seq=17 Ack=17 Win=44032 Len=0 TSval=3196060667 TSecr=3196060667

Frame 44: 68 bytes on wire (544 bits), 68 bytes captured (544 bits) on interface any, id 0
Linux cooked capture
Internet Protocol Version 4, Src: 127.0.0.1, Dst: 127.0.0.1
Transmission Control Protocol, Src Port: 34536, Dst Port: 6653, Seq: 17, Ack: 17, Len: 0

No.     Time           Source                Destination           Protocol Length Info
     45 0.412428024    127.0.0.1             127.0.0.1             OpenFlow 100    Type: OFPT_FEATURES_REPLY

Frame 45: 100 bytes on wire (800 bits), 100 bytes captured (800 bits) on interface any, id 0
Linux cooked capture
Internet Protocol Version 4, Src: 127.0.0.1, Dst: 127.0.0.1
Transmission Control Protocol, Src Port: 34536, Dst Port: 6653, Seq: 17, Ack: 17, Len: 32
OpenFlow 1.3

No.     Time           Source                Destination           Protocol Length Info
     46 0.417941793    127.0.0.1             127.0.0.1             OpenFlow 84     Type: OFPT_MULTIPART_REQUEST, OFPMP_PORT_DESC

Frame 46: 84 bytes on wire (672 bits), 84 bytes captured (672 bits) on interface any, id 0
Linux cooked capture
Internet Protocol Version 4, Src: 127.0.0.1, Dst: 127.0.0.1
Transmission Control Protocol, Src Port: 6653, Dst Port: 34536, Seq: 17, Ack: 49, Len: 16
OpenFlow 1.3

No.     Time           Source                Destination           Protocol Length Info
     47 0.418040605    127.0.0.1             127.0.0.1             OpenFlow 148    Type: OFPT_FLOW_MOD

Frame 47: 148 bytes on wire (1184 bits), 148 bytes captured (1184 bits) on interface any, id 0
Linux cooked capture
Internet Protocol Version 4, Src: 127.0.0.1, Dst: 127.0.0.1
Transmission Control Protocol, Src Port: 6653, Dst Port: 34536, Seq: 33, Ack: 49, Len: 80
OpenFlow 1.3

No.     Time           Source                Destination           Protocol Length Info
     48 0.418285934    127.0.0.1             127.0.0.1             OpenFlow 276    Type: OFPT_MULTIPART_REPLY, OFPMP_PORT_DESC

Frame 48: 276 bytes on wire (2208 bits), 276 bytes captured (2208 bits) on interface any, id 0
Linux cooked capture
Internet Protocol Version 4, Src: 127.0.0.1, Dst: 127.0.0.1
Transmission Control Protocol, Src Port: 34536, Dst Port: 6653, Seq: 49, Ack: 113, Len: 208
OpenFlow 1.3

No.     Time           Source                Destination           Protocol Length Info
     49 0.424046076    127.0.0.1             127.0.0.1             OpenFlow 132    Type: OFPT_FLOW_MOD

Frame 49: 132 bytes on wire (1056 bits), 132 bytes captured (1056 bits) on interface any, id 0
Linux cooked capture
Internet Protocol Version 4, Src: 127.0.0.1, Dst: 127.0.0.1
Transmission Control Protocol, Src Port: 6653, Dst Port: 34536, Seq: 113, Ack: 257, Len: 64
OpenFlow 1.3

No.     Time           Source                Destination           Protocol Length Info
     50 0.443270909    ::                    ff02::1:ffa7:6550     ICMPv6   88     Neighbor Solicitation for fe80::50df:12ff:fea7:6550

Frame 50: 88 bytes on wire (704 bits), 88 bytes captured (704 bits) on interface any, id 0
Linux cooked capture
Internet Protocol Version 6, Src: ::, Dst: ff02::1:ffa7:6550
Internet Control Message Protocol v6

No.     Time           Source                Destination           Protocol Length Info
     51 0.469824263    127.0.0.1             127.0.0.1             TCP      68     34536 → 6653 [ACK] Seq=257 Ack=177 Win=44032 Len=0 TSval=3196060752 TSecr=3196060707

Frame 51: 68 bytes on wire (544 bits), 68 bytes captured (544 bits) on interface any, id 0
Linux cooked capture
Internet Protocol Version 4, Src: 127.0.0.1, Dst: 127.0.0.1
Transmission Control Protocol, Src Port: 34536, Dst Port: 6653, Seq: 257, Ack: 177, Len: 0

No.     Time           Source                Destination           Protocol Length Info
     52 0.503367808    ::                    ff02::1:ff00:1        ICMPv6   88     Neighbor Solicitation for fe80::200:ff:fe00:1

Frame 52: 88 bytes on wire (704 bits), 88 bytes captured (704 bits) on interface any, id 0
Linux cooked capture
Internet Protocol Version 6, Src: ::, Dst: ff02::1:ff00:1
Internet Control Message Protocol v6

No.     Time           Source                Destination           Protocol Length Info
     53 0.503951550    127.0.0.1             127.0.0.1             OpenFlow 196    Type: OFPT_PACKET_IN

Frame 53: 196 bytes on wire (1568 bits), 196 bytes captured (1568 bits) on interface any, id 0
Linux cooked capture
Internet Protocol Version 4, Src: 127.0.0.1, Dst: 127.0.0.1
Transmission Control Protocol, Src Port: 34536, Dst Port: 6653, Seq: 257, Ack: 177, Len: 128
OpenFlow 1.3

No.     Time           Source                Destination           Protocol Length Info
     54 0.504865507    127.0.0.1             127.0.0.1             OpenFlow 194    Type: OFPT_PACKET_OUT

Frame 54: 194 bytes on wire (1552 bits), 194 bytes captured (1552 bits) on interface any, id 0
Linux cooked capture
Internet Protocol Version 4, Src: 127.0.0.1, Dst: 127.0.0.1
Transmission Control Protocol, Src Port: 6653, Dst Port: 34536, Seq: 177, Ack: 385, Len: 126
OpenFlow 1.3

No.     Time           Source                Destination           Protocol Length Info
     55 0.504881727    127.0.0.1             127.0.0.1             TCP      68     34536 → 6653 [ACK] Seq=385 Ack=303 Win=44032 Len=0 TSval=3196060787 TSecr=3196060787

Frame 55: 68 bytes on wire (544 bits), 68 bytes captured (544 bits) on interface any, id 0
Linux cooked capture
Internet Protocol Version 4, Src: 127.0.0.1, Dst: 127.0.0.1
Transmission Control Protocol, Src Port: 34536, Dst Port: 6653, Seq: 385, Ack: 303, Len: 0

No.     Time           Source                Destination           Protocol Length Info
     56 0.505017846    ::                    ff02::1:ff00:1        ICMPv6   88     Neighbor Solicitation for fe80::200:ff:fe00:1

Frame 56: 88 bytes on wire (704 bits), 88 bytes captured (704 bits) on interface any, id 0
Linux cooked capture
Internet Protocol Version 6, Src: ::, Dst: ff02::1:ff00:1
Internet Control Message Protocol v6

No.     Time           Source                Destination           Protocol Length Info
     57 0.511061410    ::                    ff02::16              ICMPv6   112    Multicast Listener Report Message v2

Frame 57: 112 bytes on wire (896 bits), 112 bytes captured (896 bits) on interface any, id 0
Linux cooked capture
Internet Protocol Version 6, Src: ::, Dst: ff02::16
Internet Control Message Protocol v6

No.     Time           Source                Destination           Protocol Length Info
     58 0.511733544    127.0.0.1             127.0.0.1             OpenFlow 220    Type: OFPT_PACKET_IN

Frame 58: 220 bytes on wire (1760 bits), 220 bytes captured (1760 bits) on interface any, id 0
Linux cooked capture
Internet Protocol Version 4, Src: 127.0.0.1, Dst: 127.0.0.1
Transmission Control Protocol, Src Port: 34536, Dst Port: 6653, Seq: 385, Ack: 303, Len: 152
OpenFlow 1.3

No.     Time           Source                Destination           Protocol Length Info
     59 0.512800810    127.0.0.1             127.0.0.1             OpenFlow 218    Type: OFPT_PACKET_OUT

Frame 59: 218 bytes on wire (1744 bits), 218 bytes captured (1744 bits) on interface any, id 0
Linux cooked capture
Internet Protocol Version 4, Src: 127.0.0.1, Dst: 127.0.0.1
Transmission Control Protocol, Src Port: 6653, Dst Port: 34536, Seq: 303, Ack: 537, Len: 150
OpenFlow 1.3

No.     Time           Source                Destination           Protocol Length Info
     60 0.513101767    ::                    ff02::16              ICMPv6   112    Multicast Listener Report Message v2

Frame 60: 112 bytes on wire (896 bits), 112 bytes captured (896 bits) on interface any, id 0
Linux cooked capture
Internet Protocol Version 6, Src: ::, Dst: ff02::16
Internet Control Message Protocol v6

No.     Time           Source                Destination           Protocol Length Info
     61 0.517539414    ::                    ff02::16              ICMPv6   92     Multicast Listener Report Message v2

Frame 61: 92 bytes on wire (736 bits), 92 bytes captured (736 bits) on interface any, id 0
Linux cooked capture
Internet Protocol Version 6, Src: ::, Dst: ff02::16
Internet Control Message Protocol v6

No.     Time           Source                Destination           Protocol Length Info
     62 0.540029262    ::                    ff02::16              ICMPv6   92     Multicast Listener Report Message v2

Frame 62: 92 bytes on wire (736 bits), 92 bytes captured (736 bits) on interface any, id 0
Linux cooked capture
Internet Protocol Version 6, Src: ::, Dst: ff02::16
Internet Control Message Protocol v6

No.     Time           Source                Destination           Protocol Length Info
     63 0.561175707    127.0.0.1             127.0.0.1             TCP      68     34536 → 6653 [ACK] Seq=537 Ack=453 Win=44032 Len=0 TSval=3196060844 TSecr=3196060795

Frame 63: 68 bytes on wire (544 bits), 68 bytes captured (544 bits) on interface any, id 0
Linux cooked capture
Internet Protocol Version 4, Src: 127.0.0.1, Dst: 127.0.0.1
Transmission Control Protocol, Src Port: 34536, Dst Port: 6653, Seq: 537, Ack: 453, Len: 0

No.     Time           Source                Destination           Protocol Length Info
     64 0.855882233    ::                    ff02::1:ff38:1141     ICMPv6   88     Neighbor Solicitation for fe80::242c:77ff:fe38:1141

Frame 64: 88 bytes on wire (704 bits), 88 bytes captured (704 bits) on interface any, id 0
Linux cooked capture
Internet Protocol Version 6, Src: ::, Dst: ff02::1:ff38:1141
Internet Control Message Protocol v6

No.     Time           Source                Destination           Protocol Length Info
     65 1.000061374    ::                    ff02::1:ff00:2        ICMPv6   88     Neighbor Solicitation for fe80::200:ff:fe00:2

Frame 65: 88 bytes on wire (704 bits), 88 bytes captured (704 bits) on interface any, id 0
Linux cooked capture
Internet Protocol Version 6, Src: ::, Dst: ff02::1:ff00:2
Internet Control Message Protocol v6

No.     Time           Source                Destination           Protocol Length Info
     66 1.001678496    127.0.0.1             127.0.0.1             OpenFlow 196    Type: OFPT_PACKET_IN

Frame 66: 196 bytes on wire (1568 bits), 196 bytes captured (1568 bits) on interface any, id 0
Linux cooked capture
Internet Protocol Version 4, Src: 127.0.0.1, Dst: 127.0.0.1
Transmission Control Protocol, Src Port: 34536, Dst Port: 6653, Seq: 537, Ack: 453, Len: 128
OpenFlow 1.3

No.     Time           Source                Destination           Protocol Length Info
     67 1.002567100    127.0.0.1             127.0.0.1             OpenFlow 194    Type: OFPT_PACKET_OUT

Frame 67: 194 bytes on wire (1552 bits), 194 bytes captured (1552 bits) on interface any, id 0
Linux cooked capture
Internet Protocol Version 4, Src: 127.0.0.1, Dst: 127.0.0.1
Transmission Control Protocol, Src Port: 6653, Dst Port: 34536, Seq: 453, Ack: 665, Len: 126
OpenFlow 1.3

No.     Time           Source                Destination           Protocol Length Info
     68 1.002578094    127.0.0.1             127.0.0.1             TCP      68     34536 → 6653 [ACK] Seq=665 Ack=579 Win=44032 Len=0 TSval=3196061285 TSecr=3196061285

Frame 68: 68 bytes on wire (544 bits), 68 bytes captured (544 bits) on interface any, id 0
Linux cooked capture
Internet Protocol Version 4, Src: 127.0.0.1, Dst: 127.0.0.1
Transmission Control Protocol, Src Port: 34536, Dst Port: 6653, Seq: 665, Ack: 579, Len: 0

No.     Time           Source                Destination           Protocol Length Info
     69 1.002694780    ::                    ff02::1:ff00:2        ICMPv6   88     Neighbor Solicitation for fe80::200:ff:fe00:2

Frame 69: 88 bytes on wire (704 bits), 88 bytes captured (704 bits) on interface any, id 0
Linux cooked capture
Internet Protocol Version 6, Src: ::, Dst: ff02::1:ff00:2
Internet Control Message Protocol v6

No.     Time           Source                Destination           Protocol Length Info
     70 1.160730821    127.0.0.1             127.0.0.53            DNS      89     Standard query 0x0e03 A daisy.ubuntu.com OPT

Frame 70: 89 bytes on wire (712 bits), 89 bytes captured (712 bits) on interface any, id 0
Linux cooked capture
Internet Protocol Version 4, Src: 127.0.0.1, Dst: 127.0.0.53
User Datagram Protocol, Src Port: 49001, Dst Port: 53
Domain Name System (query)

No.     Time           Source                Destination           Protocol Length Info
     71 1.160999075    127.0.0.1             127.0.0.53            DNS      89     Standard query 0x070f AAAA daisy.ubuntu.com OPT

Frame 71: 89 bytes on wire (712 bits), 89 bytes captured (712 bits) on interface any, id 0
Linux cooked capture
Internet Protocol Version 4, Src: 127.0.0.1, Dst: 127.0.0.53
User Datagram Protocol, Src Port: 49001, Dst Port: 53
Domain Name System (query)

No.     Time           Source                Destination           Protocol Length Info
     72 1.161221134    10.0.2.15             10.101.1.10           DNS      89     Standard query 0x3fb5 A daisy.ubuntu.com OPT

Frame 72: 89 bytes on wire (712 bits), 89 bytes captured (712 bits) on interface any, id 0
Linux cooked capture
Internet Protocol Version 4, Src: 10.0.2.15, Dst: 10.101.1.10
User Datagram Protocol, Src Port: 58482, Dst Port: 53
Domain Name System (query)

No.     Time           Source                Destination           Protocol Length Info
     73 1.161626412    10.0.2.15             10.101.1.10           DNS      89     Standard query 0x6b61 AAAA daisy.ubuntu.com OPT

Frame 73: 89 bytes on wire (712 bits), 89 bytes captured (712 bits) on interface any, id 0
Linux cooked capture
Internet Protocol Version 4, Src: 10.0.2.15, Dst: 10.101.1.10
User Datagram Protocol, Src Port: 38599, Dst Port: 53
Domain Name System (query)

No.     Time           Source                Destination           Protocol Length Info
     74 1.164022251    10.101.1.10           10.0.2.15             DNS      150    Standard query response 0x6b61 AAAA daisy.ubuntu.com SOA ns1.canonical.com OPT

Frame 74: 150 bytes on wire (1200 bits), 150 bytes captured (1200 bits) on interface any, id 0
Linux cooked capture
Internet Protocol Version 4, Src: 10.101.1.10, Dst: 10.0.2.15
User Datagram Protocol, Src Port: 53, Dst Port: 38599
Domain Name System (response)

No.     Time           Source                Destination           Protocol Length Info
     75 1.164303538    127.0.0.53            127.0.0.1             DNS      89     Standard query response 0x070f AAAA daisy.ubuntu.com OPT

Frame 75: 89 bytes on wire (712 bits), 89 bytes captured (712 bits) on interface any, id 0
Linux cooked capture
Internet Protocol Version 4, Src: 127.0.0.53, Dst: 127.0.0.1
User Datagram Protocol, Src Port: 53, Dst Port: 49001
Domain Name System (response)

No.     Time           Source                Destination           Protocol Length Info
     76 1.175677417    10.101.1.10           10.0.2.15             DNS      121    Standard query response 0x3fb5 A daisy.ubuntu.com A 162.213.35.24 A 162.213.35.25 OPT

Frame 76: 121 bytes on wire (968 bits), 121 bytes captured (968 bits) on interface any, id 0
Linux cooked capture
Internet Protocol Version 4, Src: 10.101.1.10, Dst: 10.0.2.15
User Datagram Protocol, Src Port: 53, Dst Port: 58482
Domain Name System (response)

No.     Time           Source                Destination           Protocol Length Info
     77 1.176007894    127.0.0.53            127.0.0.1             DNS      121    Standard query response 0x0e03 A daisy.ubuntu.com A 162.213.35.24 A 162.213.35.25 OPT

Frame 77: 121 bytes on wire (968 bits), 121 bytes captured (968 bits) on interface any, id 0
Linux cooked capture
Internet Protocol Version 4, Src: 127.0.0.53, Dst: 127.0.0.1
User Datagram Protocol, Src Port: 53, Dst Port: 49001
Domain Name System (response)

No.     Time           Source                Destination           Protocol Length Info
     78 1.452923791    fe80::50df:12ff:fea7:6550 ff02::16              ICMPv6   92     Multicast Listener Report Message v2

Frame 78: 92 bytes on wire (736 bits), 92 bytes captured (736 bits) on interface any, id 0
Linux cooked capture
Internet Protocol Version 6, Src: fe80::50df:12ff:fea7:6550, Dst: ff02::16
Internet Control Message Protocol v6

No.     Time           Source                Destination           Protocol Length Info
     79 1.452953192    fe80::50df:12ff:fea7:6550 ff02::2               ICMPv6   72     Router Solicitation from 52:df:12:a7:65:50

Frame 79: 72 bytes on wire (576 bits), 72 bytes captured (576 bits) on interface any, id 0
Linux cooked capture
Internet Protocol Version 6, Src: fe80::50df:12ff:fea7:6550, Dst: ff02::2
Internet Control Message Protocol v6

No.     Time           Source                Destination           Protocol Length Info
     80 1.454380245    127.0.0.1             127.0.0.53            DNS      89     Standard query 0x68f0 A daisy.ubuntu.com OPT

Frame 80: 89 bytes on wire (712 bits), 89 bytes captured (712 bits) on interface any, id 0
Linux cooked capture
Internet Protocol Version 4, Src: 127.0.0.1, Dst: 127.0.0.53
User Datagram Protocol, Src Port: 57194, Dst Port: 53
Domain Name System (query)

No.     Time           Source                Destination           Protocol Length Info
     81 1.454466269    127.0.0.1             127.0.0.53            DNS      89     Standard query 0x6afd AAAA daisy.ubuntu.com OPT

Frame 81: 89 bytes on wire (712 bits), 89 bytes captured (712 bits) on interface any, id 0
Linux cooked capture
Internet Protocol Version 4, Src: 127.0.0.1, Dst: 127.0.0.53
User Datagram Protocol, Src Port: 57194, Dst Port: 53
Domain Name System (query)

No.     Time           Source                Destination           Protocol Length Info
     82 1.454786603    127.0.0.53            127.0.0.1             DNS      121    Standard query response 0x68f0 A daisy.ubuntu.com A 162.213.35.25 A 162.213.35.24 OPT

Frame 82: 121 bytes on wire (968 bits), 121 bytes captured (968 bits) on interface any, id 0
Linux cooked capture
Internet Protocol Version 4, Src: 127.0.0.53, Dst: 127.0.0.1
User Datagram Protocol, Src Port: 53, Dst Port: 57194
Domain Name System (response)

No.     Time           Source                Destination           Protocol Length Info
     83 1.455280107    10.0.2.15             10.101.1.10           DNS      89     Standard query 0xc098 AAAA daisy.ubuntu.com OPT

Frame 83: 89 bytes on wire (712 bits), 89 bytes captured (712 bits) on interface any, id 0
Linux cooked capture
Internet Protocol Version 4, Src: 10.0.2.15, Dst: 10.101.1.10
User Datagram Protocol, Src Port: 37792, Dst Port: 53
Domain Name System (query)

No.     Time           Source                Destination           Protocol Length Info
     84 1.459356060    10.101.1.10           10.0.2.15             DNS      150    Standard query response 0xc098 AAAA daisy.ubuntu.com SOA ns1.canonical.com OPT

