No.     Time           Source                Destination           Protocol Length Info
      1 0.000000000    127.0.0.1             127.0.0.1             TCP      76     50886 → 6653 [SYN] Seq=0 Win=43690 Len=0 MSS=65495 SACK_PERM=1 TSval=3196123599 TSecr=0 WS=512

Frame 1: 76 bytes on wire (608 bits), 76 bytes captured (608 bits) on interface any, id 0
Linux cooked capture
Internet Protocol Version 4, Src: 127.0.0.1, Dst: 127.0.0.1
Transmission Control Protocol, Src Port: 50886, Dst Port: 6653, Seq: 0, Len: 0

No.     Time           Source                Destination           Protocol Length Info
      2 0.000016013    127.0.0.1             127.0.0.1             TCP      76     6653 → 50886 [SYN, ACK] Seq=0 Ack=1 Win=43690 Len=0 MSS=65495 SACK_PERM=1 TSval=3196123599 TSecr=3196123599 WS=512

Frame 2: 76 bytes on wire (608 bits), 76 bytes captured (608 bits) on interface any, id 0
Linux cooked capture
Internet Protocol Version 4, Src: 127.0.0.1, Dst: 127.0.0.1
Transmission Control Protocol, Src Port: 6653, Dst Port: 50886, Seq: 0, Ack: 1, Len: 0

No.     Time           Source                Destination           Protocol Length Info
      3 0.000025228    127.0.0.1             127.0.0.1             TCP      68     50886 → 6653 [ACK] Seq=1 Ack=1 Win=44032 Len=0 TSval=3196123599 TSecr=3196123599

Frame 3: 68 bytes on wire (544 bits), 68 bytes captured (544 bits) on interface any, id 0
Linux cooked capture
Internet Protocol Version 4, Src: 127.0.0.1, Dst: 127.0.0.1
Transmission Control Protocol, Src Port: 50886, Dst Port: 6653, Seq: 1, Ack: 1, Len: 0

No.     Time           Source                Destination           Protocol Length Info
      4 0.000224041    127.0.0.1             127.0.0.1             TCP      68     50886 → 6653 [FIN, ACK] Seq=1 Ack=1 Win=44032 Len=0 TSval=3196123600 TSecr=3196123599

Frame 4: 68 bytes on wire (544 bits), 68 bytes captured (544 bits) on interface any, id 0
Linux cooked capture
Internet Protocol Version 4, Src: 127.0.0.1, Dst: 127.0.0.1
Transmission Control Protocol, Src Port: 50886, Dst Port: 6653, Seq: 1, Ack: 1, Len: 0

No.     Time           Source                Destination           Protocol Length Info
      5 0.001800443    127.0.0.1             127.0.0.1             TCP      68     6653 → 50886 [FIN, ACK] Seq=1 Ack=2 Win=44032 Len=0 TSval=3196123601 TSecr=3196123600

Frame 5: 68 bytes on wire (544 bits), 68 bytes captured (544 bits) on interface any, id 0
Linux cooked capture
Internet Protocol Version 4, Src: 127.0.0.1, Dst: 127.0.0.1
Transmission Control Protocol, Src Port: 6653, Dst Port: 50886, Seq: 1, Ack: 2, Len: 0

No.     Time           Source                Destination           Protocol Length Info
      6 0.001844557    127.0.0.1             127.0.0.1             TCP      68     50886 → 6653 [ACK] Seq=2 Ack=2 Win=44032 Len=0 TSval=3196123601 TSecr=3196123601

Frame 6: 68 bytes on wire (544 bits), 68 bytes captured (544 bits) on interface any, id 0
Linux cooked capture
Internet Protocol Version 4, Src: 127.0.0.1, Dst: 127.0.0.1
Transmission Control Protocol, Src Port: 50886, Dst Port: 6653, Seq: 2, Ack: 2, Len: 0

No.     Time           Source                Destination           Protocol Length Info
      7 0.174214168    ::                    ff02::16              ICMPv6   92     Multicast Listener Report Message v2

Frame 7: 92 bytes on wire (736 bits), 92 bytes captured (736 bits) on interface any, id 0
Linux cooked capture
Internet Protocol Version 6, Src: ::, Dst: ff02::16
Internet Control Message Protocol v6

No.     Time           Source                Destination           Protocol Length Info
      8 0.174256149    ::                    ff02::16              ICMPv6   92     Multicast Listener Report Message v2

Frame 8: 92 bytes on wire (736 bits), 92 bytes captured (736 bits) on interface any, id 0
Linux cooked capture
Internet Protocol Version 6, Src: ::, Dst: ff02::16
Internet Control Message Protocol v6

No.     Time           Source                Destination           Protocol Length Info
      9 0.254553846    ::                    ff02::1:ffbf:e981     ICMPv6   88     Neighbor Solicitation for fe80::84f0:84ff:febf:e981

Frame 9: 88 bytes on wire (704 bits), 88 bytes captured (704 bits) on interface any, id 0
Linux cooked capture
Internet Protocol Version 6, Src: ::, Dst: ff02::1:ffbf:e981
Internet Control Message Protocol v6

No.     Time           Source                Destination           Protocol Length Info
     10 0.254573798    ::                    ff02::16              ICMPv6   92     Multicast Listener Report Message v2

Frame 10: 92 bytes on wire (736 bits), 92 bytes captured (736 bits) on interface any, id 0
Linux cooked capture
Internet Protocol Version 6, Src: ::, Dst: ff02::16
Internet Control Message Protocol v6

No.     Time           Source                Destination           Protocol Length Info
     11 0.254531846    ::                    ff02::16              ICMPv6   92     Multicast Listener Report Message v2

Frame 11: 92 bytes on wire (736 bits), 92 bytes captured (736 bits) on interface any, id 0
Linux cooked capture
Internet Protocol Version 6, Src: ::, Dst: ff02::16
Internet Control Message Protocol v6

No.     Time           Source                Destination           Protocol Length Info
     12 0.318631346    ::                    ff02::16              ICMPv6   92     Multicast Listener Report Message v2

Frame 12: 92 bytes on wire (736 bits), 92 bytes captured (736 bits) on interface any, id 0
Linux cooked capture
Internet Protocol Version 6, Src: ::, Dst: ff02::16
Internet Control Message Protocol v6

No.     Time           Source                Destination           Protocol Length Info
     13 0.318788080    ::                    ff02::16              ICMPv6   112    Multicast Listener Report Message v2

Frame 13: 112 bytes on wire (896 bits), 112 bytes captured (896 bits) on interface any, id 0
Linux cooked capture
Internet Protocol Version 6, Src: ::, Dst: ff02::16
Internet Control Message Protocol v6

No.     Time           Source                Destination           Protocol Length Info
     14 0.331893084    ::                    ff02::1:ff6b:a6e5     ICMPv6   88     Neighbor Solicitation for fe80::e055:1eff:fe6b:a6e5

Frame 14: 88 bytes on wire (704 bits), 88 bytes captured (704 bits) on interface any, id 0
Linux cooked capture
Internet Protocol Version 6, Src: ::, Dst: ff02::1:ff6b:a6e5
Internet Control Message Protocol v6

No.     Time           Source                Destination           Protocol Length Info
     15 0.344298989    127.0.0.1             127.0.0.1             TCP      76     43794 → 5037 [SYN] Seq=0 Win=43690 Len=0 MSS=65495 SACK_PERM=1 TSval=3196123944 TSecr=0 WS=512

Frame 15: 76 bytes on wire (608 bits), 76 bytes captured (608 bits) on interface any, id 0
Linux cooked capture
Internet Protocol Version 4, Src: 127.0.0.1, Dst: 127.0.0.1
Transmission Control Protocol, Src Port: 43794, Dst Port: 5037, Seq: 0, Len: 0

No.     Time           Source                Destination           Protocol Length Info
     16 0.344316046    127.0.0.1             127.0.0.1             TCP      56     5037 → 43794 [RST, ACK] Seq=1 Ack=1 Win=0 Len=0

Frame 16: 56 bytes on wire (448 bits), 56 bytes captured (448 bits) on interface any, id 0
Linux cooked capture
Internet Protocol Version 4, Src: 127.0.0.1, Dst: 127.0.0.1
Transmission Control Protocol, Src Port: 5037, Dst Port: 43794, Seq: 1, Ack: 1, Len: 0

No.     Time           Source                Destination           Protocol Length Info
     17 0.345831334    127.0.0.1             127.0.0.1             TCP      76     43810 → 5037 [SYN] Seq=0 Win=43690 Len=0 MSS=65495 SACK_PERM=1 TSval=3196123945 TSecr=0 WS=512

Frame 17: 76 bytes on wire (608 bits), 76 bytes captured (608 bits) on interface any, id 0
Linux cooked capture
Internet Protocol Version 4, Src: 127.0.0.1, Dst: 127.0.0.1
Transmission Control Protocol, Src Port: 43810, Dst Port: 5037, Seq: 0, Len: 0

No.     Time           Source                Destination           Protocol Length Info
     18 0.345857758    127.0.0.1             127.0.0.1             TCP      56     5037 → 43810 [RST, ACK] Seq=1 Ack=1 Win=0 Len=0

Frame 18: 56 bytes on wire (448 bits), 56 bytes captured (448 bits) on interface any, id 0
Linux cooked capture
Internet Protocol Version 4, Src: 127.0.0.1, Dst: 127.0.0.1
Transmission Control Protocol, Src Port: 5037, Dst Port: 43810, Seq: 1, Ack: 1, Len: 0

No.     Time           Source                Destination           Protocol Length Info
     19 0.347337373    127.0.0.1             127.0.0.1             TCP      76     43812 → 5037 [SYN] Seq=0 Win=43690 Len=0 MSS=65495 SACK_PERM=1 TSval=3196123947 TSecr=0 WS=512

Frame 19: 76 bytes on wire (608 bits), 76 bytes captured (608 bits) on interface any, id 0
Linux cooked capture
Internet Protocol Version 4, Src: 127.0.0.1, Dst: 127.0.0.1
Transmission Control Protocol, Src Port: 43812, Dst Port: 5037, Seq: 0, Len: 0

No.     Time           Source                Destination           Protocol Length Info
     20 0.347361369    127.0.0.1             127.0.0.1             TCP      56     5037 → 43812 [RST, ACK] Seq=1 Ack=1 Win=0 Len=0

Frame 20: 56 bytes on wire (448 bits), 56 bytes captured (448 bits) on interface any, id 0
Linux cooked capture
Internet Protocol Version 4, Src: 127.0.0.1, Dst: 127.0.0.1
Transmission Control Protocol, Src Port: 5037, Dst Port: 43812, Seq: 1, Ack: 1, Len: 0

No.     Time           Source                Destination           Protocol Length Info
     21 0.358550104    127.0.0.1             127.0.0.1             TCP      76     43822 → 5037 [SYN] Seq=0 Win=43690 Len=0 MSS=65495 SACK_PERM=1 TSval=3196123958 TSecr=0 WS=512

Frame 21: 76 bytes on wire (608 bits), 76 bytes captured (608 bits) on interface any, id 0
Linux cooked capture
Internet Protocol Version 4, Src: 127.0.0.1, Dst: 127.0.0.1
Transmission Control Protocol, Src Port: 43822, Dst Port: 5037, Seq: 0, Len: 0

No.     Time           Source                Destination           Protocol Length Info
     22 0.358565675    127.0.0.1             127.0.0.1             TCP      56     5037 → 43822 [RST, ACK] Seq=1 Ack=1 Win=0 Len=0

Frame 22: 56 bytes on wire (448 bits), 56 bytes captured (448 bits) on interface any, id 0
Linux cooked capture
Internet Protocol Version 4, Src: 127.0.0.1, Dst: 127.0.0.1
Transmission Control Protocol, Src Port: 5037, Dst Port: 43822, Seq: 1, Ack: 1, Len: 0

No.     Time           Source                Destination           Protocol Length Info
     23 0.362265287    127.0.0.1             127.0.0.1             TCP      76     43836 → 5037 [SYN] Seq=0 Win=43690 Len=0 MSS=65495 SACK_PERM=1 TSval=3196123962 TSecr=0 WS=512

Frame 23: 76 bytes on wire (608 bits), 76 bytes captured (608 bits) on interface any, id 0
Linux cooked capture
Internet Protocol Version 4, Src: 127.0.0.1, Dst: 127.0.0.1
Transmission Control Protocol, Src Port: 43836, Dst Port: 5037, Seq: 0, Len: 0

No.     Time           Source                Destination           Protocol Length Info
     24 0.362278353    127.0.0.1             127.0.0.1             TCP      56     5037 → 43836 [RST, ACK] Seq=1 Ack=1 Win=0 Len=0

Frame 24: 56 bytes on wire (448 bits), 56 bytes captured (448 bits) on interface any, id 0
Linux cooked capture
Internet Protocol Version 4, Src: 127.0.0.1, Dst: 127.0.0.1
Transmission Control Protocol, Src Port: 5037, Dst Port: 43836, Seq: 1, Ack: 1, Len: 0

No.     Time           Source                Destination           Protocol Length Info
     25 0.366499234    127.0.0.1             127.0.0.1             TCP      76     43842 → 5037 [SYN] Seq=0 Win=43690 Len=0 MSS=65495 SACK_PERM=1 TSval=3196123966 TSecr=0 WS=512

Frame 25: 76 bytes on wire (608 bits), 76 bytes captured (608 bits) on interface any, id 0
Linux cooked capture
Internet Protocol Version 4, Src: 127.0.0.1, Dst: 127.0.0.1
Transmission Control Protocol, Src Port: 43842, Dst Port: 5037, Seq: 0, Len: 0

No.     Time           Source                Destination           Protocol Length Info
     26 0.366531281    127.0.0.1             127.0.0.1             TCP      56     5037 → 43842 [RST, ACK] Seq=1 Ack=1 Win=0 Len=0

Frame 26: 56 bytes on wire (448 bits), 56 bytes captured (448 bits) on interface any, id 0
Linux cooked capture
Internet Protocol Version 4, Src: 127.0.0.1, Dst: 127.0.0.1
Transmission Control Protocol, Src Port: 5037, Dst Port: 43842, Seq: 1, Ack: 1, Len: 0

No.     Time           Source                Destination           Protocol Length Info
     27 0.366657669    ::                    ff02::16              ICMPv6   112    Multicast Listener Report Message v2

Frame 27: 112 bytes on wire (896 bits), 112 bytes captured (896 bits) on interface any, id 0
Linux cooked capture
Internet Protocol Version 6, Src: ::, Dst: ff02::16
Internet Control Message Protocol v6

No.     Time           Source                Destination           Protocol Length Info
     28 0.367940174    127.0.0.1             127.0.0.1             TCP      76     43848 → 5037 [SYN] Seq=0 Win=43690 Len=0 MSS=65495 SACK_PERM=1 TSval=3196123967 TSecr=0 WS=512

Frame 28: 76 bytes on wire (608 bits), 76 bytes captured (608 bits) on interface any, id 0
Linux cooked capture
Internet Protocol Version 4, Src: 127.0.0.1, Dst: 127.0.0.1
Transmission Control Protocol, Src Port: 43848, Dst Port: 5037, Seq: 0, Len: 0

No.     Time           Source                Destination           Protocol Length Info
     29 0.367951467    127.0.0.1             127.0.0.1             TCP      56     5037 → 43848 [RST, ACK] Seq=1 Ack=1 Win=0 Len=0

Frame 29: 56 bytes on wire (448 bits), 56 bytes captured (448 bits) on interface any, id 0
Linux cooked capture
Internet Protocol Version 4, Src: 127.0.0.1, Dst: 127.0.0.1
Transmission Control Protocol, Src Port: 5037, Dst Port: 43848, Seq: 1, Ack: 1, Len: 0

No.     Time           Source                Destination           Protocol Length Info
     30 0.369462048    127.0.0.1             127.0.0.1             TCP      76     43862 → 5037 [SYN] Seq=0 Win=43690 Len=0 MSS=65495 SACK_PERM=1 TSval=3196123969 TSecr=0 WS=512

Frame 30: 76 bytes on wire (608 bits), 76 bytes captured (608 bits) on interface any, id 0
Linux cooked capture
Internet Protocol Version 4, Src: 127.0.0.1, Dst: 127.0.0.1
Transmission Control Protocol, Src Port: 43862, Dst Port: 5037, Seq: 0, Len: 0

No.     Time           Source                Destination           Protocol Length Info
     31 0.369501548    127.0.0.1             127.0.0.1             TCP      56     5037 → 43862 [RST, ACK] Seq=1 Ack=1 Win=0 Len=0

Frame 31: 56 bytes on wire (448 bits), 56 bytes captured (448 bits) on interface any, id 0
Linux cooked capture
Internet Protocol Version 4, Src: 127.0.0.1, Dst: 127.0.0.1
Transmission Control Protocol, Src Port: 5037, Dst Port: 43862, Seq: 1, Ack: 1, Len: 0

No.     Time           Source                Destination           Protocol Length Info
     32 0.371214479    127.0.0.1             127.0.0.1             TCP      76     43866 → 5037 [SYN] Seq=0 Win=43690 Len=0 MSS=65495 SACK_PERM=1 TSval=3196123971 TSecr=0 WS=512

Frame 32: 76 bytes on wire (608 bits), 76 bytes captured (608 bits) on interface any, id 0
Linux cooked capture
Internet Protocol Version 4, Src: 127.0.0.1, Dst: 127.0.0.1
Transmission Control Protocol, Src Port: 43866, Dst Port: 5037, Seq: 0, Len: 0

No.     Time           Source                Destination           Protocol Length Info
     33 0.371246553    127.0.0.1             127.0.0.1             TCP      56     5037 → 43866 [RST, ACK] Seq=1 Ack=1 Win=0 Len=0

Frame 33: 56 bytes on wire (448 bits), 56 bytes captured (448 bits) on interface any, id 0
Linux cooked capture
Internet Protocol Version 4, Src: 127.0.0.1, Dst: 127.0.0.1
Transmission Control Protocol, Src Port: 5037, Dst Port: 43866, Seq: 1, Ack: 1, Len: 0

No.     Time           Source                Destination           Protocol Length Info
     34 0.373737687    127.0.0.1             127.0.0.1             TCP      76     43872 → 5037 [SYN] Seq=0 Win=43690 Len=0 MSS=65495 SACK_PERM=1 TSval=3196123973 TSecr=0 WS=512

Frame 34: 76 bytes on wire (608 bits), 76 bytes captured (608 bits) on interface any, id 0
Linux cooked capture
Internet Protocol Version 4, Src: 127.0.0.1, Dst: 127.0.0.1
Transmission Control Protocol, Src Port: 43872, Dst Port: 5037, Seq: 0, Len: 0

No.     Time           Source                Destination           Protocol Length Info
     35 0.373771500    127.0.0.1             127.0.0.1             TCP      56     5037 → 43872 [RST, ACK] Seq=1 Ack=1 Win=0 Len=0

Frame 35: 56 bytes on wire (448 bits), 56 bytes captured (448 bits) on interface any, id 0
Linux cooked capture
Internet Protocol Version 4, Src: 127.0.0.1, Dst: 127.0.0.1
Transmission Control Protocol, Src Port: 5037, Dst Port: 43872, Seq: 1, Ack: 1, Len: 0

No.     Time           Source                Destination           Protocol Length Info
     36 0.391506111    ::                    ff02::16              ICMPv6   92     Multicast Listener Report Message v2

Frame 36: 92 bytes on wire (736 bits), 92 bytes captured (736 bits) on interface any, id 0
Linux cooked capture
Internet Protocol Version 6, Src: ::, Dst: ff02::16
Internet Control Message Protocol v6

No.     Time           Source                Destination           Protocol Length Info
     37 0.391551777    ::                    ff02::16              ICMPv6   112    Multicast Listener Report Message v2

Frame 37: 112 bytes on wire (896 bits), 112 bytes captured (896 bits) on interface any, id 0
Linux cooked capture
Internet Protocol Version 6, Src: ::, Dst: ff02::16
Internet Control Message Protocol v6

No.     Time           Source                Destination           Protocol Length Info
     38 0.457049782    127.0.0.1             127.0.0.1             TCP      76     50894 → 6653 [SYN] Seq=0 Win=43690 Len=0 MSS=65495 SACK_PERM=1 TSval=3196124056 TSecr=0 WS=512

Frame 38: 76 bytes on wire (608 bits), 76 bytes captured (608 bits) on interface any, id 0
Linux cooked capture
Internet Protocol Version 4, Src: 127.0.0.1, Dst: 127.0.0.1
Transmission Control Protocol, Src Port: 50894, Dst Port: 6653, Seq: 0, Len: 0

No.     Time           Source                Destination           Protocol Length Info
     39 0.457070821    127.0.0.1             127.0.0.1             TCP      76     6653 → 50894 [SYN, ACK] Seq=0 Ack=1 Win=43690 Len=0 MSS=65495 SACK_PERM=1 TSval=3196124057 TSecr=3196124056 WS=512

Frame 39: 76 bytes on wire (608 bits), 76 bytes captured (608 bits) on interface any, id 0
Linux cooked capture
Internet Protocol Version 4, Src: 127.0.0.1, Dst: 127.0.0.1
Transmission Control Protocol, Src Port: 6653, Dst Port: 50894, Seq: 0, Ack: 1, Len: 0

No.     Time           Source                Destination           Protocol Length Info
     40 0.457087476    127.0.0.1             127.0.0.1             TCP      68     50894 → 6653 [ACK] Seq=1 Ack=1 Win=44032 Len=0 TSval=3196124057 TSecr=3196124057

Frame 40: 68 bytes on wire (544 bits), 68 bytes captured (544 bits) on interface any, id 0
Linux cooked capture
Internet Protocol Version 4, Src: 127.0.0.1, Dst: 127.0.0.1
Transmission Control Protocol, Src Port: 50894, Dst Port: 6653, Seq: 1, Ack: 1, Len: 0

No.     Time           Source                Destination           Protocol Length Info
     41 0.464457046    127.0.0.1             127.0.0.1             OpenFlow 76     Type: OFPT_HELLO

Frame 41: 76 bytes on wire (608 bits), 76 bytes captured (608 bits) on interface any, id 0
Linux cooked capture
Internet Protocol Version 4, Src: 127.0.0.1, Dst: 127.0.0.1
Transmission Control Protocol, Src Port: 6653, Dst Port: 50894, Seq: 1, Ack: 1, Len: 8
OpenFlow 1.3

No.     Time           Source                Destination           Protocol Length Info
     42 0.464479523    127.0.0.1             127.0.0.1             TCP      68     50894 → 6653 [ACK] Seq=1 Ack=9 Win=44032 Len=0 TSval=3196124064 TSecr=3196124064

Frame 42: 68 bytes on wire (544 bits), 68 bytes captured (544 bits) on interface any, id 0
Linux cooked capture
Internet Protocol Version 4, Src: 127.0.0.1, Dst: 127.0.0.1
Transmission Control Protocol, Src Port: 50894, Dst Port: 6653, Seq: 1, Ack: 9, Len: 0

No.     Time           Source                Destination           Protocol Length Info
     43 0.476151849    127.0.0.1             127.0.0.1             OpenFlow 84     Type: OFPT_HELLO

Frame 43: 84 bytes on wire (672 bits), 84 bytes captured (672 bits) on interface any, id 0
Linux cooked capture
Internet Protocol Version 4, Src: 127.0.0.1, Dst: 127.0.0.1
Transmission Control Protocol, Src Port: 50894, Dst Port: 6653, Seq: 1, Ack: 9, Len: 16
OpenFlow 1.3

No.     Time           Source                Destination           Protocol Length Info
     44 0.476164165    127.0.0.1             127.0.0.1             TCP      68     6653 → 50894 [ACK] Seq=9 Ack=17 Win=44032 Len=0 TSval=3196124076 TSecr=3196124076

Frame 44: 68 bytes on wire (544 bits), 68 bytes captured (544 bits) on interface any, id 0
Linux cooked capture
Internet Protocol Version 4, Src: 127.0.0.1, Dst: 127.0.0.1
Transmission Control Protocol, Src Port: 6653, Dst Port: 50894, Seq: 9, Ack: 17, Len: 0

No.     Time           Source                Destination           Protocol Length Info
     45 0.477216713    127.0.0.1             127.0.0.1             OpenFlow 76     Type: OFPT_FEATURES_REQUEST

Frame 45: 76 bytes on wire (608 bits), 76 bytes captured (608 bits) on interface any, id 0
Linux cooked capture
Internet Protocol Version 4, Src: 127.0.0.1, Dst: 127.0.0.1
Transmission Control Protocol, Src Port: 6653, Dst Port: 50894, Seq: 9, Ack: 17, Len: 8
OpenFlow 1.3

No.     Time           Source                Destination           Protocol Length Info
     46 0.480947387    127.0.0.1             127.0.0.1             OpenFlow 148    Type: OFPT_PORT_STATUS

Frame 46: 148 bytes on wire (1184 bits), 148 bytes captured (1184 bits) on interface any, id 0
Linux cooked capture
Internet Protocol Version 4, Src: 127.0.0.1, Dst: 127.0.0.1
Transmission Control Protocol, Src Port: 50894, Dst Port: 6653, Seq: 17, Ack: 17, Len: 80
OpenFlow 1.3

No.     Time           Source                Destination           Protocol Length Info
     47 0.481428465    127.0.0.1             127.0.0.1             OpenFlow 100    Type: OFPT_FEATURES_REPLY

Frame 47: 100 bytes on wire (800 bits), 100 bytes captured (800 bits) on interface any, id 0
Linux cooked capture
Internet Protocol Version 4, Src: 127.0.0.1, Dst: 127.0.0.1
Transmission Control Protocol, Src Port: 50894, Dst Port: 6653, Seq: 97, Ack: 17, Len: 32
OpenFlow 1.3

No.     Time           Source                Destination           Protocol Length Info
     48 0.482496345    127.0.0.1             127.0.0.1             TCP      68     6653 → 50894 [ACK] Seq=17 Ack=129 Win=44032 Len=0 TSval=3196124082 TSecr=3196124080

Frame 48: 68 bytes on wire (544 bits), 68 bytes captured (544 bits) on interface any, id 0
Linux cooked capture
Internet Protocol Version 4, Src: 127.0.0.1, Dst: 127.0.0.1
Transmission Control Protocol, Src Port: 6653, Dst Port: 50894, Seq: 17, Ack: 129, Len: 0

No.     Time           Source                Destination           Protocol Length Info
     49 0.484538912    127.0.0.1             127.0.0.1             OpenFlow 84     Type: OFPT_MULTIPART_REQUEST, OFPMP_PORT_DESC

Frame 49: 84 bytes on wire (672 bits), 84 bytes captured (672 bits) on interface any, id 0
Linux cooked capture
Internet Protocol Version 4, Src: 127.0.0.1, Dst: 127.0.0.1
Transmission Control Protocol, Src Port: 6653, Dst Port: 50894, Seq: 17, Ack: 129, Len: 16
OpenFlow 1.3

No.     Time           Source                Destination           Protocol Length Info
     50 0.484574773    127.0.0.1             127.0.0.1             OpenFlow 148    Type: OFPT_FLOW_MOD

Frame 50: 148 bytes on wire (1184 bits), 148 bytes captured (1184 bits) on interface any, id 0
Linux cooked capture
Internet Protocol Version 4, Src: 127.0.0.1, Dst: 127.0.0.1
Transmission Control Protocol, Src Port: 6653, Dst Port: 50894, Seq: 33, Ack: 129, Len: 80
OpenFlow 1.3

No.     Time           Source                Destination           Protocol Length Info
     51 0.486002577    127.0.0.1             127.0.0.1             OpenFlow 276    Type: OFPT_MULTIPART_REPLY, OFPMP_PORT_DESC

Frame 51: 276 bytes on wire (2208 bits), 276 bytes captured (2208 bits) on interface any, id 0
Linux cooked capture
Internet Protocol Version 4, Src: 127.0.0.1, Dst: 127.0.0.1
Transmission Control Protocol, Src Port: 50894, Dst Port: 6653, Seq: 129, Ack: 113, Len: 208
OpenFlow 1.3

No.     Time           Source                Destination           Protocol Length Info
     52 0.489358057    127.0.0.1             127.0.0.1             OpenFlow 132    Type: OFPT_FLOW_MOD

Frame 52: 132 bytes on wire (1056 bits), 132 bytes captured (1056 bits) on interface any, id 0
Linux cooked capture
Internet Protocol Version 4, Src: 127.0.0.1, Dst: 127.0.0.1
Transmission Control Protocol, Src Port: 6653, Dst Port: 50894, Seq: 113, Ack: 337, Len: 64
OpenFlow 1.3

No.     Time           Source                Destination           Protocol Length Info
     53 0.494307672    ::                    ff02::1:ff00:1        ICMPv6   88     Neighbor Solicitation for fe80::200:ff:fe00:1

Frame 53: 88 bytes on wire (704 bits), 88 bytes captured (704 bits) on interface any, id 0
Linux cooked capture
Internet Protocol Version 6, Src: ::, Dst: ff02::1:ff00:1
Internet Control Message Protocol v6

No.     Time           Source                Destination           Protocol Length Info
     54 0.496942501    127.0.0.1             127.0.0.1             OpenFlow 196    Type: OFPT_PACKET_IN

Frame 54: 196 bytes on wire (1568 bits), 196 bytes captured (1568 bits) on interface any, id 0
Linux cooked capture
Internet Protocol Version 4, Src: 127.0.0.1, Dst: 127.0.0.1
Transmission Control Protocol, Src Port: 50894, Dst Port: 6653, Seq: 337, Ack: 177, Len: 128
OpenFlow 1.3

No.     Time           Source                Destination           Protocol Length Info
     55 0.503007577    127.0.0.1             127.0.0.1             OpenFlow 194    Type: OFPT_PACKET_OUT

Frame 55: 194 bytes on wire (1552 bits), 194 bytes captured (1552 bits) on interface any, id 0
Linux cooked capture
Internet Protocol Version 4, Src: 127.0.0.1, Dst: 127.0.0.1
Transmission Control Protocol, Src Port: 6653, Dst Port: 50894, Seq: 177, Ack: 465, Len: 126
OpenFlow 1.3

No.     Time           Source                Destination           Protocol Length Info
     56 0.503137423    ::                    ff02::1:ff00:1        ICMPv6   88     Neighbor Solicitation for fe80::200:ff:fe00:1

Frame 56: 88 bytes on wire (704 bits), 88 bytes captured (704 bits) on interface any, id 0
Linux cooked capture
Internet Protocol Version 6, Src: ::, Dst: ff02::1:ff00:1
Internet Control Message Protocol v6

No.     Time           Source                Destination           Protocol Length Info
     57 0.518912944    ::                    ff02::1:ff00:2        ICMPv6   88     Neighbor Solicitation for fe80::200:ff:fe00:2

Frame 57: 88 bytes on wire (704 bits), 88 bytes captured (704 bits) on interface any, id 0
Linux cooked capture
Internet Protocol Version 6, Src: ::, Dst: ff02::1:ff00:2
Internet Control Message Protocol v6

No.     Time           Source                Destination           Protocol Length Info
     58 0.519497803    127.0.0.1             127.0.0.1             OpenFlow 196    Type: OFPT_PACKET_IN

Frame 58: 196 bytes on wire (1568 bits), 196 bytes captured (1568 bits) on interface any, id 0
Linux cooked capture
Internet Protocol Version 4, Src: 127.0.0.1, Dst: 127.0.0.1
Transmission Control Protocol, Src Port: 50894, Dst Port: 6653, Seq: 465, Ack: 303, Len: 128
OpenFlow 1.3

No.     Time           Source                Destination           Protocol Length Info
     59 0.520472645    127.0.0.1             127.0.0.1             OpenFlow 194    Type: OFPT_PACKET_OUT

Frame 59: 194 bytes on wire (1552 bits), 194 bytes captured (1552 bits) on interface any, id 0
Linux cooked capture
Internet Protocol Version 4, Src: 127.0.0.1, Dst: 127.0.0.1
Transmission Control Protocol, Src Port: 6653, Dst Port: 50894, Seq: 303, Ack: 593, Len: 126
OpenFlow 1.3

No.     Time           Source                Destination           Protocol Length Info
     60 0.521568693    ::                    ff02::1:ff00:2        ICMPv6   88     Neighbor Solicitation for fe80::200:ff:fe00:2

Frame 60: 88 bytes on wire (704 bits), 88 bytes captured (704 bits) on interface any, id 0
Linux cooked capture
Internet Protocol Version 6, Src: ::, Dst: ff02::1:ff00:2
Internet Control Message Protocol v6

No.     Time           Source                Destination           Protocol Length Info
     61 0.562250549    127.0.0.1             127.0.0.1             TCP      68     50894 → 6653 [ACK] Seq=593 Ack=429 Win=44032 Len=0 TSval=3196124162 TSecr=3196124120

Frame 61: 68 bytes on wire (544 bits), 68 bytes captured (544 bits) on interface any, id 0
Linux cooked capture
Internet Protocol Version 4, Src: 127.0.0.1, Dst: 127.0.0.1
Transmission Control Protocol, Src Port: 50894, Dst Port: 6653, Seq: 593, Ack: 429, Len: 0

No.     Time           Source                Destination           Protocol Length Info
     62 0.826348452    ::                    ff02::1:ff91:97a2     ICMPv6   88     Neighbor Solicitation for fe80::74c5:e8ff:fe91:97a2

Frame 62: 88 bytes on wire (704 bits), 88 bytes captured (704 bits) on interface any, id 0
Linux cooked capture
Internet Protocol Version 6, Src: ::, Dst: ff02::1:ff91:97a2
Internet Control Message Protocol v6

No.     Time           Source                Destination           Protocol Length Info
     63 0.914394466    ::                    ff02::16              ICMPv6   92     Multicast Listener Report Message v2

Frame 63: 92 bytes on wire (736 bits), 92 bytes captured (736 bits) on interface any, id 0
Linux cooked capture
Internet Protocol Version 6, Src: ::, Dst: ff02::16
Internet Control Message Protocol v6

No.     Time           Source                Destination           Protocol Length Info
     64 1.075663837    ::                    ff02::16              ICMPv6   112    Multicast Listener Report Message v2

Frame 64: 112 bytes on wire (896 bits), 112 bytes captured (896 bits) on interface any, id 0
Linux cooked capture
Internet Protocol Version 6, Src: ::, Dst: ff02::16
Internet Control Message Protocol v6

No.     Time           Source                Destination           Protocol Length Info
     65 1.076049282    127.0.0.1             127.0.0.1             OpenFlow 220    Type: OFPT_PACKET_IN

Frame 65: 220 bytes on wire (1760 bits), 220 bytes captured (1760 bits) on interface any, id 0
Linux cooked capture
Internet Protocol Version 4, Src: 127.0.0.1, Dst: 127.0.0.1
Transmission Control Protocol, Src Port: 50894, Dst Port: 6653, Seq: 593, Ack: 429, Len: 152
OpenFlow 1.3

No.     Time           Source                Destination           Protocol Length Info
     66 1.077067678    127.0.0.1             127.0.0.1             OpenFlow 218    Type: OFPT_PACKET_OUT

Frame 66: 218 bytes on wire (1744 bits), 218 bytes captured (1744 bits) on interface any, id 0
Linux cooked capture
Internet Protocol Version 4, Src: 127.0.0.1, Dst: 127.0.0.1
Transmission Control Protocol, Src Port: 6653, Dst Port: 50894, Seq: 429, Ack: 745, Len: 150
OpenFlow 1.3

No.     Time           Source                Destination           Protocol Length Info
     67 1.077079590    127.0.0.1             127.0.0.1             TCP      68     50894 → 6653 [ACK] Seq=745 Ack=579 Win=44032 Len=0 TSval=3196124677 TSecr=3196124676

Frame 67: 68 bytes on wire (544 bits), 68 bytes captured (544 bits) on interface any, id 0
Linux cooked capture
Internet Protocol Version 4, Src: 127.0.0.1, Dst: 127.0.0.1
Transmission Control Protocol, Src Port: 50894, Dst Port: 6653, Seq: 745, Ack: 579, Len: 0

No.     Time           Source                Destination           Protocol Length Info
     68 1.077343194    ::                    ff02::16              ICMPv6   112    Multicast Listener Report Message v2

Frame 68: 112 bytes on wire (896 bits), 112 bytes captured (896 bits) on interface any, id 0
Linux cooked capture
Internet Protocol Version 6, Src: ::, Dst: ff02::16
Internet Control Message Protocol v6

No.     Time           Source                Destination           Protocol Length Info
     69 1.266847520    fe80::84f0:84ff:febf:e981 ff02::16              ICMPv6   92     Multicast Listener Report Message v2

Frame 69: 92 bytes on wire (736 bits), 92 bytes captured (736 bits) on interface any, id 0
Linux cooked capture
Internet Protocol Version 6, Src: fe80::84f0:84ff:febf:e981, Dst: ff02::16
Internet Control Message Protocol v6

No.     Time           Source                Destination           Protocol Length Info
     70 1.266875183    fe80::84f0:84ff:febf:e981 ff02::2               ICMPv6   72     Router Solicitation from 86:f0:84:bf:e9:81

Frame 70: 72 bytes on wire (576 bits), 72 bytes captured (576 bits) on interface any, id 0
Linux cooked capture
Internet Protocol Version 6, Src: fe80::84f0:84ff:febf:e981, Dst: ff02::2
Internet Control Message Protocol v6

No.     Time           Source                Destination           Protocol Length Info
     71 1.267784260    127.0.0.1             127.0.0.53            DNS      89     Standard query 0x50f0 A daisy.ubuntu.com OPT

Frame 71: 89 bytes on wire (712 bits), 89 bytes captured (712 bits) on interface any, id 0
Linux cooked capture
Internet Protocol Version 4, Src: 127.0.0.1, Dst: 127.0.0.53
User Datagram Protocol, Src Port: 41330, Dst Port: 53
Domain Name System (query)

No.     Time           Source                Destination           Protocol Length Info
     72 1.267804097    127.0.0.1             127.0.0.53            DNS      89     Standard query 0xd00b AAAA daisy.ubuntu.com OPT

Frame 72: 89 bytes on wire (712 bits), 89 bytes captured (712 bits) on interface any, id 0
Linux cooked capture
Internet Protocol Version 4, Src: 127.0.0.1, Dst: 127.0.0.53
User Datagram Protocol, Src Port: 41330, Dst Port: 53
Domain Name System (query)

No.     Time           Source                Destination           Protocol Length Info
     73 1.267924780    127.0.0.53            127.0.0.1             DNS      121    Standard query response 0x50f0 A daisy.ubuntu.com A 162.213.35.24 A 162.213.35.25 OPT

Frame 73: 121 bytes on wire (968 bits), 121 bytes captured (968 bits) on interface any, id 0
Linux cooked capture
Internet Protocol Version 4, Src: 127.0.0.53, Dst: 127.0.0.1
User Datagram Protocol, Src Port: 53, Dst Port: 41330
Domain Name System (response)

No.     Time           Source                Destination           Protocol Length Info
     74 1.268024640    10.0.2.15             10.101.1.10           DNS      89     Standard query 0xa863 AAAA daisy.ubuntu.com OPT

Frame 74: 89 bytes on wire (712 bits), 89 bytes captured (712 bits) on interface any, id 0
Linux cooked capture
Internet Protocol Version 4, Src: 10.0.2.15, Dst: 10.101.1.10
User Datagram Protocol, Src Port: 46019, Dst Port: 53
Domain Name System (query)

No.     Time           Source                Destination           Protocol Length Info
     75 1.270906317    10.101.1.10           10.0.2.15             DNS      150    Standard query response 0xa863 AAAA daisy.ubuntu.com SOA ns1.canonical.com OPT

Frame 75: 150 bytes on wire (1200 bits), 150 bytes captured (1200 bits) on interface any, id 0
Linux cooked capture
Internet Protocol Version 4, Src: 10.101.1.10, Dst: 10.0.2.15
User Datagram Protocol, Src Port: 53, Dst Port: 46019
Domain Name System (response)

No.     Time           Source                Destination           Protocol Length Info
     76 1.271416183    127.0.0.53            127.0.0.1             DNS      89     Standard query response 0xd00b AAAA daisy.ubuntu.com OPT

Frame 76: 89 bytes on wire (712 bits), 89 bytes captured (712 bits) on interface any, id 0
Linux cooked capture
Internet Protocol Version 4, Src: 127.0.0.53, Dst: 127.0.0.1
User Datagram Protocol, Src Port: 53, Dst Port: 41330
Domain Name System (response)

No.     Time           Source                Destination           Protocol Length Info
     77 1.279565260    fe80::84f0:84ff:febf:e981 ff02::16              ICMPv6   112    Multicast Listener Report Message v2

Frame 77: 112 bytes on wire (896 bits), 112 bytes captured (896 bits) on interface any, id 0
Linux cooked capture
Internet Protocol Version 6, Src: fe80::84f0:84ff:febf:e981, Dst: ff02::16
Internet Control Message Protocol v6

No.     Time           Source                Destination           Protocol Length Info
     78 1.360029923    fe80::84f0:84ff:febf:e981 ff02::fb              MDNS     212    Standard query 0x0000 ANY 1.8.9.e.f.b.e.f.f.f.4.8.0.f.4.8.0.0.0.0.0.0.0.0.0.0.0.0.0.8.e.f.ip6.arpa, "QM" question ANY test.local, "QM" question AAAA fe80::84f0:84ff:febf:e981 PTR test.local

Frame 78: 212 bytes on wire (1696 bits), 212 bytes captured (1696 bits) on interface any, id 0
Linux cooked capture
Internet Protocol Version 6, Src: fe80::84f0:84ff:febf:e981, Dst: ff02::fb
User Datagram Protocol, Src Port: 5353, Dst Port: 5353
Multicast Domain Name System (query)

No.     Time           Source                Destination           Protocol Length Info
     79 1.368905896    fe80::84f0:84ff:febf:e981 ff02::fb              MDNS     205    Standard query 0x0000 PTR _nfs._tcp.local, "QM" question PTR _ipp._tcp.local, "QM" question PTR _ipps._tcp.local, "QM" question PTR _ftp._tcp.local, "QM" question PTR _webdav._tcp.local, "QM" question PTR _webdavs._tcp.local, "QM" question PTR _sftp-ssh._tcp.local, "QM" question PTR _smb._tcp.local, "QM" question PTR _afpovertcp._tcp.local, "QM" question

Frame 79: 205 bytes on wire (1640 bits), 205 bytes captured (1640 bits) on interface any, id 0
Linux cooked capture
Internet Protocol Version 6, Src: fe80::84f0:84ff:febf:e981, Dst: ff02::fb
User Datagram Protocol, Src Port: 5353, Dst Port: 5353
Multicast Domain Name System (query)

No.     Time           Source                Destination           Protocol Length Info
     80 1.522465482    fe80::200:ff:fe00:2   ff02::16              ICMPv6   92     Multicast Listener Report Message v2

Frame 80: 92 bytes on wire (736 bits), 92 bytes captured (736 bits) on interface any, id 0
Linux cooked capture
Internet Protocol Version 6, Src: fe80::200:ff:fe00:2, Dst: ff02::16
Internet Control Message Protocol v6

No.     Time           Source                Destination           Protocol Length Info
     81 1.522593231    fe80::200:ff:fe00:2   ff02::2               ICMPv6   72     Router Solicitation from 00:00:00:00:00:02

Frame 81: 72 bytes on wire (576 bits), 72 bytes captured (576 bits) on interface any, id 0
Linux cooked capture
Internet Protocol Version 6, Src: fe80::200:ff:fe00:2, Dst: ff02::2
Internet Control Message Protocol v6

No.     Time           Source                Destination           Protocol Length Info
     82 1.522814431    127.0.0.1             127.0.0.1             OpenFlow 200    Type: OFPT_PACKET_IN

Frame 82: 200 bytes on wire (1600 bits), 200 bytes captured (1600 bits) on interface any, id 0
Linux cooked capture
Internet Protocol Version 4, Src: 127.0.0.1, Dst: 127.0.0.1
Transmission Control Protocol, Src Port: 50894, Dst Port: 6653, Seq: 745, Ack: 579, Len: 132
OpenFlow 1.3

No.     Time           Source                Destination           Protocol Length Info
     83 1.522853823    127.0.0.1             127.0.0.1             OpenFlow 180    Type: OFPT_PACKET_IN

Frame 83: 180 bytes on wire (1440 bits), 180 bytes captured (1440 bits) on interface any, id 0
Linux cooked capture
Internet Protocol Version 4, Src: 127.0.0.1, Dst: 127.0.0.1
Transmission Control Protocol, Src Port: 50894, Dst Port: 6653, Seq: 877, Ack: 579, Len: 112
OpenFlow 1.3

